

================================================================
== Vitis HLS Report for 'activation_accelerator_Pipeline_VITIS_LOOP_197_3'
================================================================
* Date:           Sun Oct 12 10:45:49 2025

* Version:        2022.2 (Build 3670227 on Oct 13 2022)
* Project:        activation_accelerator
* Solution:       baseline (Vivado IP Flow Target)
* Product family: zynquplus
* Target device:  xck26-sfvc784-2LV-c


================================================================
== Performance Estimates
================================================================
+ Timing: 
    * Summary: 
    +--------+----------+----------+------------+
    |  Clock |  Target  | Estimated| Uncertainty|
    +--------+----------+----------+------------+
    |ap_clk  |  10.00 ns|  7.057 ns|     2.70 ns|
    +--------+----------+----------+------------+

+ Latency: 
    * Summary: 
    +---------+---------+----------+----------+-------+-------+---------+
    |  Latency (cycles) |  Latency (absolute) |    Interval   | Pipeline|
    |   min   |   max   |    min   |    max   |  min  |  max  |   Type  |
    +---------+---------+----------+----------+-------+-------+---------+
    |    32784|    32784|  0.328 ms|  0.328 ms|  32784|  32784|       no|
    +---------+---------+----------+----------+-------+-------+---------+

    + Detail: 
        * Instance: 
        N/A

        * Loop: 
        +--------------------+---------+---------+----------+-----------+-----------+-------+----------+
        |                    |  Latency (cycles) | Iteration|  Initiation Interval  |  Trip |          |
        |      Loop Name     |   min   |   max   |  Latency |  achieved |   target  | Count | Pipelined|
        +--------------------+---------+---------+----------+-----------+-----------+-------+----------+
        |- VITIS_LOOP_197_3  |    32782|    32782|        16|          1|          1|  32768|       yes|
        +--------------------+---------+---------+----------+-----------+-----------+-------+----------+

============================================================
+ Verbose Summary: Synthesis Manager
============================================================
InlineROM: 1
ExposeGlobal: 0
============================================================
+ Verbose Summary: CDFG Model
============================================================
IsTopModel: 0
ResetActiveHigh: 1
IsCombinational: 0
IsDatapathOnly: 0
HasWiredReturn: 1
HasMFsm: 2
HasVarLatency: 1
IsPipeline: 0
IsRtlPipelined: 0
IsInstanceOverlapped: 0
IsDontTouch: 0
HasImplIP: 0
IsGatedGlobalClock: 0

+ Individual pipeline summary: 
  * Pipeline-0: initiation interval (II) = 1, depth = 16


============================================================
+ Verbose Summary: Schedule
============================================================
* Number of FSM states : 16
* Pipeline : 1
  Pipeline-0 : II = 1, D = 16, States = { 1 2 3 4 5 6 7 8 9 10 11 12 13 14 15 16 }
* Dataflow Pipeline: 0

* FSM state transitions: 
1 --> 2 
2 --> 3 
3 --> 4 
4 --> 5 
5 --> 6 
6 --> 7 
7 --> 8 
8 --> 9 
9 --> 10 
10 --> 11 
11 --> 12 
12 --> 13 
13 --> 14 
14 --> 15 
15 --> 16 
16 --> 

* FSM state operations: 

State 1 <SV = 0> <Delay = 1.52>
ST_1 : Operation 19 [1/1] (0.00ns)   --->   "%i = alloca i32 1"   --->   Operation 19 'alloca' 'i' <Predicate = true> <Delay = 0.00>
ST_1 : Operation 20 [1/1] (0.00ns)   --->   "%stddev_read = read i32 @_ssdm_op_Read.ap_auto.float, i32 %stddev"   --->   Operation 20 'read' 'stddev_read' <Predicate = true> <Delay = 0.00>
ST_1 : Operation 21 [1/1] (0.00ns)   --->   "%mean_read = read i32 @_ssdm_op_Read.ap_auto.float, i32 %mean"   --->   Operation 21 'read' 'mean_read' <Predicate = true> <Delay = 0.00>
ST_1 : Operation 22 [1/1] (0.42ns)   --->   "%store_ln0 = store i16 0, i16 %i"   --->   Operation 22 'store' 'store_ln0' <Predicate = true> <Delay = 0.42>
ST_1 : Operation 23 [1/1] (0.00ns)   --->   "%br_ln0 = br void %for.inc27.i"   --->   Operation 23 'br' 'br_ln0' <Predicate = true> <Delay = 0.00>
ST_1 : Operation 24 [1/1] (0.00ns)   --->   "%i_12 = load i16 %i" [activation_accelerator.cpp:197]   --->   Operation 24 'load' 'i_12' <Predicate = true> <Delay = 0.00>
ST_1 : Operation 25 [1/1] (0.00ns)   --->   "%specpipeline_ln0 = specpipeline void @_ssdm_op_SpecPipeline, i32 4294967295, i32 0, i32 1, i32 0, void @p_str"   --->   Operation 25 'specpipeline' 'specpipeline_ln0' <Predicate = true> <Delay = 0.00>
ST_1 : Operation 26 [1/1] (1.10ns)   --->   "%icmp_ln197 = icmp_eq  i16 %i_12, i16 32768" [activation_accelerator.cpp:197]   --->   Operation 26 'icmp' 'icmp_ln197' <Predicate = true> <Delay = 1.10> <CoreInst = "Cmp">   --->   Core 9 'Cmp' <Latency = 0> <II = 1> <Delay = 1.10> <FuncUnit> <Opcode : 'icmp'> <InPorts = 2> <OutPorts = 1>
ST_1 : Operation 27 [1/1] (0.00ns)   --->   "%empty = speclooptripcount i32 @_ssdm_op_SpecLoopTripCount, i64 32768, i64 32768, i64 32768"   --->   Operation 27 'speclooptripcount' 'empty' <Predicate = true> <Delay = 0.00>
ST_1 : Operation 28 [1/1] (0.85ns)   --->   "%add_ln197 = add i16 %i_12, i16 1" [activation_accelerator.cpp:197]   --->   Operation 28 'add' 'add_ln197' <Predicate = true> <Delay = 0.85> <CoreInst = "Adder">   --->   Core 1 'Adder' <Latency = 0> <II = 1> <Delay = 0.85> <FuncUnit> <Opcode : 'add' 'sub'> <InPorts = 2> <OutPorts = 1>
ST_1 : Operation 29 [1/1] (0.00ns)   --->   "%br_ln197 = br i1 %icmp_ln197, void %for.inc27.i.split, void %if.end68.loopexit.exitStub" [activation_accelerator.cpp:197]   --->   Operation 29 'br' 'br_ln197' <Predicate = true> <Delay = 0.00>
ST_1 : Operation 30 [1/1] (0.00ns)   --->   "%i_24_cast = zext i16 %i_12" [activation_accelerator.cpp:197]   --->   Operation 30 'zext' 'i_24_cast' <Predicate = (!icmp_ln197)> <Delay = 0.00>
ST_1 : Operation 31 [1/1] (0.00ns)   --->   "%x_addr = getelementptr i32 %x, i64 0, i64 %i_24_cast" [activation_accelerator.cpp:198]   --->   Operation 31 'getelementptr' 'x_addr' <Predicate = (!icmp_ln197)> <Delay = 0.00>
ST_1 : Operation 32 [2/2] (1.23ns)   --->   "%x_load = load i15 %x_addr" [activation_accelerator.cpp:198]   --->   Operation 32 'load' 'x_load' <Predicate = (!icmp_ln197)> <Delay = 1.23> <CoreInst = "RAM">   --->   Core 83 'RAM' <Latency = 1> <II = 1> <Delay = 1.23> <Storage> <Opcode : 'load' 'store'> <Ports = 2> <Width = 32> <Depth = 32768> <RAM>
ST_1 : Operation 33 [1/1] (0.42ns)   --->   "%store_ln197 = store i16 %add_ln197, i16 %i" [activation_accelerator.cpp:197]   --->   Operation 33 'store' 'store_ln197' <Predicate = (!icmp_ln197)> <Delay = 0.42>

State 2 <SV = 1> <Delay = 1.23>
ST_2 : Operation 34 [1/2] (1.23ns)   --->   "%x_load = load i15 %x_addr" [activation_accelerator.cpp:198]   --->   Operation 34 'load' 'x_load' <Predicate = true> <Delay = 1.23> <CoreInst = "RAM">   --->   Core 83 'RAM' <Latency = 1> <II = 1> <Delay = 1.23> <Storage> <Opcode : 'load' 'store'> <Ports = 2> <Width = 32> <Depth = 32768> <RAM>

State 3 <SV = 2> <Delay = 6.43>
ST_3 : Operation 35 [4/4] (6.43ns)   --->   "%sub22_i = fsub i32 %x_load, i32 %mean_read" [activation_accelerator.cpp:198]   --->   Operation 35 'fsub' 'sub22_i' <Predicate = true> <Delay = 6.43> <CoreInst = "FAddSub_fulldsp">   --->   Core 18 'FAddSub_fulldsp' <Latency = 3> <II = 1> <Delay = 6.43> <FuncUnit> <Opcode : 'fadd' 'fsub'> <InPorts = 2> <OutPorts = 1>

State 4 <SV = 3> <Delay = 6.43>
ST_4 : Operation 36 [3/4] (6.43ns)   --->   "%sub22_i = fsub i32 %x_load, i32 %mean_read" [activation_accelerator.cpp:198]   --->   Operation 36 'fsub' 'sub22_i' <Predicate = true> <Delay = 6.43> <CoreInst = "FAddSub_fulldsp">   --->   Core 18 'FAddSub_fulldsp' <Latency = 3> <II = 1> <Delay = 6.43> <FuncUnit> <Opcode : 'fadd' 'fsub'> <InPorts = 2> <OutPorts = 1>

State 5 <SV = 4> <Delay = 6.43>
ST_5 : Operation 37 [2/4] (6.43ns)   --->   "%sub22_i = fsub i32 %x_load, i32 %mean_read" [activation_accelerator.cpp:198]   --->   Operation 37 'fsub' 'sub22_i' <Predicate = true> <Delay = 6.43> <CoreInst = "FAddSub_fulldsp">   --->   Core 18 'FAddSub_fulldsp' <Latency = 3> <II = 1> <Delay = 6.43> <FuncUnit> <Opcode : 'fadd' 'fsub'> <InPorts = 2> <OutPorts = 1>

State 6 <SV = 5> <Delay = 6.43>
ST_6 : Operation 38 [1/4] (6.43ns)   --->   "%sub22_i = fsub i32 %x_load, i32 %mean_read" [activation_accelerator.cpp:198]   --->   Operation 38 'fsub' 'sub22_i' <Predicate = true> <Delay = 6.43> <CoreInst = "FAddSub_fulldsp">   --->   Core 18 'FAddSub_fulldsp' <Latency = 3> <II = 1> <Delay = 6.43> <FuncUnit> <Opcode : 'fadd' 'fsub'> <InPorts = 2> <OutPorts = 1>

State 7 <SV = 6> <Delay = 7.05>
ST_7 : Operation 39 [9/9] (7.05ns)   --->   "%y = fdiv i32 %sub22_i, i32 %stddev_read" [activation_accelerator.cpp:198]   --->   Operation 39 'fdiv' 'y' <Predicate = true> <Delay = 7.05> <CoreInst = "FDiv">   --->   Core 20 'FDiv' <Latency = 8> <II = 1> <Delay = 7.05> <FuncUnit> <Opcode : 'fdiv' 'frem'> <InPorts = 2> <OutPorts = 1>

State 8 <SV = 7> <Delay = 7.05>
ST_8 : Operation 40 [8/9] (7.05ns)   --->   "%y = fdiv i32 %sub22_i, i32 %stddev_read" [activation_accelerator.cpp:198]   --->   Operation 40 'fdiv' 'y' <Predicate = true> <Delay = 7.05> <CoreInst = "FDiv">   --->   Core 20 'FDiv' <Latency = 8> <II = 1> <Delay = 7.05> <FuncUnit> <Opcode : 'fdiv' 'frem'> <InPorts = 2> <OutPorts = 1>

State 9 <SV = 8> <Delay = 7.05>
ST_9 : Operation 41 [7/9] (7.05ns)   --->   "%y = fdiv i32 %sub22_i, i32 %stddev_read" [activation_accelerator.cpp:198]   --->   Operation 41 'fdiv' 'y' <Predicate = true> <Delay = 7.05> <CoreInst = "FDiv">   --->   Core 20 'FDiv' <Latency = 8> <II = 1> <Delay = 7.05> <FuncUnit> <Opcode : 'fdiv' 'frem'> <InPorts = 2> <OutPorts = 1>

State 10 <SV = 9> <Delay = 7.05>
ST_10 : Operation 42 [6/9] (7.05ns)   --->   "%y = fdiv i32 %sub22_i, i32 %stddev_read" [activation_accelerator.cpp:198]   --->   Operation 42 'fdiv' 'y' <Predicate = true> <Delay = 7.05> <CoreInst = "FDiv">   --->   Core 20 'FDiv' <Latency = 8> <II = 1> <Delay = 7.05> <FuncUnit> <Opcode : 'fdiv' 'frem'> <InPorts = 2> <OutPorts = 1>

State 11 <SV = 10> <Delay = 7.05>
ST_11 : Operation 43 [5/9] (7.05ns)   --->   "%y = fdiv i32 %sub22_i, i32 %stddev_read" [activation_accelerator.cpp:198]   --->   Operation 43 'fdiv' 'y' <Predicate = true> <Delay = 7.05> <CoreInst = "FDiv">   --->   Core 20 'FDiv' <Latency = 8> <II = 1> <Delay = 7.05> <FuncUnit> <Opcode : 'fdiv' 'frem'> <InPorts = 2> <OutPorts = 1>

State 12 <SV = 11> <Delay = 7.05>
ST_12 : Operation 44 [4/9] (7.05ns)   --->   "%y = fdiv i32 %sub22_i, i32 %stddev_read" [activation_accelerator.cpp:198]   --->   Operation 44 'fdiv' 'y' <Predicate = true> <Delay = 7.05> <CoreInst = "FDiv">   --->   Core 20 'FDiv' <Latency = 8> <II = 1> <Delay = 7.05> <FuncUnit> <Opcode : 'fdiv' 'frem'> <InPorts = 2> <OutPorts = 1>

State 13 <SV = 12> <Delay = 7.05>
ST_13 : Operation 45 [3/9] (7.05ns)   --->   "%y = fdiv i32 %sub22_i, i32 %stddev_read" [activation_accelerator.cpp:198]   --->   Operation 45 'fdiv' 'y' <Predicate = true> <Delay = 7.05> <CoreInst = "FDiv">   --->   Core 20 'FDiv' <Latency = 8> <II = 1> <Delay = 7.05> <FuncUnit> <Opcode : 'fdiv' 'frem'> <InPorts = 2> <OutPorts = 1>

State 14 <SV = 13> <Delay = 7.05>
ST_14 : Operation 46 [2/9] (7.05ns)   --->   "%y = fdiv i32 %sub22_i, i32 %stddev_read" [activation_accelerator.cpp:198]   --->   Operation 46 'fdiv' 'y' <Predicate = true> <Delay = 7.05> <CoreInst = "FDiv">   --->   Core 20 'FDiv' <Latency = 8> <II = 1> <Delay = 7.05> <FuncUnit> <Opcode : 'fdiv' 'frem'> <InPorts = 2> <OutPorts = 1>

State 15 <SV = 14> <Delay = 7.05>
ST_15 : Operation 47 [1/9] (7.05ns)   --->   "%y = fdiv i32 %sub22_i, i32 %stddev_read" [activation_accelerator.cpp:198]   --->   Operation 47 'fdiv' 'y' <Predicate = true> <Delay = 7.05> <CoreInst = "FDiv">   --->   Core 20 'FDiv' <Latency = 8> <II = 1> <Delay = 7.05> <FuncUnit> <Opcode : 'fdiv' 'frem'> <InPorts = 2> <OutPorts = 1>
ST_15 : Operation 48 [1/1] (0.00ns)   --->   "%bitcast_ln200 = bitcast i32 %y" [activation_accelerator.cpp:200]   --->   Operation 48 'bitcast' 'bitcast_ln200' <Predicate = true> <Delay = 0.00>
ST_15 : Operation 49 [1/1] (0.00ns)   --->   "%trunc_ln = partselect i16 @_ssdm_op_PartSelect.i16.i32.i32.i32, i32 %bitcast_ln200, i32 16, i32 31" [activation_accelerator.cpp:200]   --->   Operation 49 'partselect' 'trunc_ln' <Predicate = true> <Delay = 0.00>
ST_15 : Operation 54 [1/1] (0.00ns)   --->   "%ret_ln0 = ret"   --->   Operation 54 'ret' 'ret_ln0' <Predicate = (icmp_ln197)> <Delay = 0.00>

State 16 <SV = 15> <Delay = 1.23>
ST_16 : Operation 50 [1/1] (0.00ns)   --->   "%specloopname_ln197 = specloopname void @_ssdm_op_SpecLoopName, void @empty_31" [activation_accelerator.cpp:197]   --->   Operation 50 'specloopname' 'specloopname_ln197' <Predicate = true> <Delay = 0.00>
ST_16 : Operation 51 [1/1] (0.00ns)   --->   "%buf2_addr = getelementptr i16 %buf2, i64 0, i64 %i_24_cast" [activation_accelerator.cpp:200]   --->   Operation 51 'getelementptr' 'buf2_addr' <Predicate = true> <Delay = 0.00>
ST_16 : Operation 52 [1/1] (1.23ns)   --->   "%store_ln200 = store i16 %trunc_ln, i15 %buf2_addr" [activation_accelerator.cpp:200]   --->   Operation 52 'store' 'store_ln200' <Predicate = true> <Delay = 1.23> <CoreInst = "RAM">   --->   Core 83 'RAM' <Latency = 1> <II = 1> <Delay = 1.23> <Storage> <Opcode : 'load' 'store'> <Ports = 2> <Width = 16> <Depth = 32768> <RAM>
ST_16 : Operation 53 [1/1] (0.00ns)   --->   "%br_ln197 = br void %for.inc27.i" [activation_accelerator.cpp:197]   --->   Operation 53 'br' 'br_ln197' <Predicate = true> <Delay = 0.00>


============================================================
+ Verbose Summary: Timing violations
============================================================
Target clock period: 10ns, clock uncertainty: 2.7ns.

 <State 1>: 1.53ns
The critical path consists of the following:
	'alloca' operation ('i') [5]  (0 ns)
	'load' operation ('i', activation_accelerator.cpp:197) on local variable 'i' [11]  (0 ns)
	'add' operation ('add_ln197', activation_accelerator.cpp:197) [15]  (0.853 ns)
	'store' operation ('store_ln197', activation_accelerator.cpp:197) of variable 'add_ln197', activation_accelerator.cpp:197 on local variable 'i' [28]  (0.427 ns)
	blocking operation 0.249 ns on control path)

 <State 2>: 1.24ns
The critical path consists of the following:
	'load' operation ('x_load', activation_accelerator.cpp:198) on array 'x' [21]  (1.24 ns)

 <State 3>: 6.44ns
The critical path consists of the following:
	'fsub' operation ('sub22_i', activation_accelerator.cpp:198) [22]  (6.44 ns)

 <State 4>: 6.44ns
The critical path consists of the following:
	'fsub' operation ('sub22_i', activation_accelerator.cpp:198) [22]  (6.44 ns)

 <State 5>: 6.44ns
The critical path consists of the following:
	'fsub' operation ('sub22_i', activation_accelerator.cpp:198) [22]  (6.44 ns)

 <State 6>: 6.44ns
The critical path consists of the following:
	'fsub' operation ('sub22_i', activation_accelerator.cpp:198) [22]  (6.44 ns)

 <State 7>: 7.06ns
The critical path consists of the following:
	'fdiv' operation ('y', activation_accelerator.cpp:198) [23]  (7.06 ns)

 <State 8>: 7.06ns
The critical path consists of the following:
	'fdiv' operation ('y', activation_accelerator.cpp:198) [23]  (7.06 ns)

 <State 9>: 7.06ns
The critical path consists of the following:
	'fdiv' operation ('y', activation_accelerator.cpp:198) [23]  (7.06 ns)

 <State 10>: 7.06ns
The critical path consists of the following:
	'fdiv' operation ('y', activation_accelerator.cpp:198) [23]  (7.06 ns)

 <State 11>: 7.06ns
The critical path consists of the following:
	'fdiv' operation ('y', activation_accelerator.cpp:198) [23]  (7.06 ns)

 <State 12>: 7.06ns
The critical path consists of the following:
	'fdiv' operation ('y', activation_accelerator.cpp:198) [23]  (7.06 ns)

 <State 13>: 7.06ns
The critical path consists of the following:
	'fdiv' operation ('y', activation_accelerator.cpp:198) [23]  (7.06 ns)

 <State 14>: 7.06ns
The critical path consists of the following:
	'fdiv' operation ('y', activation_accelerator.cpp:198) [23]  (7.06 ns)

 <State 15>: 7.06ns
The critical path consists of the following:
	'fdiv' operation ('y', activation_accelerator.cpp:198) [23]  (7.06 ns)

 <State 16>: 1.24ns
The critical path consists of the following:
	'getelementptr' operation ('buf2_addr', activation_accelerator.cpp:200) [26]  (0 ns)
	'store' operation ('store_ln200', activation_accelerator.cpp:200) of variable 'trunc_ln', activation_accelerator.cpp:200 on array 'buf2' [27]  (1.24 ns)


============================================================
+ Verbose Summary: Binding
============================================================
N/A
* FSMD analyzer results:
  - Output states:
 - Input state : 
  - Chain level:
	State 1
	State 2
	State 3
	State 4
	State 5
	State 6
	State 7
	State 8
	State 9
	State 10
	State 11
	State 12
	State 13
	State 14
	State 15
	State 16


============================================================
+ Verbose Summary: Datapath Resource usage 
============================================================
N/A
