

================================================================
== Vitis HLS Report for 'activation_accelerator_Pipeline_loop_24'
================================================================
* Date:           Wed Oct  8 15:53:26 2025

* Version:        2022.2 (Build 3670227 on Oct 13 2022)
* Project:        activation_accelerator
* Solution:       baseline (Vivado IP Flow Target)
* Product family: zynquplus
* Target device:  xck26-sfvc784-2LV-c


================================================================
== Performance Estimates
================================================================
+ Timing: 
    * Summary: 
    +--------+----------+----------+------------+
    |  Clock |  Target  | Estimated| Uncertainty|
    +--------+----------+----------+------------+
    |ap_clk  |  10.00 ns|  7.300 ns|     2.70 ns|
    +--------+----------+----------+------------+

+ Latency: 
    * Summary: 
    +---------+---------+-----------+-----------+------+------+---------+
    |  Latency (cycles) |   Latency (absolute)  |   Interval  | Pipeline|
    |   min   |   max   |    min    |    max    |  min |  max |   Type  |
    +---------+---------+-----------+-----------+------+------+---------+
    |     1027|     1027|  10.270 us|  10.270 us|  1027|  1027|       no|
    +---------+---------+-----------+-----------+------+------+---------+

    + Detail: 
        * Instance: 
        N/A

        * Loop: 
        +-----------+---------+---------+----------+-----------+-----------+------+----------+
        |           |  Latency (cycles) | Iteration|  Initiation Interval  | Trip |          |
        | Loop Name |   min   |   max   |  Latency |  achieved |   target  | Count| Pipelined|
        +-----------+---------+---------+----------+-----------+-----------+------+----------+
        |- loop_24  |     1025|     1025|         3|          1|          1|  1024|       yes|
        +-----------+---------+---------+----------+-----------+-----------+------+----------+

============================================================
+ Verbose Summary: Synthesis Manager
============================================================
InlineROM: 1
ExposeGlobal: 0
============================================================
+ Verbose Summary: CDFG Model
============================================================
IsTopModel: 0
ResetActiveHigh: 1
IsCombinational: 0
IsDatapathOnly: 0
HasWiredReturn: 1
HasMFsm: 2
HasVarLatency: 1
IsPipeline: 0
IsRtlPipelined: 0
IsInstanceOverlapped: 0
IsDontTouch: 0
HasImplIP: 0
IsGatedGlobalClock: 0

+ Individual pipeline summary: 
  * Pipeline-0: initiation interval (II) = 1, depth = 3


============================================================
+ Verbose Summary: Schedule
============================================================
* Number of FSM states : 3
* Pipeline : 1
  Pipeline-0 : II = 1, D = 3, States = { 1 2 3 }
* Dataflow Pipeline: 0

* FSM state transitions: 
1 --> 2 
2 --> 3 
3 --> 

* FSM state operations: 

State 1 <SV = 0> <Delay = 1.37>
ST_1 : Operation 6 [1/1] (0.00ns)   --->   "%i_12 = alloca i32 1"   --->   Operation 6 'alloca' 'i_12' <Predicate = true> <Delay = 0.00>
ST_1 : Operation 7 [1/1] (0.00ns)   --->   "%sext_ln494_read = read i63 @_ssdm_op_Read.ap_auto.i63, i63 %sext_ln494"   --->   Operation 7 'read' 'sext_ln494_read' <Predicate = true> <Delay = 0.00>
ST_1 : Operation 8 [1/1] (0.00ns)   --->   "%sext_ln494_cast = sext i63 %sext_ln494_read"   --->   Operation 8 'sext' 'sext_ln494_cast' <Predicate = true> <Delay = 0.00>
ST_1 : Operation 9 [1/1] (0.00ns)   --->   "%specinterface_ln0 = specinterface void @_ssdm_op_SpecInterface, i16 %gmem1, void @empty_19, i32 0, i32 0, void @empty_1, i32 0, i32 32768, void @empty_34, void @empty_26, void @empty_1, i32 16, i32 16, i32 16, i32 16, void @empty_1, void @empty_1, i32 4294967295, i32 0"   --->   Operation 9 'specinterface' 'specinterface_ln0' <Predicate = true> <Delay = 0.00>
ST_1 : Operation 10 [1/1] (0.42ns)   --->   "%store_ln0 = store i11 0, i11 %i_12"   --->   Operation 10 'store' 'store_ln0' <Predicate = true> <Delay = 0.42>
ST_1 : Operation 11 [1/1] (0.00ns)   --->   "%br_ln0 = br void %for.inc13"   --->   Operation 11 'br' 'br_ln0' <Predicate = true> <Delay = 0.00>
ST_1 : Operation 12 [1/1] (0.00ns)   --->   "%i = load i11 %i_12" [activation_accelerator.cpp:495]   --->   Operation 12 'load' 'i' <Predicate = true> <Delay = 0.00>
ST_1 : Operation 13 [1/1] (0.00ns)   --->   "%specbitsmap_ln0 = specbitsmap void @_ssdm_op_SpecBitsMap, i16 %gmem1"   --->   Operation 13 'specbitsmap' 'specbitsmap_ln0' <Predicate = true> <Delay = 0.00>
ST_1 : Operation 14 [1/1] (0.00ns)   --->   "%gmem1_addr = getelementptr i16 %gmem1, i64 %sext_ln494_cast" [activation_accelerator.cpp:494]   --->   Operation 14 'getelementptr' 'gmem1_addr' <Predicate = true> <Delay = 0.00>
ST_1 : Operation 15 [1/1] (0.00ns)   --->   "%specpipeline_ln0 = specpipeline void @_ssdm_op_SpecPipeline, i32 4294967295, i32 0, i32 1, i32 0, void @p_str"   --->   Operation 15 'specpipeline' 'specpipeline_ln0' <Predicate = true> <Delay = 0.00>
ST_1 : Operation 16 [1/1] (0.94ns)   --->   "%icmp_ln494 = icmp_eq  i11 %i, i11 1024" [activation_accelerator.cpp:494]   --->   Operation 16 'icmp' 'icmp_ln494' <Predicate = true> <Delay = 0.94> <CoreInst = "Cmp">   --->   Core 9 'Cmp' <Latency = 0> <II = 1> <Delay = 0.94> <FuncUnit> <Opcode : 'icmp'> <InPorts = 2> <OutPorts = 1>
ST_1 : Operation 17 [1/1] (0.00ns)   --->   "%empty = speclooptripcount i32 @_ssdm_op_SpecLoopTripCount, i64 1024, i64 1024, i64 1024"   --->   Operation 17 'speclooptripcount' 'empty' <Predicate = true> <Delay = 0.00>
ST_1 : Operation 18 [1/1] (0.79ns)   --->   "%add_ln494 = add i11 %i, i11 1" [activation_accelerator.cpp:494]   --->   Operation 18 'add' 'add_ln494' <Predicate = true> <Delay = 0.79> <CoreInst = "Adder">   --->   Core 1 'Adder' <Latency = 0> <II = 1> <Delay = 0.79> <FuncUnit> <Opcode : 'add' 'sub'> <InPorts = 2> <OutPorts = 1>
ST_1 : Operation 19 [1/1] (0.00ns)   --->   "%br_ln494 = br i1 %icmp_ln494, void %for.inc13.split, void %if.end90.loopexit.exitStub" [activation_accelerator.cpp:494]   --->   Operation 19 'br' 'br_ln494' <Predicate = true> <Delay = 0.00>
ST_1 : Operation 20 [1/1] (0.00ns)   --->   "%lshr_ln4 = partselect i7 @_ssdm_op_PartSelect.i7.i11.i32.i32, i11 %i, i32 3, i32 9" [activation_accelerator.cpp:495]   --->   Operation 20 'partselect' 'lshr_ln4' <Predicate = (!icmp_ln494)> <Delay = 0.00>
ST_1 : Operation 21 [1/1] (0.00ns)   --->   "%trunc_ln495 = trunc i11 %i" [activation_accelerator.cpp:495]   --->   Operation 21 'trunc' 'trunc_ln495' <Predicate = (!icmp_ln494)> <Delay = 0.00>
ST_1 : Operation 22 [1/1] (0.44ns)   --->   "%switch_ln495 = switch i3 %trunc_ln495, void %arrayidx12.case.7, i3 0, void %arrayidx12.case.0, i3 1, void %arrayidx12.case.1, i3 2, void %arrayidx12.case.2, i3 3, void %arrayidx12.case.3, i3 4, void %arrayidx12.case.4, i3 5, void %arrayidx12.case.5, i3 6, void %arrayidx12.case.6" [activation_accelerator.cpp:495]   --->   Operation 22 'switch' 'switch_ln495' <Predicate = (!icmp_ln494)> <Delay = 0.44>
ST_1 : Operation 23 [1/1] (0.42ns)   --->   "%store_ln494 = store i11 %add_ln494, i11 %i_12" [activation_accelerator.cpp:494]   --->   Operation 23 'store' 'store_ln494' <Predicate = (!icmp_ln494)> <Delay = 0.42>
ST_1 : Operation 24 [1/1] (0.00ns)   --->   "%br_ln494 = br void %for.inc13" [activation_accelerator.cpp:494]   --->   Operation 24 'br' 'br_ln494' <Predicate = (!icmp_ln494)> <Delay = 0.00>

State 2 <SV = 1> <Delay = 7.30>
ST_2 : Operation 25 [1/1] (7.30ns)   --->   "%gmem1_addr_read = read i16 @_ssdm_op_Read.m_axi.p1i16, i16 %gmem1_addr" [activation_accelerator.cpp:495]   --->   Operation 25 'read' 'gmem1_addr_read' <Predicate = true> <Delay = 7.30> <CoreInst = "m_axi">   --->   Core 121 'm_axi' <Latency = 0> <II = 1> <Delay = 1.00> <Adapter> <Opcode : 'read' 'write' 'readreq' 'writereq' 'writeresp'>
ST_2 : Operation 52 [1/1] (0.00ns)   --->   "%ret_ln0 = ret"   --->   Operation 52 'ret' 'ret_ln0' <Predicate = (icmp_ln494)> <Delay = 0.00>

State 3 <SV = 2> <Delay = 1.23>
ST_3 : Operation 26 [1/1] (0.00ns)   --->   "%specloopname_ln494 = specloopname void @_ssdm_op_SpecLoopName, void @empty_32" [activation_accelerator.cpp:494]   --->   Operation 26 'specloopname' 'specloopname_ln494' <Predicate = true> <Delay = 0.00>
ST_3 : Operation 27 [1/1] (0.00ns)   --->   "%zext_ln495 = zext i7 %lshr_ln4" [activation_accelerator.cpp:495]   --->   Operation 27 'zext' 'zext_ln495' <Predicate = true> <Delay = 0.00>
ST_3 : Operation 28 [1/1] (0.00ns)   --->   "%activation_accelerator_unsigned_short_unsigned_short_unsigned_short_int_i_80 = getelementptr i16 %activation_accelerator_unsigned_short_unsigned_short_unsigned_short_int_i_15, i64 0, i64 %zext_ln495" [activation_accelerator.cpp:495]   --->   Operation 28 'getelementptr' 'activation_accelerator_unsigned_short_unsigned_short_unsigned_short_int_i_80' <Predicate = true> <Delay = 0.00>
ST_3 : Operation 29 [1/1] (0.00ns)   --->   "%activation_accelerator_unsigned_short_unsigned_short_unsigned_short_int_i_81 = getelementptr i16 %activation_accelerator_unsigned_short_unsigned_short_unsigned_short_int_i_9, i64 0, i64 %zext_ln495" [activation_accelerator.cpp:495]   --->   Operation 29 'getelementptr' 'activation_accelerator_unsigned_short_unsigned_short_unsigned_short_int_i_81' <Predicate = true> <Delay = 0.00>
ST_3 : Operation 30 [1/1] (0.00ns)   --->   "%activation_accelerator_unsigned_short_unsigned_short_unsigned_short_int_i_82 = getelementptr i16 %activation_accelerator_unsigned_short_unsigned_short_unsigned_short_int_i_8, i64 0, i64 %zext_ln495" [activation_accelerator.cpp:495]   --->   Operation 30 'getelementptr' 'activation_accelerator_unsigned_short_unsigned_short_unsigned_short_int_i_82' <Predicate = true> <Delay = 0.00>
ST_3 : Operation 31 [1/1] (0.00ns)   --->   "%activation_accelerator_unsigned_short_unsigned_short_unsigned_short_int_i_83 = getelementptr i16 %activation_accelerator_unsigned_short_unsigned_short_unsigned_short_int_i_14, i64 0, i64 %zext_ln495" [activation_accelerator.cpp:495]   --->   Operation 31 'getelementptr' 'activation_accelerator_unsigned_short_unsigned_short_unsigned_short_int_i_83' <Predicate = true> <Delay = 0.00>
ST_3 : Operation 32 [1/1] (0.00ns)   --->   "%activation_accelerator_unsigned_short_unsigned_short_unsigned_short_int_i_84 = getelementptr i16 %activation_accelerator_unsigned_short_unsigned_short_unsigned_short_int_i_13, i64 0, i64 %zext_ln495" [activation_accelerator.cpp:495]   --->   Operation 32 'getelementptr' 'activation_accelerator_unsigned_short_unsigned_short_unsigned_short_int_i_84' <Predicate = true> <Delay = 0.00>
ST_3 : Operation 33 [1/1] (0.00ns)   --->   "%activation_accelerator_unsigned_short_unsigned_short_unsigned_short_int_i_85 = getelementptr i16 %activation_accelerator_unsigned_short_unsigned_short_unsigned_short_int_i_12, i64 0, i64 %zext_ln495" [activation_accelerator.cpp:495]   --->   Operation 33 'getelementptr' 'activation_accelerator_unsigned_short_unsigned_short_unsigned_short_int_i_85' <Predicate = true> <Delay = 0.00>
ST_3 : Operation 34 [1/1] (0.00ns)   --->   "%activation_accelerator_unsigned_short_unsigned_short_unsigned_short_int_i_86 = getelementptr i16 %activation_accelerator_unsigned_short_unsigned_short_unsigned_short_int_i_11, i64 0, i64 %zext_ln495" [activation_accelerator.cpp:495]   --->   Operation 34 'getelementptr' 'activation_accelerator_unsigned_short_unsigned_short_unsigned_short_int_i_86' <Predicate = true> <Delay = 0.00>
ST_3 : Operation 35 [1/1] (0.00ns)   --->   "%activation_accelerator_unsigned_short_unsigned_short_unsigned_short_int_i_87 = getelementptr i16 %activation_accelerator_unsigned_short_unsigned_short_unsigned_short_int_i_10, i64 0, i64 %zext_ln495" [activation_accelerator.cpp:495]   --->   Operation 35 'getelementptr' 'activation_accelerator_unsigned_short_unsigned_short_unsigned_short_int_i_87' <Predicate = true> <Delay = 0.00>
ST_3 : Operation 36 [1/1] (1.23ns)   --->   "%store_ln495 = store i16 %gmem1_addr_read, i7 %activation_accelerator_unsigned_short_unsigned_short_unsigned_short_int_i_86" [activation_accelerator.cpp:495]   --->   Operation 36 'store' 'store_ln495' <Predicate = (trunc_ln495 == 6)> <Delay = 1.23> <CoreInst = "RAM">   --->   Core 83 'RAM' <Latency = 1> <II = 1> <Delay = 1.23> <Storage> <Opcode : 'load' 'store'> <Ports = 2> <Width = 16> <Depth = 128> <RAM>
ST_3 : Operation 37 [1/1] (0.00ns)   --->   "%br_ln495 = br void %arrayidx12.exit" [activation_accelerator.cpp:495]   --->   Operation 37 'br' 'br_ln495' <Predicate = (trunc_ln495 == 6)> <Delay = 0.00>
ST_3 : Operation 38 [1/1] (1.23ns)   --->   "%store_ln495 = store i16 %gmem1_addr_read, i7 %activation_accelerator_unsigned_short_unsigned_short_unsigned_short_int_i_85" [activation_accelerator.cpp:495]   --->   Operation 38 'store' 'store_ln495' <Predicate = (trunc_ln495 == 5)> <Delay = 1.23> <CoreInst = "RAM">   --->   Core 83 'RAM' <Latency = 1> <II = 1> <Delay = 1.23> <Storage> <Opcode : 'load' 'store'> <Ports = 2> <Width = 16> <Depth = 128> <RAM>
ST_3 : Operation 39 [1/1] (0.00ns)   --->   "%br_ln495 = br void %arrayidx12.exit" [activation_accelerator.cpp:495]   --->   Operation 39 'br' 'br_ln495' <Predicate = (trunc_ln495 == 5)> <Delay = 0.00>
ST_3 : Operation 40 [1/1] (1.23ns)   --->   "%store_ln495 = store i16 %gmem1_addr_read, i7 %activation_accelerator_unsigned_short_unsigned_short_unsigned_short_int_i_84" [activation_accelerator.cpp:495]   --->   Operation 40 'store' 'store_ln495' <Predicate = (trunc_ln495 == 4)> <Delay = 1.23> <CoreInst = "RAM">   --->   Core 83 'RAM' <Latency = 1> <II = 1> <Delay = 1.23> <Storage> <Opcode : 'load' 'store'> <Ports = 2> <Width = 16> <Depth = 128> <RAM>
ST_3 : Operation 41 [1/1] (0.00ns)   --->   "%br_ln495 = br void %arrayidx12.exit" [activation_accelerator.cpp:495]   --->   Operation 41 'br' 'br_ln495' <Predicate = (trunc_ln495 == 4)> <Delay = 0.00>
ST_3 : Operation 42 [1/1] (1.23ns)   --->   "%store_ln495 = store i16 %gmem1_addr_read, i7 %activation_accelerator_unsigned_short_unsigned_short_unsigned_short_int_i_83" [activation_accelerator.cpp:495]   --->   Operation 42 'store' 'store_ln495' <Predicate = (trunc_ln495 == 3)> <Delay = 1.23> <CoreInst = "RAM">   --->   Core 83 'RAM' <Latency = 1> <II = 1> <Delay = 1.23> <Storage> <Opcode : 'load' 'store'> <Ports = 2> <Width = 16> <Depth = 128> <RAM>
ST_3 : Operation 43 [1/1] (0.00ns)   --->   "%br_ln495 = br void %arrayidx12.exit" [activation_accelerator.cpp:495]   --->   Operation 43 'br' 'br_ln495' <Predicate = (trunc_ln495 == 3)> <Delay = 0.00>
ST_3 : Operation 44 [1/1] (1.23ns)   --->   "%store_ln495 = store i16 %gmem1_addr_read, i7 %activation_accelerator_unsigned_short_unsigned_short_unsigned_short_int_i_82" [activation_accelerator.cpp:495]   --->   Operation 44 'store' 'store_ln495' <Predicate = (trunc_ln495 == 2)> <Delay = 1.23> <CoreInst = "RAM">   --->   Core 83 'RAM' <Latency = 1> <II = 1> <Delay = 1.23> <Storage> <Opcode : 'load' 'store'> <Ports = 2> <Width = 16> <Depth = 128> <RAM>
ST_3 : Operation 45 [1/1] (0.00ns)   --->   "%br_ln495 = br void %arrayidx12.exit" [activation_accelerator.cpp:495]   --->   Operation 45 'br' 'br_ln495' <Predicate = (trunc_ln495 == 2)> <Delay = 0.00>
ST_3 : Operation 46 [1/1] (1.23ns)   --->   "%store_ln495 = store i16 %gmem1_addr_read, i7 %activation_accelerator_unsigned_short_unsigned_short_unsigned_short_int_i_81" [activation_accelerator.cpp:495]   --->   Operation 46 'store' 'store_ln495' <Predicate = (trunc_ln495 == 1)> <Delay = 1.23> <CoreInst = "RAM">   --->   Core 83 'RAM' <Latency = 1> <II = 1> <Delay = 1.23> <Storage> <Opcode : 'load' 'store'> <Ports = 2> <Width = 16> <Depth = 128> <RAM>
ST_3 : Operation 47 [1/1] (0.00ns)   --->   "%br_ln495 = br void %arrayidx12.exit" [activation_accelerator.cpp:495]   --->   Operation 47 'br' 'br_ln495' <Predicate = (trunc_ln495 == 1)> <Delay = 0.00>
ST_3 : Operation 48 [1/1] (1.23ns)   --->   "%store_ln495 = store i16 %gmem1_addr_read, i7 %activation_accelerator_unsigned_short_unsigned_short_unsigned_short_int_i_80" [activation_accelerator.cpp:495]   --->   Operation 48 'store' 'store_ln495' <Predicate = (trunc_ln495 == 0)> <Delay = 1.23> <CoreInst = "RAM">   --->   Core 83 'RAM' <Latency = 1> <II = 1> <Delay = 1.23> <Storage> <Opcode : 'load' 'store'> <Ports = 2> <Width = 16> <Depth = 128> <RAM>
ST_3 : Operation 49 [1/1] (0.00ns)   --->   "%br_ln495 = br void %arrayidx12.exit" [activation_accelerator.cpp:495]   --->   Operation 49 'br' 'br_ln495' <Predicate = (trunc_ln495 == 0)> <Delay = 0.00>
ST_3 : Operation 50 [1/1] (1.23ns)   --->   "%store_ln495 = store i16 %gmem1_addr_read, i7 %activation_accelerator_unsigned_short_unsigned_short_unsigned_short_int_i_87" [activation_accelerator.cpp:495]   --->   Operation 50 'store' 'store_ln495' <Predicate = (trunc_ln495 == 7)> <Delay = 1.23> <CoreInst = "RAM">   --->   Core 83 'RAM' <Latency = 1> <II = 1> <Delay = 1.23> <Storage> <Opcode : 'load' 'store'> <Ports = 2> <Width = 16> <Depth = 128> <RAM>
ST_3 : Operation 51 [1/1] (0.00ns)   --->   "%br_ln495 = br void %arrayidx12.exit" [activation_accelerator.cpp:495]   --->   Operation 51 'br' 'br_ln495' <Predicate = (trunc_ln495 == 7)> <Delay = 0.00>


============================================================
+ Verbose Summary: Timing violations
============================================================
Target clock period: 10ns, clock uncertainty: 2.7ns.

 <State 1>: 1.37ns
The critical path consists of the following:
	'alloca' operation ('i') [11]  (0 ns)
	'load' operation ('i', activation_accelerator.cpp:495) on local variable 'i' [18]  (0 ns)
	'add' operation ('add_ln494', activation_accelerator.cpp:494) [24]  (0.798 ns)
	'store' operation ('store_ln494', activation_accelerator.cpp:494) of variable 'add_ln494', activation_accelerator.cpp:494 on local variable 'i' [66]  (0.427 ns)
	blocking operation 0.146 ns on control path)

 <State 2>: 7.3ns
The critical path consists of the following:
	bus read operation ('gmem1_addr_read', activation_accelerator.cpp:495) on port 'gmem1' (activation_accelerator.cpp:495) [28]  (7.3 ns)

 <State 3>: 1.24ns
The critical path consists of the following:
	'getelementptr' operation ('activation_accelerator_unsigned_short_unsigned_short_unsigned_short_int_i_87', activation_accelerator.cpp:495) [38]  (0 ns)
	'store' operation ('store_ln495', activation_accelerator.cpp:495) of variable 'gmem1_addr_read', activation_accelerator.cpp:495 on array 'activation_accelerator_unsigned_short_unsigned_short_unsigned_short_int_i_10' [63]  (1.24 ns)


============================================================
+ Verbose Summary: Binding
============================================================
N/A
* FSMD analyzer results:
  - Output states:
 - Input state : 
  - Chain level:
	State 1
	State 2
	State 3


============================================================
+ Verbose Summary: Datapath Resource usage 
============================================================
N/A
