

================================================================
== Vitis HLS Report for 'activation_accelerator_Pipeline_VITIS_LOOP_465_4'
================================================================
* Date:           Sun Oct 12 10:45:49 2025

* Version:        2022.2 (Build 3670227 on Oct 13 2022)
* Project:        activation_accelerator
* Solution:       baseline (Vivado IP Flow Target)
* Product family: zynquplus
* Target device:  xck26-sfvc784-2LV-c


================================================================
== Performance Estimates
================================================================
+ Timing: 
    * Summary: 
    +--------+----------+----------+------------+
    |  Clock |  Target  | Estimated| Uncertainty|
    +--------+----------+----------+------------+
    |ap_clk  |  10.00 ns|  7.300 ns|     2.70 ns|
    +--------+----------+----------+------------+

+ Latency: 
    * Summary: 
    +---------+---------+----------+----------+-------+-------+---------+
    |  Latency (cycles) |  Latency (absolute) |    Interval   | Pipeline|
    |   min   |   max   |    min   |    max   |  min  |  max  |   Type  |
    +---------+---------+----------+----------+-------+-------+---------+
    |    32771|    32771|  0.328 ms|  0.328 ms|  32771|  32771|       no|
    +---------+---------+----------+----------+-------+-------+---------+

    + Detail: 
        * Instance: 
        N/A

        * Loop: 
        +--------------------+---------+---------+----------+-----------+-----------+-------+----------+
        |                    |  Latency (cycles) | Iteration|  Initiation Interval  |  Trip |          |
        |      Loop Name     |   min   |   max   |  Latency |  achieved |   target  | Count | Pipelined|
        +--------------------+---------+---------+----------+-----------+-----------+-------+----------+
        |- VITIS_LOOP_465_4  |    32769|    32769|         3|          1|          1|  32768|       yes|
        +--------------------+---------+---------+----------+-----------+-----------+-------+----------+

============================================================
+ Verbose Summary: Synthesis Manager
============================================================
InlineROM: 1
ExposeGlobal: 0
============================================================
+ Verbose Summary: CDFG Model
============================================================
IsTopModel: 0
ResetActiveHigh: 1
IsCombinational: 0
IsDatapathOnly: 0
HasWiredReturn: 1
HasMFsm: 2
HasVarLatency: 1
IsPipeline: 0
IsRtlPipelined: 0
IsInstanceOverlapped: 0
IsDontTouch: 0
HasImplIP: 0
IsGatedGlobalClock: 0

+ Individual pipeline summary: 
  * Pipeline-0: initiation interval (II) = 1, depth = 3


============================================================
+ Verbose Summary: Schedule
============================================================
* Number of FSM states : 3
* Pipeline : 1
  Pipeline-0 : II = 1, D = 3, States = { 1 2 3 }
* Dataflow Pipeline: 0

* FSM state transitions: 
1 --> 2 
2 --> 3 
3 --> 

* FSM state operations: 

State 1 <SV = 0> <Delay = 1.52>
ST_1 : Operation 6 [1/1] (0.00ns)   --->   "%i = alloca i32 1"   --->   Operation 6 'alloca' 'i' <Predicate = true> <Delay = 0.00>
ST_1 : Operation 7 [1/1] (0.00ns)   --->   "%sext_ln465_read = read i63 @_ssdm_op_Read.ap_auto.i63, i63 %sext_ln465"   --->   Operation 7 'read' 'sext_ln465_read' <Predicate = true> <Delay = 0.00>
ST_1 : Operation 8 [1/1] (0.00ns)   --->   "%sext_ln465_cast = sext i63 %sext_ln465_read"   --->   Operation 8 'sext' 'sext_ln465_cast' <Predicate = true> <Delay = 0.00>
ST_1 : Operation 9 [1/1] (0.00ns)   --->   "%specinterface_ln0 = specinterface void @_ssdm_op_SpecInterface, i16 %gmem2, void @empty_13, i32 0, i32 0, void @empty, i32 0, i32 32768, void @empty_3, void @empty_1, void @empty, i32 16, i32 16, i32 16, i32 16, void @empty, void @empty, i32 4294967295, i32 0"   --->   Operation 9 'specinterface' 'specinterface_ln0' <Predicate = true> <Delay = 0.00>
ST_1 : Operation 10 [1/1] (0.42ns)   --->   "%store_ln0 = store i16 0, i16 %i"   --->   Operation 10 'store' 'store_ln0' <Predicate = true> <Delay = 0.42>
ST_1 : Operation 11 [1/1] (0.00ns)   --->   "%br_ln0 = br void %for.inc87"   --->   Operation 11 'br' 'br_ln0' <Predicate = true> <Delay = 0.00>
ST_1 : Operation 12 [1/1] (0.00ns)   --->   "%i_3 = load i16 %i" [activation_accelerator.cpp:465]   --->   Operation 12 'load' 'i_3' <Predicate = true> <Delay = 0.00>
ST_1 : Operation 13 [1/1] (0.00ns)   --->   "%specbitsmap_ln0 = specbitsmap void @_ssdm_op_SpecBitsMap, i16 %gmem2"   --->   Operation 13 'specbitsmap' 'specbitsmap_ln0' <Predicate = true> <Delay = 0.00>
ST_1 : Operation 14 [1/1] (0.00ns)   --->   "%gmem2_addr = getelementptr i16 %gmem2, i64 %sext_ln465_cast" [activation_accelerator.cpp:465]   --->   Operation 14 'getelementptr' 'gmem2_addr' <Predicate = true> <Delay = 0.00>
ST_1 : Operation 15 [1/1] (0.00ns)   --->   "%specpipeline_ln0 = specpipeline void @_ssdm_op_SpecPipeline, i32 4294967295, i32 0, i32 1, i32 0, void @p_str"   --->   Operation 15 'specpipeline' 'specpipeline_ln0' <Predicate = true> <Delay = 0.00>
ST_1 : Operation 16 [1/1] (1.10ns)   --->   "%icmp_ln465 = icmp_eq  i16 %i_3, i16 32768" [activation_accelerator.cpp:465]   --->   Operation 16 'icmp' 'icmp_ln465' <Predicate = true> <Delay = 1.10> <CoreInst = "Cmp">   --->   Core 9 'Cmp' <Latency = 0> <II = 1> <Delay = 1.10> <FuncUnit> <Opcode : 'icmp'> <InPorts = 2> <OutPorts = 1>
ST_1 : Operation 17 [1/1] (0.00ns)   --->   "%empty = speclooptripcount i32 @_ssdm_op_SpecLoopTripCount, i64 32768, i64 32768, i64 32768"   --->   Operation 17 'speclooptripcount' 'empty' <Predicate = true> <Delay = 0.00>
ST_1 : Operation 18 [1/1] (0.85ns)   --->   "%add_ln465 = add i16 %i_3, i16 1" [activation_accelerator.cpp:465]   --->   Operation 18 'add' 'add_ln465' <Predicate = true> <Delay = 0.85> <CoreInst = "Adder">   --->   Core 1 'Adder' <Latency = 0> <II = 1> <Delay = 0.85> <FuncUnit> <Opcode : 'add' 'sub'> <InPorts = 2> <OutPorts = 1>
ST_1 : Operation 19 [1/1] (0.00ns)   --->   "%br_ln465 = br i1 %icmp_ln465, void %for.inc87.split, void %if.end90.loopexit261.exitStub" [activation_accelerator.cpp:465]   --->   Operation 19 'br' 'br_ln465' <Predicate = true> <Delay = 0.00>
ST_1 : Operation 20 [1/1] (0.00ns)   --->   "%i_3_cast = zext i16 %i_3" [activation_accelerator.cpp:465]   --->   Operation 20 'zext' 'i_3_cast' <Predicate = (!icmp_ln465)> <Delay = 0.00>
ST_1 : Operation 21 [1/1] (0.00ns)   --->   "%buf2_addr = getelementptr i16 %buf2, i64 0, i64 %i_3_cast" [activation_accelerator.cpp:466]   --->   Operation 21 'getelementptr' 'buf2_addr' <Predicate = (!icmp_ln465)> <Delay = 0.00>
ST_1 : Operation 22 [2/2] (1.23ns)   --->   "%buf2_load = load i15 %buf2_addr" [activation_accelerator.cpp:466]   --->   Operation 22 'load' 'buf2_load' <Predicate = (!icmp_ln465)> <Delay = 1.23> <CoreInst = "RAM">   --->   Core 83 'RAM' <Latency = 1> <II = 1> <Delay = 1.23> <Storage> <Opcode : 'load' 'store'> <Ports = 2> <Width = 16> <Depth = 32768> <RAM>
ST_1 : Operation 23 [1/1] (0.42ns)   --->   "%store_ln465 = store i16 %add_ln465, i16 %i" [activation_accelerator.cpp:465]   --->   Operation 23 'store' 'store_ln465' <Predicate = (!icmp_ln465)> <Delay = 0.42>

State 2 <SV = 1> <Delay = 1.23>
ST_2 : Operation 24 [1/2] (1.23ns)   --->   "%buf2_load = load i15 %buf2_addr" [activation_accelerator.cpp:466]   --->   Operation 24 'load' 'buf2_load' <Predicate = true> <Delay = 1.23> <CoreInst = "RAM">   --->   Core 83 'RAM' <Latency = 1> <II = 1> <Delay = 1.23> <Storage> <Opcode : 'load' 'store'> <Ports = 2> <Width = 16> <Depth = 32768> <RAM>
ST_2 : Operation 28 [1/1] (0.00ns)   --->   "%ret_ln0 = ret"   --->   Operation 28 'ret' 'ret_ln0' <Predicate = (icmp_ln465)> <Delay = 0.00>

State 3 <SV = 2> <Delay = 7.30>
ST_3 : Operation 25 [1/1] (0.00ns)   --->   "%specloopname_ln465 = specloopname void @_ssdm_op_SpecLoopName, void @empty_23" [activation_accelerator.cpp:465]   --->   Operation 25 'specloopname' 'specloopname_ln465' <Predicate = true> <Delay = 0.00>
ST_3 : Operation 26 [1/1] (7.30ns)   --->   "%write_ln466 = write void @_ssdm_op_Write.m_axi.p1i16, i16 %gmem2_addr, i16 %buf2_load, i2 3" [activation_accelerator.cpp:466]   --->   Operation 26 'write' 'write_ln466' <Predicate = true> <Delay = 7.30> <CoreInst = "m_axi">   --->   Core 121 'm_axi' <Latency = 0> <II = 1> <Delay = 1.00> <Adapter> <Opcode : 'read' 'write' 'readreq' 'writereq' 'writeresp'>
ST_3 : Operation 27 [1/1] (0.00ns)   --->   "%br_ln465 = br void %for.inc87" [activation_accelerator.cpp:465]   --->   Operation 27 'br' 'br_ln465' <Predicate = true> <Delay = 0.00>


============================================================
+ Verbose Summary: Timing violations
============================================================
Target clock period: 10ns, clock uncertainty: 2.7ns.

 <State 1>: 1.53ns
The critical path consists of the following:
	'alloca' operation ('i') [4]  (0 ns)
	'load' operation ('i', activation_accelerator.cpp:465) on local variable 'i' [11]  (0 ns)
	'add' operation ('add_ln465', activation_accelerator.cpp:465) [17]  (0.853 ns)
	'store' operation ('store_ln465', activation_accelerator.cpp:465) of variable 'add_ln465', activation_accelerator.cpp:465 on local variable 'i' [25]  (0.427 ns)
	blocking operation 0.249 ns on control path)

 <State 2>: 1.24ns
The critical path consists of the following:
	'load' operation ('buf2_load', activation_accelerator.cpp:466) on array 'buf2' [23]  (1.24 ns)

 <State 3>: 7.3ns
The critical path consists of the following:
	bus write operation ('write_ln466', activation_accelerator.cpp:466) on port 'gmem2' (activation_accelerator.cpp:466) [24]  (7.3 ns)


============================================================
+ Verbose Summary: Binding
============================================================
N/A
* FSMD analyzer results:
  - Output states:
 - Input state : 
  - Chain level:
	State 1
	State 2
	State 3


============================================================
+ Verbose Summary: Datapath Resource usage 
============================================================
N/A
