

================================================================
== Vitis HLS Report for 'activation_accelerator_Pipeline_rms_loop_0'
================================================================
* Date:           Sat Sep 27 10:30:47 2025

* Version:        2022.2 (Build 3670227 on Oct 13 2022)
* Project:        activation_accelerator
* Solution:       baseline (Vivado IP Flow Target)
* Product family: zynquplus
* Target device:  xck26-sfvc784-2LV-c


================================================================
== Performance Estimates
================================================================
+ Timing: 
    * Summary: 
    +--------+----------+----------+------------+
    |  Clock |  Target  | Estimated| Uncertainty|
    +--------+----------+----------+------------+
    |ap_clk  |  10.00 ns|  7.016 ns|     2.70 ns|
    +--------+----------+----------+------------+

+ Latency: 
    * Summary: 
    +---------+---------+-----------+-----------+------+------+---------+
    |  Latency (cycles) |   Latency (absolute)  |   Interval  | Pipeline|
    |   min   |   max   |    min    |    max    |  min |  max |   Type  |
    +---------+---------+-----------+-----------+------+------+---------+
    |     3079|     3079|  30.790 us|  30.790 us|  3079|  3079|       no|
    +---------+---------+-----------+-----------+------+------+---------+

    + Detail: 
        * Instance: 
        N/A

        * Loop: 
        +--------------+---------+---------+----------+-----------+-----------+------+----------+
        |              |  Latency (cycles) | Iteration|  Initiation Interval  | Trip |          |
        |   Loop Name  |   min   |   max   |  Latency |  achieved |   target  | Count| Pipelined|
        +--------------+---------+---------+----------+-----------+-----------+------+----------+
        |- rms_loop_0  |     3077|     3077|         9|          3|          1|  1024|       yes|
        +--------------+---------+---------+----------+-----------+-----------+------+----------+

============================================================
+ Verbose Summary: Synthesis Manager
============================================================
InlineROM: 1
ExposeGlobal: 0
============================================================
+ Verbose Summary: CDFG Model
============================================================
IsTopModel: 0
ResetActiveHigh: 1
IsCombinational: 0
IsDatapathOnly: 0
HasWiredReturn: 1
HasMFsm: 2
HasVarLatency: 1
IsPipeline: 0
IsRtlPipelined: 0
IsInstanceOverlapped: 0
IsDontTouch: 0
HasImplIP: 0
IsGatedGlobalClock: 0

+ Individual pipeline summary: 
  * Pipeline-0: initiation interval (II) = 3, depth = 9


============================================================
+ Verbose Summary: Schedule
============================================================
* Number of FSM states : 9
* Pipeline : 1
  Pipeline-0 : II = 3, D = 9, States = { 1 2 3 4 5 6 7 8 9 }
* Dataflow Pipeline: 0

* FSM state transitions: 
1 --> 2 
2 --> 3 
3 --> 4 
4 --> 5 
5 --> 6 
6 --> 7 
7 --> 8 
8 --> 9 
9 --> 

* FSM state operations: 

State 1 <SV = 0> <Delay = 1.37>
ST_1 : Operation 12 [1/1] (0.00ns)   --->   "%sum_sq = alloca i32 1"   --->   Operation 12 'alloca' 'sum_sq' <Predicate = true> <Delay = 0.00>
ST_1 : Operation 13 [1/1] (0.00ns)   --->   "%i_8 = alloca i32 1"   --->   Operation 13 'alloca' 'i_8' <Predicate = true> <Delay = 0.00>
ST_1 : Operation 14 [1/1] (0.00ns)   --->   "%specmemcore_ln0 = specmemcore void @_ssdm_op_SpecMemCore, i32 %xt, i64 666, i64 25, i64 18446744073709551615"   --->   Operation 14 'specmemcore' 'specmemcore_ln0' <Predicate = true> <Delay = 0.00>
ST_1 : Operation 15 [1/1] (0.42ns)   --->   "%store_ln0 = store i11 0, i11 %i_8"   --->   Operation 15 'store' 'store_ln0' <Predicate = true> <Delay = 0.42>
ST_1 : Operation 16 [1/1] (0.42ns)   --->   "%store_ln0 = store i32 0, i32 %sum_sq"   --->   Operation 16 'store' 'store_ln0' <Predicate = true> <Delay = 0.42>
ST_1 : Operation 17 [1/1] (0.00ns)   --->   "%br_ln0 = br void %for.inc.i34"   --->   Operation 17 'br' 'br_ln0' <Predicate = true> <Delay = 0.00>
ST_1 : Operation 18 [1/1] (0.00ns)   --->   "%i = load i11 %i_8" [activation_accelerator.cpp:182]   --->   Operation 18 'load' 'i' <Predicate = true> <Delay = 0.00>
ST_1 : Operation 19 [1/1] (0.94ns)   --->   "%icmp_ln182 = icmp_eq  i11 %i, i11 1024" [activation_accelerator.cpp:182]   --->   Operation 19 'icmp' 'icmp_ln182' <Predicate = true> <Delay = 0.94> <CoreInst = "Cmp">   --->   Core 9 'Cmp' <Latency = 0> <II = 1> <Delay = 0.94> <FuncUnit> <Opcode : 'icmp'> <InPorts = 2> <OutPorts = 1>
ST_1 : Operation 20 [1/1] (0.00ns)   --->   "%speclooptripcount_ln0 = speclooptripcount void @_ssdm_op_SpecLoopTripCount, i64 1024, i64 1024, i64 1024"   --->   Operation 20 'speclooptripcount' 'speclooptripcount_ln0' <Predicate = true> <Delay = 0.00>
ST_1 : Operation 21 [1/1] (0.79ns)   --->   "%add_ln182 = add i11 %i, i11 1" [activation_accelerator.cpp:182]   --->   Operation 21 'add' 'add_ln182' <Predicate = true> <Delay = 0.79> <CoreInst = "Adder">   --->   Core 1 'Adder' <Latency = 0> <II = 1> <Delay = 0.79> <FuncUnit> <Opcode : 'add' 'sub'> <InPorts = 2> <OutPorts = 1>
ST_1 : Operation 22 [1/1] (0.00ns)   --->   "%br_ln182 = br i1 %icmp_ln182, void %for.inc.i34.split, void %for.end.i.exitStub" [activation_accelerator.cpp:182]   --->   Operation 22 'br' 'br_ln182' <Predicate = true> <Delay = 0.00>
ST_1 : Operation 23 [1/1] (0.00ns)   --->   "%zext_ln182 = zext i11 %i" [activation_accelerator.cpp:182]   --->   Operation 23 'zext' 'zext_ln182' <Predicate = (!icmp_ln182)> <Delay = 0.00>
ST_1 : Operation 24 [1/1] (0.00ns)   --->   "%xt_addr = getelementptr i32 %xt, i64 0, i64 %zext_ln182" [activation_accelerator.cpp:184]   --->   Operation 24 'getelementptr' 'xt_addr' <Predicate = (!icmp_ln182)> <Delay = 0.00>
ST_1 : Operation 25 [2/2] (1.23ns)   --->   "%xt_load = load i10 %xt_addr" [activation_accelerator.cpp:184]   --->   Operation 25 'load' 'xt_load' <Predicate = (!icmp_ln182)> <Delay = 1.23> <CoreInst = "RAM_S2P_BRAM">   --->   Core 97 'RAM_S2P_BRAM' <Latency = 1> <II = 1> <Delay = 1.23> <Storage> <Opcode : 'load' 'store'> <Ports = 2> <Width = 32> <Depth = 1024> <RAM>
ST_1 : Operation 26 [1/1] (0.42ns)   --->   "%store_ln182 = store i11 %add_ln182, i11 %i_8" [activation_accelerator.cpp:182]   --->   Operation 26 'store' 'store_ln182' <Predicate = (!icmp_ln182)> <Delay = 0.42>

State 2 <SV = 1> <Delay = 1.23>
ST_2 : Operation 27 [1/2] (1.23ns)   --->   "%xt_load = load i10 %xt_addr" [activation_accelerator.cpp:184]   --->   Operation 27 'load' 'xt_load' <Predicate = (!icmp_ln182)> <Delay = 1.23> <CoreInst = "RAM_S2P_BRAM">   --->   Core 97 'RAM_S2P_BRAM' <Latency = 1> <II = 1> <Delay = 1.23> <Storage> <Opcode : 'load' 'store'> <Ports = 2> <Width = 32> <Depth = 1024> <RAM>

State 3 <SV = 2> <Delay = 7.01>
ST_3 : Operation 28 [3/3] (7.01ns)   --->   "%mul_i = fmul i32 %xt_load, i32 %xt_load" [activation_accelerator.cpp:184]   --->   Operation 28 'fmul' 'mul_i' <Predicate = (!icmp_ln182)> <Delay = 7.01> <CoreInst = "FMul_maxdsp">   --->   Core 30 'FMul_maxdsp' <Latency = 2> <II = 1> <Delay = 7.01> <FuncUnit> <Opcode : 'fmul'> <InPorts = 2> <OutPorts = 1>

State 4 <SV = 3> <Delay = 7.01>
ST_4 : Operation 29 [2/3] (7.01ns)   --->   "%mul_i = fmul i32 %xt_load, i32 %xt_load" [activation_accelerator.cpp:184]   --->   Operation 29 'fmul' 'mul_i' <Predicate = true> <Delay = 7.01> <CoreInst = "FMul_maxdsp">   --->   Core 30 'FMul_maxdsp' <Latency = 2> <II = 1> <Delay = 7.01> <FuncUnit> <Opcode : 'fmul'> <InPorts = 2> <OutPorts = 1>

State 5 <SV = 4> <Delay = 7.01>
ST_5 : Operation 30 [1/3] (7.01ns)   --->   "%mul_i = fmul i32 %xt_load, i32 %xt_load" [activation_accelerator.cpp:184]   --->   Operation 30 'fmul' 'mul_i' <Predicate = true> <Delay = 7.01> <CoreInst = "FMul_maxdsp">   --->   Core 30 'FMul_maxdsp' <Latency = 2> <II = 1> <Delay = 7.01> <FuncUnit> <Opcode : 'fmul'> <InPorts = 2> <OutPorts = 1>

State 6 <SV = 5> <Delay = 4.89>
ST_6 : Operation 31 [1/1] (0.00ns)   --->   "%sum_sq_load = load i32 %sum_sq" [activation_accelerator.cpp:184]   --->   Operation 31 'load' 'sum_sq_load' <Predicate = true> <Delay = 0.00>
ST_6 : Operation 32 [4/4] (4.89ns)   --->   "%sum_sq_1 = fadd i32 %sum_sq_load, i32 %mul_i" [activation_accelerator.cpp:184]   --->   Operation 32 'fadd' 'sum_sq_1' <Predicate = true> <Delay = 4.89> <CoreInst = "FAddSub_nodsp">   --->   Core 17 'FAddSub_nodsp' <Latency = 3> <II = 1> <Delay = 4.89> <FuncUnit> <Opcode : 'fadd' 'fsub'> <InPorts = 2> <OutPorts = 1>
ST_6 : Operation 40 [1/1] (0.00ns)   --->   "%sum_sq_load_1 = load i32 %sum_sq"   --->   Operation 40 'load' 'sum_sq_load_1' <Predicate = (icmp_ln182)> <Delay = 0.00>
ST_6 : Operation 41 [1/1] (0.00ns)   --->   "%write_ln0 = write void @_ssdm_op_Write.ap_auto.floatP0A, i32 %sum_sq_out, i32 %sum_sq_load_1"   --->   Operation 41 'write' 'write_ln0' <Predicate = (icmp_ln182)> <Delay = 0.00>
ST_6 : Operation 42 [1/1] (0.00ns)   --->   "%ret_ln0 = ret"   --->   Operation 42 'ret' 'ret_ln0' <Predicate = (icmp_ln182)> <Delay = 0.00>

State 7 <SV = 6> <Delay = 4.89>
ST_7 : Operation 33 [3/4] (4.89ns)   --->   "%sum_sq_1 = fadd i32 %sum_sq_load, i32 %mul_i" [activation_accelerator.cpp:184]   --->   Operation 33 'fadd' 'sum_sq_1' <Predicate = true> <Delay = 4.89> <CoreInst = "FAddSub_nodsp">   --->   Core 17 'FAddSub_nodsp' <Latency = 3> <II = 1> <Delay = 4.89> <FuncUnit> <Opcode : 'fadd' 'fsub'> <InPorts = 2> <OutPorts = 1>

State 8 <SV = 7> <Delay = 4.89>
ST_8 : Operation 34 [2/4] (4.89ns)   --->   "%sum_sq_1 = fadd i32 %sum_sq_load, i32 %mul_i" [activation_accelerator.cpp:184]   --->   Operation 34 'fadd' 'sum_sq_1' <Predicate = true> <Delay = 4.89> <CoreInst = "FAddSub_nodsp">   --->   Core 17 'FAddSub_nodsp' <Latency = 3> <II = 1> <Delay = 4.89> <FuncUnit> <Opcode : 'fadd' 'fsub'> <InPorts = 2> <OutPorts = 1>

State 9 <SV = 8> <Delay = 5.32>
ST_9 : Operation 35 [1/1] (0.00ns)   --->   "%specpipeline_ln183 = specpipeline void @_ssdm_op_SpecPipeline, i32 1, i32 0, i32 0, i32 0, void @empty_4" [activation_accelerator.cpp:183]   --->   Operation 35 'specpipeline' 'specpipeline_ln183' <Predicate = true> <Delay = 0.00>
ST_9 : Operation 36 [1/1] (0.00ns)   --->   "%specloopname_ln180 = specloopname void @_ssdm_op_SpecLoopName, void @empty_2" [activation_accelerator.cpp:180]   --->   Operation 36 'specloopname' 'specloopname_ln180' <Predicate = true> <Delay = 0.00>
ST_9 : Operation 37 [1/4] (4.89ns)   --->   "%sum_sq_1 = fadd i32 %sum_sq_load, i32 %mul_i" [activation_accelerator.cpp:184]   --->   Operation 37 'fadd' 'sum_sq_1' <Predicate = true> <Delay = 4.89> <CoreInst = "FAddSub_nodsp">   --->   Core 17 'FAddSub_nodsp' <Latency = 3> <II = 1> <Delay = 4.89> <FuncUnit> <Opcode : 'fadd' 'fsub'> <InPorts = 2> <OutPorts = 1>
ST_9 : Operation 38 [1/1] (0.42ns)   --->   "%store_ln182 = store i32 %sum_sq_1, i32 %sum_sq" [activation_accelerator.cpp:182]   --->   Operation 38 'store' 'store_ln182' <Predicate = true> <Delay = 0.42>
ST_9 : Operation 39 [1/1] (0.00ns)   --->   "%br_ln182 = br void %for.inc.i34" [activation_accelerator.cpp:182]   --->   Operation 39 'br' 'br_ln182' <Predicate = true> <Delay = 0.00>


============================================================
+ Verbose Summary: Timing violations
============================================================
Target clock period: 10ns, clock uncertainty: 2.7ns.

 <State 1>: 1.37ns
The critical path consists of the following:
	'alloca' operation ('i') [4]  (0 ns)
	'load' operation ('i', activation_accelerator.cpp:182) on local variable 'i' [10]  (0 ns)
	'getelementptr' operation ('xt_addr', activation_accelerator.cpp:184) [20]  (0 ns)
	'load' operation ('xt_load', activation_accelerator.cpp:184) on array 'xt' [21]  (1.24 ns)
	blocking operation 0.134 ns on control path)

 <State 2>: 1.24ns
The critical path consists of the following:
	'load' operation ('xt_load', activation_accelerator.cpp:184) on array 'xt' [21]  (1.24 ns)

 <State 3>: 7.02ns
The critical path consists of the following:
	'fmul' operation ('mul_i', activation_accelerator.cpp:184) [22]  (7.02 ns)

 <State 4>: 7.02ns
The critical path consists of the following:
	'fmul' operation ('mul_i', activation_accelerator.cpp:184) [22]  (7.02 ns)

 <State 5>: 7.02ns
The critical path consists of the following:
	'fmul' operation ('mul_i', activation_accelerator.cpp:184) [22]  (7.02 ns)

 <State 6>: 4.89ns
The critical path consists of the following:
	'load' operation ('sum_sq_load', activation_accelerator.cpp:184) on local variable 'sum_sq' [16]  (0 ns)
	'fadd' operation ('sum_sq', activation_accelerator.cpp:184) [23]  (4.89 ns)

 <State 7>: 4.89ns
The critical path consists of the following:
	'fadd' operation ('sum_sq', activation_accelerator.cpp:184) [23]  (4.89 ns)

 <State 8>: 4.89ns
The critical path consists of the following:
	'fadd' operation ('sum_sq', activation_accelerator.cpp:184) [23]  (4.89 ns)

 <State 9>: 5.32ns
The critical path consists of the following:
	'fadd' operation ('sum_sq', activation_accelerator.cpp:184) [23]  (4.89 ns)
	'store' operation ('store_ln182', activation_accelerator.cpp:182) of variable 'sum_sq', activation_accelerator.cpp:184 on local variable 'sum_sq' [25]  (0.427 ns)


============================================================
+ Verbose Summary: Binding
============================================================
N/A
* FSMD analyzer results:
  - Output states:
 - Input state : 
  - Chain level:
	State 1
	State 2
	State 3
	State 4
	State 5
	State 6
	State 7
	State 8
	State 9


============================================================
+ Verbose Summary: Datapath Resource usage 
============================================================
N/A
