

================================================================
== Vitis HLS Report for 'activation_accelerator_Pipeline_VITIS_LOOP_175_2'
================================================================
* Date:           Tue Sep 23 21:33:50 2025

* Version:        2022.2 (Build 3670227 on Oct 13 2022)
* Project:        activation_accelerator
* Solution:       baseline (Vivado IP Flow Target)
* Product family: zynquplus
* Target device:  xck26-sfvc784-2LV-c


================================================================
== Performance Estimates
================================================================
+ Timing: 
    * Summary: 
    +--------+----------+----------+------------+
    |  Clock |  Target  | Estimated| Uncertainty|
    +--------+----------+----------+------------+
    |ap_clk  |  10.00 ns|  7.057 ns|     2.70 ns|
    +--------+----------+----------+------------+

+ Latency: 
    * Summary: 
    +---------+---------+----------+----------+-------+-------+---------+
    |  Latency (cycles) |  Latency (absolute) |    Interval   | Pipeline|
    |   min   |   max   |    min   |    max   |  min  |  max  |   Type  |
    +---------+---------+----------+----------+-------+-------+---------+
    |    32780|    32780|  0.328 ms|  0.328 ms|  32780|  32780|       no|
    +---------+---------+----------+----------+-------+-------+---------+

    + Detail: 
        * Instance: 
        N/A

        * Loop: 
        +--------------------+---------+---------+----------+-----------+-----------+-------+----------+
        |                    |  Latency (cycles) | Iteration|  Initiation Interval  |  Trip |          |
        |      Loop Name     |   min   |   max   |  Latency |  achieved |   target  | Count | Pipelined|
        +--------------------+---------+---------+----------+-----------+-----------+-------+----------+
        |- VITIS_LOOP_175_2  |    32778|    32778|        12|          1|          1|  32768|       yes|
        +--------------------+---------+---------+----------+-----------+-----------+-------+----------+

============================================================
+ Verbose Summary: Synthesis Manager
============================================================
InlineROM: 1
ExposeGlobal: 0
============================================================
+ Verbose Summary: CDFG Model
============================================================
IsTopModel: 0
ResetActiveHigh: 1
IsCombinational: 0
IsDatapathOnly: 0
HasWiredReturn: 1
HasMFsm: 2
HasVarLatency: 1
IsPipeline: 0
IsRtlPipelined: 0
IsInstanceOverlapped: 0
IsDontTouch: 0
HasImplIP: 0
IsGatedGlobalClock: 0

+ Individual pipeline summary: 
  * Pipeline-0: initiation interval (II) = 1, depth = 12


============================================================
+ Verbose Summary: Schedule
============================================================
* Number of FSM states : 12
* Pipeline : 1
  Pipeline-0 : II = 1, D = 12, States = { 1 2 3 4 5 6 7 8 9 10 11 12 }
* Dataflow Pipeline: 0

* FSM state transitions: 
1 --> 2 
2 --> 3 
3 --> 4 
4 --> 5 
5 --> 6 
6 --> 7 
7 --> 8 
8 --> 9 
9 --> 10 
10 --> 11 
11 --> 12 
12 --> 

* FSM state operations: 

State 1 <SV = 0> <Delay = 1.52>
ST_1 : Operation 15 [1/1] (0.00ns)   --->   "%i = alloca i32 1"   --->   Operation 15 'alloca' 'i' <Predicate = true> <Delay = 0.00>
ST_1 : Operation 16 [1/1] (0.00ns)   --->   "%rms_read = read i32 @_ssdm_op_Read.ap_auto.float, i32 %rms"   --->   Operation 16 'read' 'rms_read' <Predicate = true> <Delay = 0.00>
ST_1 : Operation 17 [1/1] (0.42ns)   --->   "%store_ln0 = store i16 0, i16 %i"   --->   Operation 17 'store' 'store_ln0' <Predicate = true> <Delay = 0.42>
ST_1 : Operation 18 [1/1] (0.00ns)   --->   "%br_ln0 = br void %for.inc15.i"   --->   Operation 18 'br' 'br_ln0' <Predicate = true> <Delay = 0.00>
ST_1 : Operation 19 [1/1] (0.00ns)   --->   "%i_11 = load i16 %i" [activation_accelerator.cpp:175]   --->   Operation 19 'load' 'i_11' <Predicate = true> <Delay = 0.00>
ST_1 : Operation 20 [1/1] (0.00ns)   --->   "%specpipeline_ln0 = specpipeline void @_ssdm_op_SpecPipeline, i32 4294967295, i32 0, i32 1, i32 0, void @p_str"   --->   Operation 20 'specpipeline' 'specpipeline_ln0' <Predicate = true> <Delay = 0.00>
ST_1 : Operation 21 [1/1] (1.10ns)   --->   "%icmp_ln175 = icmp_eq  i16 %i_11, i16 32768" [activation_accelerator.cpp:175]   --->   Operation 21 'icmp' 'icmp_ln175' <Predicate = true> <Delay = 1.10> <CoreInst = "Cmp">   --->   Core 9 'Cmp' <Latency = 0> <II = 1> <Delay = 1.10> <FuncUnit> <Opcode : 'icmp'> <InPorts = 2> <OutPorts = 1>
ST_1 : Operation 22 [1/1] (0.00ns)   --->   "%empty = speclooptripcount i32 @_ssdm_op_SpecLoopTripCount, i64 32768, i64 32768, i64 32768"   --->   Operation 22 'speclooptripcount' 'empty' <Predicate = true> <Delay = 0.00>
ST_1 : Operation 23 [1/1] (0.85ns)   --->   "%add_ln175 = add i16 %i_11, i16 1" [activation_accelerator.cpp:175]   --->   Operation 23 'add' 'add_ln175' <Predicate = true> <Delay = 0.85> <CoreInst = "Adder">   --->   Core 1 'Adder' <Latency = 0> <II = 1> <Delay = 0.85> <FuncUnit> <Opcode : 'add' 'sub'> <InPorts = 2> <OutPorts = 1>
ST_1 : Operation 24 [1/1] (0.00ns)   --->   "%br_ln175 = br i1 %icmp_ln175, void %for.inc15.i.split, void %if.end83.loopexit.exitStub" [activation_accelerator.cpp:175]   --->   Operation 24 'br' 'br_ln175' <Predicate = true> <Delay = 0.00>
ST_1 : Operation 25 [1/1] (0.00ns)   --->   "%i_16_cast = zext i16 %i_11" [activation_accelerator.cpp:175]   --->   Operation 25 'zext' 'i_16_cast' <Predicate = (!icmp_ln175)> <Delay = 0.00>
ST_1 : Operation 26 [1/1] (0.00ns)   --->   "%x_addr = getelementptr i32 %x, i64 0, i64 %i_16_cast" [activation_accelerator.cpp:176]   --->   Operation 26 'getelementptr' 'x_addr' <Predicate = (!icmp_ln175)> <Delay = 0.00>
ST_1 : Operation 27 [2/2] (1.23ns)   --->   "%x_load = load i15 %x_addr" [activation_accelerator.cpp:176]   --->   Operation 27 'load' 'x_load' <Predicate = (!icmp_ln175)> <Delay = 1.23> <CoreInst = "RAM">   --->   Core 83 'RAM' <Latency = 1> <II = 1> <Delay = 1.23> <Storage> <Opcode : 'load' 'store'> <Ports = 2> <Width = 32> <Depth = 32768> <RAM>
ST_1 : Operation 28 [1/1] (0.42ns)   --->   "%store_ln175 = store i16 %add_ln175, i16 %i" [activation_accelerator.cpp:175]   --->   Operation 28 'store' 'store_ln175' <Predicate = (!icmp_ln175)> <Delay = 0.42>

State 2 <SV = 1> <Delay = 1.23>
ST_2 : Operation 29 [1/2] (1.23ns)   --->   "%x_load = load i15 %x_addr" [activation_accelerator.cpp:176]   --->   Operation 29 'load' 'x_load' <Predicate = true> <Delay = 1.23> <CoreInst = "RAM">   --->   Core 83 'RAM' <Latency = 1> <II = 1> <Delay = 1.23> <Storage> <Opcode : 'load' 'store'> <Ports = 2> <Width = 32> <Depth = 32768> <RAM>

State 3 <SV = 2> <Delay = 7.05>
ST_3 : Operation 30 [9/9] (7.05ns)   --->   "%y = fdiv i32 %x_load, i32 %rms_read" [activation_accelerator.cpp:176]   --->   Operation 30 'fdiv' 'y' <Predicate = true> <Delay = 7.05> <CoreInst = "FDiv">   --->   Core 20 'FDiv' <Latency = 8> <II = 1> <Delay = 7.05> <FuncUnit> <Opcode : 'fdiv' 'frem'> <InPorts = 2> <OutPorts = 1>

State 4 <SV = 3> <Delay = 7.05>
ST_4 : Operation 31 [8/9] (7.05ns)   --->   "%y = fdiv i32 %x_load, i32 %rms_read" [activation_accelerator.cpp:176]   --->   Operation 31 'fdiv' 'y' <Predicate = true> <Delay = 7.05> <CoreInst = "FDiv">   --->   Core 20 'FDiv' <Latency = 8> <II = 1> <Delay = 7.05> <FuncUnit> <Opcode : 'fdiv' 'frem'> <InPorts = 2> <OutPorts = 1>

State 5 <SV = 4> <Delay = 7.05>
ST_5 : Operation 32 [7/9] (7.05ns)   --->   "%y = fdiv i32 %x_load, i32 %rms_read" [activation_accelerator.cpp:176]   --->   Operation 32 'fdiv' 'y' <Predicate = true> <Delay = 7.05> <CoreInst = "FDiv">   --->   Core 20 'FDiv' <Latency = 8> <II = 1> <Delay = 7.05> <FuncUnit> <Opcode : 'fdiv' 'frem'> <InPorts = 2> <OutPorts = 1>

State 6 <SV = 5> <Delay = 7.05>
ST_6 : Operation 33 [6/9] (7.05ns)   --->   "%y = fdiv i32 %x_load, i32 %rms_read" [activation_accelerator.cpp:176]   --->   Operation 33 'fdiv' 'y' <Predicate = true> <Delay = 7.05> <CoreInst = "FDiv">   --->   Core 20 'FDiv' <Latency = 8> <II = 1> <Delay = 7.05> <FuncUnit> <Opcode : 'fdiv' 'frem'> <InPorts = 2> <OutPorts = 1>

State 7 <SV = 6> <Delay = 7.05>
ST_7 : Operation 34 [5/9] (7.05ns)   --->   "%y = fdiv i32 %x_load, i32 %rms_read" [activation_accelerator.cpp:176]   --->   Operation 34 'fdiv' 'y' <Predicate = true> <Delay = 7.05> <CoreInst = "FDiv">   --->   Core 20 'FDiv' <Latency = 8> <II = 1> <Delay = 7.05> <FuncUnit> <Opcode : 'fdiv' 'frem'> <InPorts = 2> <OutPorts = 1>

State 8 <SV = 7> <Delay = 7.05>
ST_8 : Operation 35 [4/9] (7.05ns)   --->   "%y = fdiv i32 %x_load, i32 %rms_read" [activation_accelerator.cpp:176]   --->   Operation 35 'fdiv' 'y' <Predicate = true> <Delay = 7.05> <CoreInst = "FDiv">   --->   Core 20 'FDiv' <Latency = 8> <II = 1> <Delay = 7.05> <FuncUnit> <Opcode : 'fdiv' 'frem'> <InPorts = 2> <OutPorts = 1>

State 9 <SV = 8> <Delay = 7.05>
ST_9 : Operation 36 [3/9] (7.05ns)   --->   "%y = fdiv i32 %x_load, i32 %rms_read" [activation_accelerator.cpp:176]   --->   Operation 36 'fdiv' 'y' <Predicate = true> <Delay = 7.05> <CoreInst = "FDiv">   --->   Core 20 'FDiv' <Latency = 8> <II = 1> <Delay = 7.05> <FuncUnit> <Opcode : 'fdiv' 'frem'> <InPorts = 2> <OutPorts = 1>

State 10 <SV = 9> <Delay = 7.05>
ST_10 : Operation 37 [2/9] (7.05ns)   --->   "%y = fdiv i32 %x_load, i32 %rms_read" [activation_accelerator.cpp:176]   --->   Operation 37 'fdiv' 'y' <Predicate = true> <Delay = 7.05> <CoreInst = "FDiv">   --->   Core 20 'FDiv' <Latency = 8> <II = 1> <Delay = 7.05> <FuncUnit> <Opcode : 'fdiv' 'frem'> <InPorts = 2> <OutPorts = 1>

State 11 <SV = 10> <Delay = 7.05>
ST_11 : Operation 38 [1/9] (7.05ns)   --->   "%y = fdiv i32 %x_load, i32 %rms_read" [activation_accelerator.cpp:176]   --->   Operation 38 'fdiv' 'y' <Predicate = true> <Delay = 7.05> <CoreInst = "FDiv">   --->   Core 20 'FDiv' <Latency = 8> <II = 1> <Delay = 7.05> <FuncUnit> <Opcode : 'fdiv' 'frem'> <InPorts = 2> <OutPorts = 1>
ST_11 : Operation 39 [1/1] (0.00ns)   --->   "%bitcast_ln178 = bitcast i32 %y" [activation_accelerator.cpp:178]   --->   Operation 39 'bitcast' 'bitcast_ln178' <Predicate = true> <Delay = 0.00>
ST_11 : Operation 40 [1/1] (0.00ns)   --->   "%trunc_ln = partselect i16 @_ssdm_op_PartSelect.i16.i32.i32.i32, i32 %bitcast_ln178, i32 16, i32 31" [activation_accelerator.cpp:178]   --->   Operation 40 'partselect' 'trunc_ln' <Predicate = true> <Delay = 0.00>
ST_11 : Operation 45 [1/1] (0.00ns)   --->   "%ret_ln0 = ret"   --->   Operation 45 'ret' 'ret_ln0' <Predicate = (icmp_ln175)> <Delay = 0.00>

State 12 <SV = 11> <Delay = 1.23>
ST_12 : Operation 41 [1/1] (0.00ns)   --->   "%specloopname_ln175 = specloopname void @_ssdm_op_SpecLoopName, void @empty_26" [activation_accelerator.cpp:175]   --->   Operation 41 'specloopname' 'specloopname_ln175' <Predicate = true> <Delay = 0.00>
ST_12 : Operation 42 [1/1] (0.00ns)   --->   "%buf2_addr = getelementptr i16 %buf2, i64 0, i64 %i_16_cast" [activation_accelerator.cpp:178]   --->   Operation 42 'getelementptr' 'buf2_addr' <Predicate = true> <Delay = 0.00>
ST_12 : Operation 43 [1/1] (1.23ns)   --->   "%store_ln178 = store i16 %trunc_ln, i15 %buf2_addr" [activation_accelerator.cpp:178]   --->   Operation 43 'store' 'store_ln178' <Predicate = true> <Delay = 1.23> <CoreInst = "RAM">   --->   Core 83 'RAM' <Latency = 1> <II = 1> <Delay = 1.23> <Storage> <Opcode : 'load' 'store'> <Ports = 2> <Width = 16> <Depth = 32768> <RAM>
ST_12 : Operation 44 [1/1] (0.00ns)   --->   "%br_ln175 = br void %for.inc15.i" [activation_accelerator.cpp:175]   --->   Operation 44 'br' 'br_ln175' <Predicate = true> <Delay = 0.00>


============================================================
+ Verbose Summary: Timing violations
============================================================
Target clock period: 10ns, clock uncertainty: 2.7ns.

 <State 1>: 1.53ns
The critical path consists of the following:
	'alloca' operation ('i') [4]  (0 ns)
	'load' operation ('i', activation_accelerator.cpp:175) on local variable 'i' [9]  (0 ns)
	'add' operation ('add_ln175', activation_accelerator.cpp:175) [13]  (0.853 ns)
	'store' operation ('store_ln175', activation_accelerator.cpp:175) of variable 'add_ln175', activation_accelerator.cpp:175 on local variable 'i' [25]  (0.427 ns)
	blocking operation 0.249 ns on control path)

 <State 2>: 1.24ns
The critical path consists of the following:
	'load' operation ('x_load', activation_accelerator.cpp:176) on array 'x' [19]  (1.24 ns)

 <State 3>: 7.06ns
The critical path consists of the following:
	'fdiv' operation ('y', activation_accelerator.cpp:176) [20]  (7.06 ns)

 <State 4>: 7.06ns
The critical path consists of the following:
	'fdiv' operation ('y', activation_accelerator.cpp:176) [20]  (7.06 ns)

 <State 5>: 7.06ns
The critical path consists of the following:
	'fdiv' operation ('y', activation_accelerator.cpp:176) [20]  (7.06 ns)

 <State 6>: 7.06ns
The critical path consists of the following:
	'fdiv' operation ('y', activation_accelerator.cpp:176) [20]  (7.06 ns)

 <State 7>: 7.06ns
The critical path consists of the following:
	'fdiv' operation ('y', activation_accelerator.cpp:176) [20]  (7.06 ns)

 <State 8>: 7.06ns
The critical path consists of the following:
	'fdiv' operation ('y', activation_accelerator.cpp:176) [20]  (7.06 ns)

 <State 9>: 7.06ns
The critical path consists of the following:
	'fdiv' operation ('y', activation_accelerator.cpp:176) [20]  (7.06 ns)

 <State 10>: 7.06ns
The critical path consists of the following:
	'fdiv' operation ('y', activation_accelerator.cpp:176) [20]  (7.06 ns)

 <State 11>: 7.06ns
The critical path consists of the following:
	'fdiv' operation ('y', activation_accelerator.cpp:176) [20]  (7.06 ns)

 <State 12>: 1.24ns
The critical path consists of the following:
	'getelementptr' operation ('buf2_addr', activation_accelerator.cpp:178) [23]  (0 ns)
	'store' operation ('store_ln178', activation_accelerator.cpp:178) of variable 'trunc_ln', activation_accelerator.cpp:178 on array 'buf2' [24]  (1.24 ns)


============================================================
+ Verbose Summary: Binding
============================================================
N/A
* FSMD analyzer results:
  - Output states:
 - Input state : 
  - Chain level:
	State 1
	State 2
	State 3
	State 4
	State 5
	State 6
	State 7
	State 8
	State 9
	State 10
	State 11
	State 12


============================================================
+ Verbose Summary: Datapath Resource usage 
============================================================
N/A
