

================================================================
== Vitis HLS Report for 'activation_accelerator_Pipeline_loop_mean'
================================================================
* Date:           Wed Oct  8 15:53:18 2025

* Version:        2022.2 (Build 3670227 on Oct 13 2022)
* Project:        activation_accelerator
* Solution:       baseline (Vivado IP Flow Target)
* Product family: zynquplus
* Target device:  xck26-sfvc784-2LV-c


================================================================
== Performance Estimates
================================================================
+ Timing: 
    * Summary: 
    +--------+----------+----------+------------+
    |  Clock |  Target  | Estimated| Uncertainty|
    +--------+----------+----------+------------+
    |ap_clk  |  10.00 ns|  6.656 ns|     2.70 ns|
    +--------+----------+----------+------------+

+ Latency: 
    * Summary: 
    +---------+---------+-----------+-----------+------+------+---------+
    |  Latency (cycles) |   Latency (absolute)  |   Interval  | Pipeline|
    |   min   |   max   |    min    |    max    |  min |  max |   Type  |
    +---------+---------+-----------+-----------+------+------+---------+
    |     3075|     3075|  30.750 us|  30.750 us|  3075|  3075|       no|
    +---------+---------+-----------+-----------+------+------+---------+

    + Detail: 
        * Instance: 
        N/A

        * Loop: 
        +-------------+---------+---------+----------+-----------+-----------+------+----------+
        |             |  Latency (cycles) | Iteration|  Initiation Interval  | Trip |          |
        |  Loop Name  |   min   |   max   |  Latency |  achieved |   target  | Count| Pipelined|
        +-------------+---------+---------+----------+-----------+-----------+------+----------+
        |- loop_mean  |     3073|     3073|         5|          3|          1|  1024|       yes|
        +-------------+---------+---------+----------+-----------+-----------+------+----------+

============================================================
+ Verbose Summary: Synthesis Manager
============================================================
InlineROM: 1
ExposeGlobal: 0
============================================================
+ Verbose Summary: CDFG Model
============================================================
IsTopModel: 0
ResetActiveHigh: 1
IsCombinational: 0
IsDatapathOnly: 0
HasWiredReturn: 1
HasMFsm: 2
HasVarLatency: 1
IsPipeline: 0
IsRtlPipelined: 0
IsInstanceOverlapped: 0
IsDontTouch: 0
HasImplIP: 0
IsGatedGlobalClock: 0

+ Individual pipeline summary: 
  * Pipeline-0: initiation interval (II) = 3, depth = 5


============================================================
+ Verbose Summary: Schedule
============================================================
* Number of FSM states : 5
* Pipeline : 1
  Pipeline-0 : II = 3, D = 5, States = { 1 2 3 4 5 }
* Dataflow Pipeline: 0

* FSM state transitions: 
1 --> 2 
2 --> 3 
3 --> 4 
4 --> 5 
5 --> 

* FSM state operations: 

State 1 <SV = 0> <Delay = 1.37>
ST_1 : Operation 8 [1/1] (0.00ns)   --->   "%sum = alloca i32 1"   --->   Operation 8 'alloca' 'sum' <Predicate = true> <Delay = 0.00>
ST_1 : Operation 9 [1/1] (0.00ns)   --->   "%i = alloca i32 1"   --->   Operation 9 'alloca' 'i' <Predicate = true> <Delay = 0.00>
ST_1 : Operation 10 [1/1] (0.42ns)   --->   "%store_ln0 = store i11 0, i11 %i"   --->   Operation 10 'store' 'store_ln0' <Predicate = true> <Delay = 0.42>
ST_1 : Operation 11 [1/1] (0.42ns)   --->   "%store_ln0 = store i32 0, i32 %sum"   --->   Operation 11 'store' 'store_ln0' <Predicate = true> <Delay = 0.42>
ST_1 : Operation 12 [1/1] (0.00ns)   --->   "%br_ln0 = br void %for.inc.i144"   --->   Operation 12 'br' 'br_ln0' <Predicate = true> <Delay = 0.00>
ST_1 : Operation 13 [1/1] (0.00ns)   --->   "%i_14 = load i11 %i" [activation_accelerator.cpp:248]   --->   Operation 13 'load' 'i_14' <Predicate = true> <Delay = 0.00>
ST_1 : Operation 14 [1/1] (0.94ns)   --->   "%icmp_ln246 = icmp_eq  i11 %i_14, i11 1024" [activation_accelerator.cpp:246]   --->   Operation 14 'icmp' 'icmp_ln246' <Predicate = true> <Delay = 0.94> <CoreInst = "Cmp">   --->   Core 9 'Cmp' <Latency = 0> <II = 1> <Delay = 0.94> <FuncUnit> <Opcode : 'icmp'> <InPorts = 2> <OutPorts = 1>
ST_1 : Operation 15 [1/1] (0.00ns)   --->   "%empty = speclooptripcount i32 @_ssdm_op_SpecLoopTripCount, i64 1024, i64 1024, i64 1024"   --->   Operation 15 'speclooptripcount' 'empty' <Predicate = true> <Delay = 0.00>
ST_1 : Operation 16 [1/1] (0.79ns)   --->   "%add_ln246 = add i11 %i_14, i11 1" [activation_accelerator.cpp:246]   --->   Operation 16 'add' 'add_ln246' <Predicate = true> <Delay = 0.79> <CoreInst = "Adder">   --->   Core 1 'Adder' <Latency = 0> <II = 1> <Delay = 0.79> <FuncUnit> <Opcode : 'add' 'sub'> <InPorts = 2> <OutPorts = 1>
ST_1 : Operation 17 [1/1] (0.00ns)   --->   "%br_ln246 = br i1 %icmp_ln246, void %for.inc.i144.split, void %for.end.i146.exitStub" [activation_accelerator.cpp:246]   --->   Operation 17 'br' 'br_ln246' <Predicate = true> <Delay = 0.00>
ST_1 : Operation 18 [1/1] (0.00ns)   --->   "%lshr_ln9 = partselect i8 @_ssdm_op_PartSelect.i8.i11.i32.i32, i11 %i_14, i32 2, i32 9" [activation_accelerator.cpp:248]   --->   Operation 18 'partselect' 'lshr_ln9' <Predicate = (!icmp_ln246)> <Delay = 0.00>
ST_1 : Operation 19 [1/1] (0.00ns)   --->   "%zext_ln248 = zext i8 %lshr_ln9" [activation_accelerator.cpp:248]   --->   Operation 19 'zext' 'zext_ln248' <Predicate = (!icmp_ln246)> <Delay = 0.00>
ST_1 : Operation 20 [1/1] (0.00ns)   --->   "%x_addr = getelementptr i32 %x, i64 0, i64 %zext_ln248" [activation_accelerator.cpp:248]   --->   Operation 20 'getelementptr' 'x_addr' <Predicate = (!icmp_ln246)> <Delay = 0.00>
ST_1 : Operation 21 [1/1] (0.00ns)   --->   "%x_2_addr = getelementptr i32 %x_2, i64 0, i64 %zext_ln248" [activation_accelerator.cpp:248]   --->   Operation 21 'getelementptr' 'x_2_addr' <Predicate = (!icmp_ln246)> <Delay = 0.00>
ST_1 : Operation 22 [1/1] (0.00ns)   --->   "%x_4_addr = getelementptr i32 %x_4, i64 0, i64 %zext_ln248" [activation_accelerator.cpp:248]   --->   Operation 22 'getelementptr' 'x_4_addr' <Predicate = (!icmp_ln246)> <Delay = 0.00>
ST_1 : Operation 23 [1/1] (0.00ns)   --->   "%x_6_addr = getelementptr i32 %x_6, i64 0, i64 %zext_ln248" [activation_accelerator.cpp:248]   --->   Operation 23 'getelementptr' 'x_6_addr' <Predicate = (!icmp_ln246)> <Delay = 0.00>
ST_1 : Operation 24 [1/1] (0.00ns)   --->   "%trunc_ln248 = trunc i11 %i_14" [activation_accelerator.cpp:248]   --->   Operation 24 'trunc' 'trunc_ln248' <Predicate = (!icmp_ln246)> <Delay = 0.00>
ST_1 : Operation 25 [2/2] (1.23ns)   --->   "%x_load = load i8 %x_addr" [activation_accelerator.cpp:248]   --->   Operation 25 'load' 'x_load' <Predicate = (!icmp_ln246)> <Delay = 1.23> <CoreInst = "RAM">   --->   Core 83 'RAM' <Latency = 1> <II = 1> <Delay = 1.23> <Storage> <Opcode : 'load' 'store'> <Ports = 2> <Width = 32> <Depth = 256> <RAM>
ST_1 : Operation 26 [2/2] (1.23ns)   --->   "%x_2_load = load i8 %x_2_addr" [activation_accelerator.cpp:248]   --->   Operation 26 'load' 'x_2_load' <Predicate = (!icmp_ln246)> <Delay = 1.23> <CoreInst = "RAM">   --->   Core 83 'RAM' <Latency = 1> <II = 1> <Delay = 1.23> <Storage> <Opcode : 'load' 'store'> <Ports = 2> <Width = 32> <Depth = 256> <RAM>
ST_1 : Operation 27 [2/2] (1.23ns)   --->   "%x_4_load = load i8 %x_4_addr" [activation_accelerator.cpp:248]   --->   Operation 27 'load' 'x_4_load' <Predicate = (!icmp_ln246)> <Delay = 1.23> <CoreInst = "RAM">   --->   Core 83 'RAM' <Latency = 1> <II = 1> <Delay = 1.23> <Storage> <Opcode : 'load' 'store'> <Ports = 2> <Width = 32> <Depth = 256> <RAM>
ST_1 : Operation 28 [2/2] (1.23ns)   --->   "%x_6_load = load i8 %x_6_addr" [activation_accelerator.cpp:248]   --->   Operation 28 'load' 'x_6_load' <Predicate = (!icmp_ln246)> <Delay = 1.23> <CoreInst = "RAM">   --->   Core 83 'RAM' <Latency = 1> <II = 1> <Delay = 1.23> <Storage> <Opcode : 'load' 'store'> <Ports = 2> <Width = 32> <Depth = 256> <RAM>
ST_1 : Operation 29 [1/1] (0.42ns)   --->   "%store_ln246 = store i11 %add_ln246, i11 %i" [activation_accelerator.cpp:246]   --->   Operation 29 'store' 'store_ln246' <Predicate = (!icmp_ln246)> <Delay = 0.42>

State 2 <SV = 1> <Delay = 6.65>
ST_2 : Operation 30 [1/1] (0.00ns)   --->   "%sum_load = load i32 %sum" [activation_accelerator.cpp:248]   --->   Operation 30 'load' 'sum_load' <Predicate = (!icmp_ln246)> <Delay = 0.00>
ST_2 : Operation 31 [1/2] (1.23ns)   --->   "%x_load = load i8 %x_addr" [activation_accelerator.cpp:248]   --->   Operation 31 'load' 'x_load' <Predicate = (!icmp_ln246)> <Delay = 1.23> <CoreInst = "RAM">   --->   Core 83 'RAM' <Latency = 1> <II = 1> <Delay = 1.23> <Storage> <Opcode : 'load' 'store'> <Ports = 2> <Width = 32> <Depth = 256> <RAM>
ST_2 : Operation 32 [1/2] (1.23ns)   --->   "%x_2_load = load i8 %x_2_addr" [activation_accelerator.cpp:248]   --->   Operation 32 'load' 'x_2_load' <Predicate = (!icmp_ln246)> <Delay = 1.23> <CoreInst = "RAM">   --->   Core 83 'RAM' <Latency = 1> <II = 1> <Delay = 1.23> <Storage> <Opcode : 'load' 'store'> <Ports = 2> <Width = 32> <Depth = 256> <RAM>
ST_2 : Operation 33 [1/2] (1.23ns)   --->   "%x_4_load = load i8 %x_4_addr" [activation_accelerator.cpp:248]   --->   Operation 33 'load' 'x_4_load' <Predicate = (!icmp_ln246)> <Delay = 1.23> <CoreInst = "RAM">   --->   Core 83 'RAM' <Latency = 1> <II = 1> <Delay = 1.23> <Storage> <Opcode : 'load' 'store'> <Ports = 2> <Width = 32> <Depth = 256> <RAM>
ST_2 : Operation 34 [1/2] (1.23ns)   --->   "%x_6_load = load i8 %x_6_addr" [activation_accelerator.cpp:248]   --->   Operation 34 'load' 'x_6_load' <Predicate = (!icmp_ln246)> <Delay = 1.23> <CoreInst = "RAM">   --->   Core 83 'RAM' <Latency = 1> <II = 1> <Delay = 1.23> <Storage> <Opcode : 'load' 'store'> <Ports = 2> <Width = 32> <Depth = 256> <RAM>
ST_2 : Operation 35 [1/1] (0.52ns)   --->   "%tmp_s = mux i32 @_ssdm_op_Mux.ap_auto.4f32.i2, i32 %x_load, i32 %x_2_load, i32 %x_4_load, i32 %x_6_load, i2 %trunc_ln248" [activation_accelerator.cpp:248]   --->   Operation 35 'mux' 'tmp_s' <Predicate = (!icmp_ln246)> <Delay = 0.52> <CoreInst = "Multiplexer">   --->   Core 76 'Multiplexer' <Latency = 0> <II = 1> <Delay = 0.52> <FuncUnit> <Opcode : 'mux'> <InPorts = 2> <OutPorts = 1>
ST_2 : Operation 36 [4/4] (4.89ns)   --->   "%sum_2 = fadd i32 %sum_load, i32 %tmp_s" [activation_accelerator.cpp:248]   --->   Operation 36 'fadd' 'sum_2' <Predicate = (!icmp_ln246)> <Delay = 4.89> <CoreInst = "FAddSub_nodsp">   --->   Core 17 'FAddSub_nodsp' <Latency = 3> <II = 1> <Delay = 4.89> <FuncUnit> <Opcode : 'fadd' 'fsub'> <InPorts = 2> <OutPorts = 1>
ST_2 : Operation 44 [1/1] (0.00ns)   --->   "%sum_load_2 = load i32 %sum"   --->   Operation 44 'load' 'sum_load_2' <Predicate = (icmp_ln246)> <Delay = 0.00>
ST_2 : Operation 45 [1/1] (0.00ns)   --->   "%write_ln0 = write void @_ssdm_op_Write.ap_auto.floatP0A, i32 %sum_out, i32 %sum_load_2"   --->   Operation 45 'write' 'write_ln0' <Predicate = (icmp_ln246)> <Delay = 0.00>
ST_2 : Operation 46 [1/1] (0.00ns)   --->   "%ret_ln0 = ret"   --->   Operation 46 'ret' 'ret_ln0' <Predicate = (icmp_ln246)> <Delay = 0.00>

State 3 <SV = 2> <Delay = 4.89>
ST_3 : Operation 37 [3/4] (4.89ns)   --->   "%sum_2 = fadd i32 %sum_load, i32 %tmp_s" [activation_accelerator.cpp:248]   --->   Operation 37 'fadd' 'sum_2' <Predicate = (!icmp_ln246)> <Delay = 4.89> <CoreInst = "FAddSub_nodsp">   --->   Core 17 'FAddSub_nodsp' <Latency = 3> <II = 1> <Delay = 4.89> <FuncUnit> <Opcode : 'fadd' 'fsub'> <InPorts = 2> <OutPorts = 1>

State 4 <SV = 3> <Delay = 4.89>
ST_4 : Operation 38 [2/4] (4.89ns)   --->   "%sum_2 = fadd i32 %sum_load, i32 %tmp_s" [activation_accelerator.cpp:248]   --->   Operation 38 'fadd' 'sum_2' <Predicate = true> <Delay = 4.89> <CoreInst = "FAddSub_nodsp">   --->   Core 17 'FAddSub_nodsp' <Latency = 3> <II = 1> <Delay = 4.89> <FuncUnit> <Opcode : 'fadd' 'fsub'> <InPorts = 2> <OutPorts = 1>

State 5 <SV = 4> <Delay = 5.32>
ST_5 : Operation 39 [1/1] (0.00ns)   --->   "%specpipeline_ln247 = specpipeline void @_ssdm_op_SpecPipeline, i32 1, i32 0, i32 0, i32 0, void @empty_1" [activation_accelerator.cpp:247]   --->   Operation 39 'specpipeline' 'specpipeline_ln247' <Predicate = true> <Delay = 0.00>
ST_5 : Operation 40 [1/1] (0.00ns)   --->   "%specloopname_ln244 = specloopname void @_ssdm_op_SpecLoopName, void @empty_28" [activation_accelerator.cpp:244]   --->   Operation 40 'specloopname' 'specloopname_ln244' <Predicate = true> <Delay = 0.00>
ST_5 : Operation 41 [1/4] (4.89ns)   --->   "%sum_2 = fadd i32 %sum_load, i32 %tmp_s" [activation_accelerator.cpp:248]   --->   Operation 41 'fadd' 'sum_2' <Predicate = true> <Delay = 4.89> <CoreInst = "FAddSub_nodsp">   --->   Core 17 'FAddSub_nodsp' <Latency = 3> <II = 1> <Delay = 4.89> <FuncUnit> <Opcode : 'fadd' 'fsub'> <InPorts = 2> <OutPorts = 1>
ST_5 : Operation 42 [1/1] (0.42ns)   --->   "%store_ln246 = store i32 %sum_2, i32 %sum" [activation_accelerator.cpp:246]   --->   Operation 42 'store' 'store_ln246' <Predicate = true> <Delay = 0.42>
ST_5 : Operation 43 [1/1] (0.00ns)   --->   "%br_ln246 = br void %for.inc.i144" [activation_accelerator.cpp:246]   --->   Operation 43 'br' 'br_ln246' <Predicate = true> <Delay = 0.00>


============================================================
+ Verbose Summary: Timing violations
============================================================
Target clock period: 10ns, clock uncertainty: 2.7ns.

 <State 1>: 1.37ns
The critical path consists of the following:
	'alloca' operation ('i') [7]  (0 ns)
	'load' operation ('i', activation_accelerator.cpp:248) on local variable 'i' [12]  (0 ns)
	'getelementptr' operation ('x_addr', activation_accelerator.cpp:248) [23]  (0 ns)
	'load' operation ('x_load', activation_accelerator.cpp:248) on array 'x' [28]  (1.24 ns)
	blocking operation 0.134 ns on control path)

 <State 2>: 6.66ns
The critical path consists of the following:
	'load' operation ('x_load', activation_accelerator.cpp:248) on array 'x' [28]  (1.24 ns)
	'mux' operation ('tmp_s', activation_accelerator.cpp:248) [32]  (0.525 ns)
	'fadd' operation ('sum', activation_accelerator.cpp:248) [33]  (4.89 ns)

 <State 3>: 4.89ns
The critical path consists of the following:
	'fadd' operation ('sum', activation_accelerator.cpp:248) [33]  (4.89 ns)

 <State 4>: 4.89ns
The critical path consists of the following:
	'fadd' operation ('sum', activation_accelerator.cpp:248) [33]  (4.89 ns)

 <State 5>: 5.32ns
The critical path consists of the following:
	'fadd' operation ('sum', activation_accelerator.cpp:248) [33]  (4.89 ns)
	'store' operation ('store_ln246', activation_accelerator.cpp:246) of variable 'sum', activation_accelerator.cpp:248 on local variable 'sum' [35]  (0.427 ns)


============================================================
+ Verbose Summary: Binding
============================================================
N/A
* FSMD analyzer results:
  - Output states:
 - Input state : 
  - Chain level:
	State 1
	State 2
	State 3
	State 4
	State 5


============================================================
+ Verbose Summary: Datapath Resource usage 
============================================================
N/A
