

================================================================
== Vitis HLS Report for 'activation_accelerator_Pipeline_loop_norm11'
================================================================
* Date:           Wed Oct  8 19:21:37 2025

* Version:        2022.2 (Build 3670227 on Oct 13 2022)
* Project:        activation_accelerator
* Solution:       baseline (Vivado IP Flow Target)
* Product family: zynquplus
* Target device:  xck26-sfvc784-2LV-c


================================================================
== Performance Estimates
================================================================
+ Timing: 
    * Summary: 
    +--------+----------+----------+------------+
    |  Clock |  Target  | Estimated| Uncertainty|
    +--------+----------+----------+------------+
    |ap_clk  |  10.00 ns|  7.057 ns|     2.70 ns|
    +--------+----------+----------+------------+

+ Latency: 
    * Summary: 
    +---------+---------+-----------+-----------+------+------+---------+
    |  Latency (cycles) |   Latency (absolute)  |   Interval  | Pipeline|
    |   min   |   max   |    min    |    max    |  min |  max |   Type  |
    +---------+---------+-----------+-----------+------+------+---------+
    |     1040|     1040|  10.400 us|  10.400 us|  1040|  1040|       no|
    +---------+---------+-----------+-----------+------+------+---------+

    + Detail: 
        * Instance: 
        N/A

        * Loop: 
        +-------------+---------+---------+----------+-----------+-----------+------+----------+
        |             |  Latency (cycles) | Iteration|  Initiation Interval  | Trip |          |
        |  Loop Name  |   min   |   max   |  Latency |  achieved |   target  | Count| Pipelined|
        +-------------+---------+---------+----------+-----------+-----------+------+----------+
        |- loop_norm  |     1038|     1038|        16|          1|          1|  1024|       yes|
        +-------------+---------+---------+----------+-----------+-----------+------+----------+

============================================================
+ Verbose Summary: Synthesis Manager
============================================================
InlineROM: 1
ExposeGlobal: 0
============================================================
+ Verbose Summary: CDFG Model
============================================================
IsTopModel: 0
ResetActiveHigh: 1
IsCombinational: 0
IsDatapathOnly: 0
HasWiredReturn: 1
HasMFsm: 2
HasVarLatency: 1
IsPipeline: 0
IsRtlPipelined: 0
IsInstanceOverlapped: 0
IsDontTouch: 0
HasImplIP: 0
IsGatedGlobalClock: 0

+ Individual pipeline summary: 
  * Pipeline-0: initiation interval (II) = 1, depth = 16


============================================================
+ Verbose Summary: Schedule
============================================================
* Number of FSM states : 16
* Pipeline : 1
  Pipeline-0 : II = 1, D = 16, States = { 1 2 3 4 5 6 7 8 9 10 11 12 13 14 15 16 }
* Dataflow Pipeline: 0

* FSM state transitions: 
1 --> 2 
2 --> 3 
3 --> 4 
4 --> 5 
5 --> 6 
6 --> 7 
7 --> 8 
8 --> 9 
9 --> 10 
10 --> 11 
11 --> 12 
12 --> 13 
13 --> 14 
14 --> 15 
15 --> 16 
16 --> 

* FSM state operations: 

State 1 <SV = 0> <Delay = 1.37>
ST_1 : Operation 19 [1/1] (0.00ns)   --->   "%i = alloca i32 1"   --->   Operation 19 'alloca' 'i' <Predicate = true> <Delay = 0.00>
ST_1 : Operation 20 [1/1] (0.00ns)   --->   "%stddev_read = read i32 @_ssdm_op_Read.ap_auto.float, i32 %stddev"   --->   Operation 20 'read' 'stddev_read' <Predicate = true> <Delay = 0.00>
ST_1 : Operation 21 [1/1] (0.00ns)   --->   "%mean_read = read i32 @_ssdm_op_Read.ap_auto.float, i32 %mean"   --->   Operation 21 'read' 'mean_read' <Predicate = true> <Delay = 0.00>
ST_1 : Operation 22 [1/1] (0.42ns)   --->   "%store_ln0 = store i11 0, i11 %i"   --->   Operation 22 'store' 'store_ln0' <Predicate = true> <Delay = 0.42>
ST_1 : Operation 23 [1/1] (0.00ns)   --->   "%br_ln0 = br void %for.inc28.i152"   --->   Operation 23 'br' 'br_ln0' <Predicate = true> <Delay = 0.00>
ST_1 : Operation 24 [1/1] (0.00ns)   --->   "%i_12 = load i11 %i" [activation_accelerator.cpp:270]   --->   Operation 24 'load' 'i_12' <Predicate = true> <Delay = 0.00>
ST_1 : Operation 25 [1/1] (0.94ns)   --->   "%icmp_ln265 = icmp_eq  i11 %i_12, i11 1024" [activation_accelerator.cpp:265]   --->   Operation 25 'icmp' 'icmp_ln265' <Predicate = true> <Delay = 0.94> <CoreInst = "Cmp">   --->   Core 9 'Cmp' <Latency = 0> <II = 1> <Delay = 0.94> <FuncUnit> <Opcode : 'icmp'> <InPorts = 2> <OutPorts = 1>
ST_1 : Operation 26 [1/1] (0.00ns)   --->   "%empty = speclooptripcount i32 @_ssdm_op_SpecLoopTripCount, i64 1024, i64 1024, i64 1024"   --->   Operation 26 'speclooptripcount' 'empty' <Predicate = true> <Delay = 0.00>
ST_1 : Operation 27 [1/1] (0.79ns)   --->   "%add_ln265 = add i11 %i_12, i11 1" [activation_accelerator.cpp:265]   --->   Operation 27 'add' 'add_ln265' <Predicate = true> <Delay = 0.79> <CoreInst = "Adder">   --->   Core 1 'Adder' <Latency = 0> <II = 1> <Delay = 0.79> <FuncUnit> <Opcode : 'add' 'sub'> <InPorts = 2> <OutPorts = 1>
ST_1 : Operation 28 [1/1] (0.00ns)   --->   "%br_ln265 = br i1 %icmp_ln265, void %for.inc28.i152.split, void %if.end68.loopexit.exitStub" [activation_accelerator.cpp:265]   --->   Operation 28 'br' 'br_ln265' <Predicate = true> <Delay = 0.00>
ST_1 : Operation 29 [1/1] (0.00ns)   --->   "%lshr_ln = partselect i8 @_ssdm_op_PartSelect.i8.i11.i32.i32, i11 %i_12, i32 2, i32 9" [activation_accelerator.cpp:267]   --->   Operation 29 'partselect' 'lshr_ln' <Predicate = (!icmp_ln265)> <Delay = 0.00>
ST_1 : Operation 30 [1/1] (0.00ns)   --->   "%zext_ln267 = zext i8 %lshr_ln" [activation_accelerator.cpp:267]   --->   Operation 30 'zext' 'zext_ln267' <Predicate = (!icmp_ln265)> <Delay = 0.00>
ST_1 : Operation 31 [1/1] (0.00ns)   --->   "%x_addr = getelementptr i32 %x, i64 0, i64 %zext_ln267" [activation_accelerator.cpp:267]   --->   Operation 31 'getelementptr' 'x_addr' <Predicate = (!icmp_ln265)> <Delay = 0.00>
ST_1 : Operation 32 [1/1] (0.00ns)   --->   "%x_2_addr = getelementptr i32 %x_2, i64 0, i64 %zext_ln267" [activation_accelerator.cpp:267]   --->   Operation 32 'getelementptr' 'x_2_addr' <Predicate = (!icmp_ln265)> <Delay = 0.00>
ST_1 : Operation 33 [1/1] (0.00ns)   --->   "%x_4_addr = getelementptr i32 %x_4, i64 0, i64 %zext_ln267" [activation_accelerator.cpp:267]   --->   Operation 33 'getelementptr' 'x_4_addr' <Predicate = (!icmp_ln265)> <Delay = 0.00>
ST_1 : Operation 34 [1/1] (0.00ns)   --->   "%x_6_addr = getelementptr i32 %x_6, i64 0, i64 %zext_ln267" [activation_accelerator.cpp:267]   --->   Operation 34 'getelementptr' 'x_6_addr' <Predicate = (!icmp_ln265)> <Delay = 0.00>
ST_1 : Operation 35 [1/1] (0.00ns)   --->   "%trunc_ln267 = trunc i11 %i_12" [activation_accelerator.cpp:267]   --->   Operation 35 'trunc' 'trunc_ln267' <Predicate = (!icmp_ln265)> <Delay = 0.00>
ST_1 : Operation 36 [2/2] (1.23ns)   --->   "%x_load = load i8 %x_addr" [activation_accelerator.cpp:267]   --->   Operation 36 'load' 'x_load' <Predicate = (!icmp_ln265)> <Delay = 1.23> <CoreInst = "RAM">   --->   Core 83 'RAM' <Latency = 1> <II = 1> <Delay = 1.23> <Storage> <Opcode : 'load' 'store'> <Ports = 2> <Width = 32> <Depth = 256> <RAM>
ST_1 : Operation 37 [2/2] (1.23ns)   --->   "%x_2_load = load i8 %x_2_addr" [activation_accelerator.cpp:267]   --->   Operation 37 'load' 'x_2_load' <Predicate = (!icmp_ln265)> <Delay = 1.23> <CoreInst = "RAM">   --->   Core 83 'RAM' <Latency = 1> <II = 1> <Delay = 1.23> <Storage> <Opcode : 'load' 'store'> <Ports = 2> <Width = 32> <Depth = 256> <RAM>
ST_1 : Operation 38 [2/2] (1.23ns)   --->   "%x_4_load = load i8 %x_4_addr" [activation_accelerator.cpp:267]   --->   Operation 38 'load' 'x_4_load' <Predicate = (!icmp_ln265)> <Delay = 1.23> <CoreInst = "RAM">   --->   Core 83 'RAM' <Latency = 1> <II = 1> <Delay = 1.23> <Storage> <Opcode : 'load' 'store'> <Ports = 2> <Width = 32> <Depth = 256> <RAM>
ST_1 : Operation 39 [2/2] (1.23ns)   --->   "%x_6_load = load i8 %x_6_addr" [activation_accelerator.cpp:267]   --->   Operation 39 'load' 'x_6_load' <Predicate = (!icmp_ln265)> <Delay = 1.23> <CoreInst = "RAM">   --->   Core 83 'RAM' <Latency = 1> <II = 1> <Delay = 1.23> <Storage> <Opcode : 'load' 'store'> <Ports = 2> <Width = 32> <Depth = 256> <RAM>
ST_1 : Operation 40 [1/1] (0.00ns)   --->   "%lshr_ln270_1 = partselect i7 @_ssdm_op_PartSelect.i7.i11.i32.i32, i11 %i_12, i32 3, i32 9" [activation_accelerator.cpp:270]   --->   Operation 40 'partselect' 'lshr_ln270_1' <Predicate = (!icmp_ln265)> <Delay = 0.00>
ST_1 : Operation 41 [1/1] (0.00ns)   --->   "%trunc_ln270 = trunc i11 %i_12" [activation_accelerator.cpp:270]   --->   Operation 41 'trunc' 'trunc_ln270' <Predicate = (!icmp_ln265)> <Delay = 0.00>
ST_1 : Operation 42 [1/1] (0.44ns)   --->   "%switch_ln270 = switch i3 %trunc_ln270, void %arrayidx271.i150.case.7, i3 0, void %arrayidx271.i150.case.0, i3 1, void %arrayidx271.i150.case.1, i3 2, void %arrayidx271.i150.case.2, i3 3, void %arrayidx271.i150.case.3, i3 4, void %arrayidx271.i150.case.4, i3 5, void %arrayidx271.i150.case.5, i3 6, void %arrayidx271.i150.case.6" [activation_accelerator.cpp:270]   --->   Operation 42 'switch' 'switch_ln270' <Predicate = (!icmp_ln265)> <Delay = 0.44>
ST_1 : Operation 43 [1/1] (0.42ns)   --->   "%store_ln265 = store i11 %add_ln265, i11 %i" [activation_accelerator.cpp:265]   --->   Operation 43 'store' 'store_ln265' <Predicate = (!icmp_ln265)> <Delay = 0.42>
ST_1 : Operation 44 [1/1] (0.00ns)   --->   "%br_ln265 = br void %for.inc28.i152" [activation_accelerator.cpp:265]   --->   Operation 44 'br' 'br_ln265' <Predicate = (!icmp_ln265)> <Delay = 0.00>

State 2 <SV = 1> <Delay = 1.76>
ST_2 : Operation 45 [1/2] (1.23ns)   --->   "%x_load = load i8 %x_addr" [activation_accelerator.cpp:267]   --->   Operation 45 'load' 'x_load' <Predicate = true> <Delay = 1.23> <CoreInst = "RAM">   --->   Core 83 'RAM' <Latency = 1> <II = 1> <Delay = 1.23> <Storage> <Opcode : 'load' 'store'> <Ports = 2> <Width = 32> <Depth = 256> <RAM>
ST_2 : Operation 46 [1/2] (1.23ns)   --->   "%x_2_load = load i8 %x_2_addr" [activation_accelerator.cpp:267]   --->   Operation 46 'load' 'x_2_load' <Predicate = true> <Delay = 1.23> <CoreInst = "RAM">   --->   Core 83 'RAM' <Latency = 1> <II = 1> <Delay = 1.23> <Storage> <Opcode : 'load' 'store'> <Ports = 2> <Width = 32> <Depth = 256> <RAM>
ST_2 : Operation 47 [1/2] (1.23ns)   --->   "%x_4_load = load i8 %x_4_addr" [activation_accelerator.cpp:267]   --->   Operation 47 'load' 'x_4_load' <Predicate = true> <Delay = 1.23> <CoreInst = "RAM">   --->   Core 83 'RAM' <Latency = 1> <II = 1> <Delay = 1.23> <Storage> <Opcode : 'load' 'store'> <Ports = 2> <Width = 32> <Depth = 256> <RAM>
ST_2 : Operation 48 [1/2] (1.23ns)   --->   "%x_6_load = load i8 %x_6_addr" [activation_accelerator.cpp:267]   --->   Operation 48 'load' 'x_6_load' <Predicate = true> <Delay = 1.23> <CoreInst = "RAM">   --->   Core 83 'RAM' <Latency = 1> <II = 1> <Delay = 1.23> <Storage> <Opcode : 'load' 'store'> <Ports = 2> <Width = 32> <Depth = 256> <RAM>
ST_2 : Operation 49 [1/1] (0.52ns)   --->   "%tmp_s = mux i32 @_ssdm_op_Mux.ap_auto.4f32.i2, i32 %x_load, i32 %x_2_load, i32 %x_4_load, i32 %x_6_load, i2 %trunc_ln267" [activation_accelerator.cpp:267]   --->   Operation 49 'mux' 'tmp_s' <Predicate = true> <Delay = 0.52> <CoreInst = "Multiplexer">   --->   Core 76 'Multiplexer' <Latency = 0> <II = 1> <Delay = 0.52> <FuncUnit> <Opcode : 'mux'> <InPorts = 2> <OutPorts = 1>

State 3 <SV = 2> <Delay = 6.43>
ST_3 : Operation 50 [4/4] (6.43ns)   --->   "%diff = fsub i32 %tmp_s, i32 %mean_read" [activation_accelerator.cpp:267]   --->   Operation 50 'fsub' 'diff' <Predicate = true> <Delay = 6.43> <CoreInst = "FAddSub_fulldsp">   --->   Core 18 'FAddSub_fulldsp' <Latency = 3> <II = 1> <Delay = 6.43> <FuncUnit> <Opcode : 'fadd' 'fsub'> <InPorts = 2> <OutPorts = 1>

State 4 <SV = 3> <Delay = 6.43>
ST_4 : Operation 51 [3/4] (6.43ns)   --->   "%diff = fsub i32 %tmp_s, i32 %mean_read" [activation_accelerator.cpp:267]   --->   Operation 51 'fsub' 'diff' <Predicate = true> <Delay = 6.43> <CoreInst = "FAddSub_fulldsp">   --->   Core 18 'FAddSub_fulldsp' <Latency = 3> <II = 1> <Delay = 6.43> <FuncUnit> <Opcode : 'fadd' 'fsub'> <InPorts = 2> <OutPorts = 1>

State 5 <SV = 4> <Delay = 6.43>
ST_5 : Operation 52 [2/4] (6.43ns)   --->   "%diff = fsub i32 %tmp_s, i32 %mean_read" [activation_accelerator.cpp:267]   --->   Operation 52 'fsub' 'diff' <Predicate = true> <Delay = 6.43> <CoreInst = "FAddSub_fulldsp">   --->   Core 18 'FAddSub_fulldsp' <Latency = 3> <II = 1> <Delay = 6.43> <FuncUnit> <Opcode : 'fadd' 'fsub'> <InPorts = 2> <OutPorts = 1>

State 6 <SV = 5> <Delay = 6.43>
ST_6 : Operation 53 [1/4] (6.43ns)   --->   "%diff = fsub i32 %tmp_s, i32 %mean_read" [activation_accelerator.cpp:267]   --->   Operation 53 'fsub' 'diff' <Predicate = true> <Delay = 6.43> <CoreInst = "FAddSub_fulldsp">   --->   Core 18 'FAddSub_fulldsp' <Latency = 3> <II = 1> <Delay = 6.43> <FuncUnit> <Opcode : 'fadd' 'fsub'> <InPorts = 2> <OutPorts = 1>

State 7 <SV = 6> <Delay = 7.05>
ST_7 : Operation 54 [9/9] (7.05ns)   --->   "%y_val = fdiv i32 %diff, i32 %stddev_read" [activation_accelerator.cpp:268]   --->   Operation 54 'fdiv' 'y_val' <Predicate = true> <Delay = 7.05> <CoreInst = "FDiv">   --->   Core 20 'FDiv' <Latency = 8> <II = 1> <Delay = 7.05> <FuncUnit> <Opcode : 'fdiv' 'frem'> <InPorts = 2> <OutPorts = 1>

State 8 <SV = 7> <Delay = 7.05>
ST_8 : Operation 55 [8/9] (7.05ns)   --->   "%y_val = fdiv i32 %diff, i32 %stddev_read" [activation_accelerator.cpp:268]   --->   Operation 55 'fdiv' 'y_val' <Predicate = true> <Delay = 7.05> <CoreInst = "FDiv">   --->   Core 20 'FDiv' <Latency = 8> <II = 1> <Delay = 7.05> <FuncUnit> <Opcode : 'fdiv' 'frem'> <InPorts = 2> <OutPorts = 1>

State 9 <SV = 8> <Delay = 7.05>
ST_9 : Operation 56 [7/9] (7.05ns)   --->   "%y_val = fdiv i32 %diff, i32 %stddev_read" [activation_accelerator.cpp:268]   --->   Operation 56 'fdiv' 'y_val' <Predicate = true> <Delay = 7.05> <CoreInst = "FDiv">   --->   Core 20 'FDiv' <Latency = 8> <II = 1> <Delay = 7.05> <FuncUnit> <Opcode : 'fdiv' 'frem'> <InPorts = 2> <OutPorts = 1>

State 10 <SV = 9> <Delay = 7.05>
ST_10 : Operation 57 [6/9] (7.05ns)   --->   "%y_val = fdiv i32 %diff, i32 %stddev_read" [activation_accelerator.cpp:268]   --->   Operation 57 'fdiv' 'y_val' <Predicate = true> <Delay = 7.05> <CoreInst = "FDiv">   --->   Core 20 'FDiv' <Latency = 8> <II = 1> <Delay = 7.05> <FuncUnit> <Opcode : 'fdiv' 'frem'> <InPorts = 2> <OutPorts = 1>

State 11 <SV = 10> <Delay = 7.05>
ST_11 : Operation 58 [5/9] (7.05ns)   --->   "%y_val = fdiv i32 %diff, i32 %stddev_read" [activation_accelerator.cpp:268]   --->   Operation 58 'fdiv' 'y_val' <Predicate = true> <Delay = 7.05> <CoreInst = "FDiv">   --->   Core 20 'FDiv' <Latency = 8> <II = 1> <Delay = 7.05> <FuncUnit> <Opcode : 'fdiv' 'frem'> <InPorts = 2> <OutPorts = 1>

State 12 <SV = 11> <Delay = 7.05>
ST_12 : Operation 59 [4/9] (7.05ns)   --->   "%y_val = fdiv i32 %diff, i32 %stddev_read" [activation_accelerator.cpp:268]   --->   Operation 59 'fdiv' 'y_val' <Predicate = true> <Delay = 7.05> <CoreInst = "FDiv">   --->   Core 20 'FDiv' <Latency = 8> <II = 1> <Delay = 7.05> <FuncUnit> <Opcode : 'fdiv' 'frem'> <InPorts = 2> <OutPorts = 1>

State 13 <SV = 12> <Delay = 7.05>
ST_13 : Operation 60 [3/9] (7.05ns)   --->   "%y_val = fdiv i32 %diff, i32 %stddev_read" [activation_accelerator.cpp:268]   --->   Operation 60 'fdiv' 'y_val' <Predicate = true> <Delay = 7.05> <CoreInst = "FDiv">   --->   Core 20 'FDiv' <Latency = 8> <II = 1> <Delay = 7.05> <FuncUnit> <Opcode : 'fdiv' 'frem'> <InPorts = 2> <OutPorts = 1>

State 14 <SV = 13> <Delay = 7.05>
ST_14 : Operation 61 [2/9] (7.05ns)   --->   "%y_val = fdiv i32 %diff, i32 %stddev_read" [activation_accelerator.cpp:268]   --->   Operation 61 'fdiv' 'y_val' <Predicate = true> <Delay = 7.05> <CoreInst = "FDiv">   --->   Core 20 'FDiv' <Latency = 8> <II = 1> <Delay = 7.05> <FuncUnit> <Opcode : 'fdiv' 'frem'> <InPorts = 2> <OutPorts = 1>

State 15 <SV = 14> <Delay = 7.05>
ST_15 : Operation 62 [1/9] (7.05ns)   --->   "%y_val = fdiv i32 %diff, i32 %stddev_read" [activation_accelerator.cpp:268]   --->   Operation 62 'fdiv' 'y_val' <Predicate = true> <Delay = 7.05> <CoreInst = "FDiv">   --->   Core 20 'FDiv' <Latency = 8> <II = 1> <Delay = 7.05> <FuncUnit> <Opcode : 'fdiv' 'frem'> <InPorts = 2> <OutPorts = 1>
ST_15 : Operation 63 [1/1] (0.00ns)   --->   "%bitcast_ln270 = bitcast i32 %y_val" [activation_accelerator.cpp:270]   --->   Operation 63 'bitcast' 'bitcast_ln270' <Predicate = true> <Delay = 0.00>
ST_15 : Operation 64 [1/1] (0.00ns)   --->   "%trunc_ln = partselect i16 @_ssdm_op_PartSelect.i16.i32.i32.i32, i32 %bitcast_ln270, i32 16, i32 31" [activation_accelerator.cpp:270]   --->   Operation 64 'partselect' 'trunc_ln' <Predicate = true> <Delay = 0.00>
ST_15 : Operation 92 [1/1] (0.00ns)   --->   "%ret_ln0 = ret"   --->   Operation 92 'ret' 'ret_ln0' <Predicate = (icmp_ln265)> <Delay = 0.00>

State 16 <SV = 15> <Delay = 1.23>
ST_16 : Operation 65 [1/1] (0.00ns)   --->   "%specpipeline_ln266 = specpipeline void @_ssdm_op_SpecPipeline, i32 1, i32 0, i32 0, i32 0, void @empty_1" [activation_accelerator.cpp:266]   --->   Operation 65 'specpipeline' 'specpipeline_ln266' <Predicate = true> <Delay = 0.00>
ST_16 : Operation 66 [1/1] (0.00ns)   --->   "%specloopname_ln265 = specloopname void @_ssdm_op_SpecLoopName, void @empty_3" [activation_accelerator.cpp:265]   --->   Operation 66 'specloopname' 'specloopname_ln265' <Predicate = true> <Delay = 0.00>
ST_16 : Operation 67 [1/1] (0.00ns)   --->   "%zext_ln270 = zext i7 %lshr_ln270_1" [activation_accelerator.cpp:270]   --->   Operation 67 'zext' 'zext_ln270' <Predicate = true> <Delay = 0.00>
ST_16 : Operation 68 [1/1] (0.00ns)   --->   "%activation_accelerator_unsigned_short_unsigned_short_unsigned_short_int_i_40 = getelementptr i16 %activation_accelerator_unsigned_short_unsigned_short_unsigned_short_int_i_7, i64 0, i64 %zext_ln270" [activation_accelerator.cpp:270]   --->   Operation 68 'getelementptr' 'activation_accelerator_unsigned_short_unsigned_short_unsigned_short_int_i_40' <Predicate = true> <Delay = 0.00>
ST_16 : Operation 69 [1/1] (0.00ns)   --->   "%activation_accelerator_unsigned_short_unsigned_short_unsigned_short_int_i_41 = getelementptr i16 %activation_accelerator_unsigned_short_unsigned_short_unsigned_short_int_i_6, i64 0, i64 %zext_ln270" [activation_accelerator.cpp:270]   --->   Operation 69 'getelementptr' 'activation_accelerator_unsigned_short_unsigned_short_unsigned_short_int_i_41' <Predicate = true> <Delay = 0.00>
ST_16 : Operation 70 [1/1] (0.00ns)   --->   "%activation_accelerator_unsigned_short_unsigned_short_unsigned_short_int_i_42 = getelementptr i16 %activation_accelerator_unsigned_short_unsigned_short_unsigned_short_int_i_5, i64 0, i64 %zext_ln270" [activation_accelerator.cpp:270]   --->   Operation 70 'getelementptr' 'activation_accelerator_unsigned_short_unsigned_short_unsigned_short_int_i_42' <Predicate = true> <Delay = 0.00>
ST_16 : Operation 71 [1/1] (0.00ns)   --->   "%activation_accelerator_unsigned_short_unsigned_short_unsigned_short_int_i_43 = getelementptr i16 %activation_accelerator_unsigned_short_unsigned_short_unsigned_short_int_i_4, i64 0, i64 %zext_ln270" [activation_accelerator.cpp:270]   --->   Operation 71 'getelementptr' 'activation_accelerator_unsigned_short_unsigned_short_unsigned_short_int_i_43' <Predicate = true> <Delay = 0.00>
ST_16 : Operation 72 [1/1] (0.00ns)   --->   "%activation_accelerator_unsigned_short_unsigned_short_unsigned_short_int_i_44 = getelementptr i16 %activation_accelerator_unsigned_short_unsigned_short_unsigned_short_int_i_3, i64 0, i64 %zext_ln270" [activation_accelerator.cpp:270]   --->   Operation 72 'getelementptr' 'activation_accelerator_unsigned_short_unsigned_short_unsigned_short_int_i_44' <Predicate = true> <Delay = 0.00>
ST_16 : Operation 73 [1/1] (0.00ns)   --->   "%activation_accelerator_unsigned_short_unsigned_short_unsigned_short_int_i_45 = getelementptr i16 %activation_accelerator_unsigned_short_unsigned_short_unsigned_short_int_i_2, i64 0, i64 %zext_ln270" [activation_accelerator.cpp:270]   --->   Operation 73 'getelementptr' 'activation_accelerator_unsigned_short_unsigned_short_unsigned_short_int_i_45' <Predicate = true> <Delay = 0.00>
ST_16 : Operation 74 [1/1] (0.00ns)   --->   "%activation_accelerator_unsigned_short_unsigned_short_unsigned_short_int_i_46 = getelementptr i16 %activation_accelerator_unsigned_short_unsigned_short_unsigned_short_int_i_1, i64 0, i64 %zext_ln270" [activation_accelerator.cpp:270]   --->   Operation 74 'getelementptr' 'activation_accelerator_unsigned_short_unsigned_short_unsigned_short_int_i_46' <Predicate = true> <Delay = 0.00>
ST_16 : Operation 75 [1/1] (0.00ns)   --->   "%activation_accelerator_unsigned_short_unsigned_short_unsigned_short_int_i_47 = getelementptr i16 %activation_accelerator_unsigned_short_unsigned_short_unsigned_short_int_i, i64 0, i64 %zext_ln270" [activation_accelerator.cpp:270]   --->   Operation 75 'getelementptr' 'activation_accelerator_unsigned_short_unsigned_short_unsigned_short_int_i_47' <Predicate = true> <Delay = 0.00>
ST_16 : Operation 76 [1/1] (1.23ns)   --->   "%store_ln270 = store i16 %trunc_ln, i7 %activation_accelerator_unsigned_short_unsigned_short_unsigned_short_int_i_46" [activation_accelerator.cpp:270]   --->   Operation 76 'store' 'store_ln270' <Predicate = (trunc_ln270 == 6)> <Delay = 1.23> <CoreInst = "RAM">   --->   Core 83 'RAM' <Latency = 1> <II = 1> <Delay = 1.23> <Storage> <Opcode : 'load' 'store'> <Ports = 2> <Width = 16> <Depth = 128> <RAM>
ST_16 : Operation 77 [1/1] (0.00ns)   --->   "%br_ln270 = br void %arrayidx271.i150.exit" [activation_accelerator.cpp:270]   --->   Operation 77 'br' 'br_ln270' <Predicate = (trunc_ln270 == 6)> <Delay = 0.00>
ST_16 : Operation 78 [1/1] (1.23ns)   --->   "%store_ln270 = store i16 %trunc_ln, i7 %activation_accelerator_unsigned_short_unsigned_short_unsigned_short_int_i_45" [activation_accelerator.cpp:270]   --->   Operation 78 'store' 'store_ln270' <Predicate = (trunc_ln270 == 5)> <Delay = 1.23> <CoreInst = "RAM">   --->   Core 83 'RAM' <Latency = 1> <II = 1> <Delay = 1.23> <Storage> <Opcode : 'load' 'store'> <Ports = 2> <Width = 16> <Depth = 128> <RAM>
ST_16 : Operation 79 [1/1] (0.00ns)   --->   "%br_ln270 = br void %arrayidx271.i150.exit" [activation_accelerator.cpp:270]   --->   Operation 79 'br' 'br_ln270' <Predicate = (trunc_ln270 == 5)> <Delay = 0.00>
ST_16 : Operation 80 [1/1] (1.23ns)   --->   "%store_ln270 = store i16 %trunc_ln, i7 %activation_accelerator_unsigned_short_unsigned_short_unsigned_short_int_i_44" [activation_accelerator.cpp:270]   --->   Operation 80 'store' 'store_ln270' <Predicate = (trunc_ln270 == 4)> <Delay = 1.23> <CoreInst = "RAM">   --->   Core 83 'RAM' <Latency = 1> <II = 1> <Delay = 1.23> <Storage> <Opcode : 'load' 'store'> <Ports = 2> <Width = 16> <Depth = 128> <RAM>
ST_16 : Operation 81 [1/1] (0.00ns)   --->   "%br_ln270 = br void %arrayidx271.i150.exit" [activation_accelerator.cpp:270]   --->   Operation 81 'br' 'br_ln270' <Predicate = (trunc_ln270 == 4)> <Delay = 0.00>
ST_16 : Operation 82 [1/1] (1.23ns)   --->   "%store_ln270 = store i16 %trunc_ln, i7 %activation_accelerator_unsigned_short_unsigned_short_unsigned_short_int_i_43" [activation_accelerator.cpp:270]   --->   Operation 82 'store' 'store_ln270' <Predicate = (trunc_ln270 == 3)> <Delay = 1.23> <CoreInst = "RAM">   --->   Core 83 'RAM' <Latency = 1> <II = 1> <Delay = 1.23> <Storage> <Opcode : 'load' 'store'> <Ports = 2> <Width = 16> <Depth = 128> <RAM>
ST_16 : Operation 83 [1/1] (0.00ns)   --->   "%br_ln270 = br void %arrayidx271.i150.exit" [activation_accelerator.cpp:270]   --->   Operation 83 'br' 'br_ln270' <Predicate = (trunc_ln270 == 3)> <Delay = 0.00>
ST_16 : Operation 84 [1/1] (1.23ns)   --->   "%store_ln270 = store i16 %trunc_ln, i7 %activation_accelerator_unsigned_short_unsigned_short_unsigned_short_int_i_42" [activation_accelerator.cpp:270]   --->   Operation 84 'store' 'store_ln270' <Predicate = (trunc_ln270 == 2)> <Delay = 1.23> <CoreInst = "RAM">   --->   Core 83 'RAM' <Latency = 1> <II = 1> <Delay = 1.23> <Storage> <Opcode : 'load' 'store'> <Ports = 2> <Width = 16> <Depth = 128> <RAM>
ST_16 : Operation 85 [1/1] (0.00ns)   --->   "%br_ln270 = br void %arrayidx271.i150.exit" [activation_accelerator.cpp:270]   --->   Operation 85 'br' 'br_ln270' <Predicate = (trunc_ln270 == 2)> <Delay = 0.00>
ST_16 : Operation 86 [1/1] (1.23ns)   --->   "%store_ln270 = store i16 %trunc_ln, i7 %activation_accelerator_unsigned_short_unsigned_short_unsigned_short_int_i_41" [activation_accelerator.cpp:270]   --->   Operation 86 'store' 'store_ln270' <Predicate = (trunc_ln270 == 1)> <Delay = 1.23> <CoreInst = "RAM">   --->   Core 83 'RAM' <Latency = 1> <II = 1> <Delay = 1.23> <Storage> <Opcode : 'load' 'store'> <Ports = 2> <Width = 16> <Depth = 128> <RAM>
ST_16 : Operation 87 [1/1] (0.00ns)   --->   "%br_ln270 = br void %arrayidx271.i150.exit" [activation_accelerator.cpp:270]   --->   Operation 87 'br' 'br_ln270' <Predicate = (trunc_ln270 == 1)> <Delay = 0.00>
ST_16 : Operation 88 [1/1] (1.23ns)   --->   "%store_ln270 = store i16 %trunc_ln, i7 %activation_accelerator_unsigned_short_unsigned_short_unsigned_short_int_i_40" [activation_accelerator.cpp:270]   --->   Operation 88 'store' 'store_ln270' <Predicate = (trunc_ln270 == 0)> <Delay = 1.23> <CoreInst = "RAM">   --->   Core 83 'RAM' <Latency = 1> <II = 1> <Delay = 1.23> <Storage> <Opcode : 'load' 'store'> <Ports = 2> <Width = 16> <Depth = 128> <RAM>
ST_16 : Operation 89 [1/1] (0.00ns)   --->   "%br_ln270 = br void %arrayidx271.i150.exit" [activation_accelerator.cpp:270]   --->   Operation 89 'br' 'br_ln270' <Predicate = (trunc_ln270 == 0)> <Delay = 0.00>
ST_16 : Operation 90 [1/1] (1.23ns)   --->   "%store_ln270 = store i16 %trunc_ln, i7 %activation_accelerator_unsigned_short_unsigned_short_unsigned_short_int_i_47" [activation_accelerator.cpp:270]   --->   Operation 90 'store' 'store_ln270' <Predicate = (trunc_ln270 == 7)> <Delay = 1.23> <CoreInst = "RAM">   --->   Core 83 'RAM' <Latency = 1> <II = 1> <Delay = 1.23> <Storage> <Opcode : 'load' 'store'> <Ports = 2> <Width = 16> <Depth = 128> <RAM>
ST_16 : Operation 91 [1/1] (0.00ns)   --->   "%br_ln270 = br void %arrayidx271.i150.exit" [activation_accelerator.cpp:270]   --->   Operation 91 'br' 'br_ln270' <Predicate = (trunc_ln270 == 7)> <Delay = 0.00>


============================================================
+ Verbose Summary: Timing violations
============================================================
Target clock period: 10ns, clock uncertainty: 2.7ns.

 <State 1>: 1.37ns
The critical path consists of the following:
	'alloca' operation ('i') [15]  (0 ns)
	'load' operation ('i', activation_accelerator.cpp:270) on local variable 'i' [21]  (0 ns)
	'getelementptr' operation ('x_addr', activation_accelerator.cpp:267) [31]  (0 ns)
	'load' operation ('x_load', activation_accelerator.cpp:267) on array 'x' [36]  (1.24 ns)
	blocking operation 0.134 ns on control path)

 <State 2>: 1.76ns
The critical path consists of the following:
	'load' operation ('x_load', activation_accelerator.cpp:267) on array 'x' [36]  (1.24 ns)
	'mux' operation ('tmp_s', activation_accelerator.cpp:267) [40]  (0.525 ns)

 <State 3>: 6.44ns
The critical path consists of the following:
	'fsub' operation ('diff', activation_accelerator.cpp:267) [41]  (6.44 ns)

 <State 4>: 6.44ns
The critical path consists of the following:
	'fsub' operation ('diff', activation_accelerator.cpp:267) [41]  (6.44 ns)

 <State 5>: 6.44ns
The critical path consists of the following:
	'fsub' operation ('diff', activation_accelerator.cpp:267) [41]  (6.44 ns)

 <State 6>: 6.44ns
The critical path consists of the following:
	'fsub' operation ('diff', activation_accelerator.cpp:267) [41]  (6.44 ns)

 <State 7>: 7.06ns
The critical path consists of the following:
	'fdiv' operation ('y_val', activation_accelerator.cpp:268) [42]  (7.06 ns)

 <State 8>: 7.06ns
The critical path consists of the following:
	'fdiv' operation ('y_val', activation_accelerator.cpp:268) [42]  (7.06 ns)

 <State 9>: 7.06ns
The critical path consists of the following:
	'fdiv' operation ('y_val', activation_accelerator.cpp:268) [42]  (7.06 ns)

 <State 10>: 7.06ns
The critical path consists of the following:
	'fdiv' operation ('y_val', activation_accelerator.cpp:268) [42]  (7.06 ns)

 <State 11>: 7.06ns
The critical path consists of the following:
	'fdiv' operation ('y_val', activation_accelerator.cpp:268) [42]  (7.06 ns)

 <State 12>: 7.06ns
The critical path consists of the following:
	'fdiv' operation ('y_val', activation_accelerator.cpp:268) [42]  (7.06 ns)

 <State 13>: 7.06ns
The critical path consists of the following:
	'fdiv' operation ('y_val', activation_accelerator.cpp:268) [42]  (7.06 ns)

 <State 14>: 7.06ns
The critical path consists of the following:
	'fdiv' operation ('y_val', activation_accelerator.cpp:268) [42]  (7.06 ns)

 <State 15>: 7.06ns
The critical path consists of the following:
	'fdiv' operation ('y_val', activation_accelerator.cpp:268) [42]  (7.06 ns)

 <State 16>: 1.24ns
The critical path consists of the following:
	'getelementptr' operation ('activation_accelerator_unsigned_short_unsigned_short_unsigned_short_int_i_47', activation_accelerator.cpp:270) [54]  (0 ns)
	'store' operation ('store_ln270', activation_accelerator.cpp:270) of variable 'trunc_ln', activation_accelerator.cpp:270 on array 'activation_accelerator_unsigned_short_unsigned_short_unsigned_short_int_i' [79]  (1.24 ns)


============================================================
+ Verbose Summary: Binding
============================================================
N/A
* FSMD analyzer results:
  - Output states:
 - Input state : 
  - Chain level:
	State 1
	State 2
	State 3
	State 4
	State 5
	State 6
	State 7
	State 8
	State 9
	State 10
	State 11
	State 12
	State 13
	State 14
	State 15
	State 16


============================================================
+ Verbose Summary: Datapath Resource usage 
============================================================
N/A
