

================================================================
== Vitis HLS Report for 'p_hls_fptoui_float_i16'
================================================================
* Date:           Thu Oct 16 16:49:47 2025

* Version:        2022.2 (Build 3670227 on Oct 13 2022)
* Project:        activation_accelerator
* Solution:       baseline (Vivado IP Flow Target)
* Product family: zynquplus
* Target device:  xck26-sfvc784-2LV-c


================================================================
== Performance Estimates
================================================================
+ Timing: 
    * Summary: 
    +--------+----------+----------+------------+
    |  Clock |  Target  | Estimated| Uncertainty|
    +--------+----------+----------+------------+
    |ap_clk  |  10.00 ns|  2.551 ns|     2.70 ns|
    +--------+----------+----------+------------+

+ Latency: 
    * Summary: 
    +---------+---------+----------+----------+-----+-----+---------+
    |  Latency (cycles) |  Latency (absolute) |  Interval | Pipeline|
    |   min   |   max   |    min   |    max   | min | max |   Type  |
    +---------+---------+----------+----------+-----+-----+---------+
    |        0|        0|      0 ns|      0 ns|    1|    1|      yes|
    +---------+---------+----------+----------+-----+-----+---------+

    + Detail: 
        * Instance: 
        N/A

        * Loop: 
        N/A

============================================================
+ Verbose Summary: Synthesis Manager
============================================================
InlineROM: 1
ExposeGlobal: 0
============================================================
+ Verbose Summary: CDFG Model
============================================================
IsTopModel: 0
ResetActiveHigh: 1
IsCombinational: 0
IsDatapathOnly: 0
HasWiredReturn: 1
HasMFsm: 2
HasVarLatency: 0
IsPipeline: 1
IsRtlPipelined: 0
IsInstanceOverlapped: 0
IsDontTouch: 0
HasImplIP: 0
IsGatedGlobalClock: 0

+ Individual pipeline summary: 
  * Pipeline-0: initiation interval (II) = 1, depth = 1


============================================================
+ Verbose Summary: Schedule
============================================================
* Number of FSM states : 1
* Pipeline : 1
  Pipeline-0 : II = 1, D = 1, States = { 1 }
* Dataflow Pipeline: 0

* FSM state transitions: 
1 --> 

* FSM state operations: 

State 1 <SV = 0> <Delay = 2.55>
ST_1 : Operation 2 [1/1] (0.00ns)   --->   "%x_read = read i32 @_ssdm_op_Read.ap_auto.float, i32 %x" [/wrk/ci/prod/2022.2/hls_product/continuous/608/2022.2/src/shared/hls/clib/hlsmath/src/lib_floatconversion.cpp:64]   --->   Operation 2 'read' 'x_read' <Predicate = true> <Delay = 0.00>
ST_1 : Operation 3 [1/1] (0.00ns)   --->   "%data_V = bitcast i32 %x_read" [/wrk/ci/prod/2022.2/hls_product/continuous/608/2022.2/src/shared/hls/clib/src/hls/utils/x_hls_utils.h:317]   --->   Operation 3 'bitcast' 'data_V' <Predicate = true> <Delay = 0.00>
ST_1 : Operation 4 [1/1] (0.00ns)   --->   "%xs_exp_V = partselect i8 @_ssdm_op_PartSelect.i8.i32.i32.i32, i32 %data_V, i32 23, i32 30"   --->   Operation 4 'partselect' 'xs_exp_V' <Predicate = true> <Delay = 0.00>
ST_1 : Operation 5 [1/1] (0.00ns)   --->   "%p_Result_s = trunc i32 %data_V"   --->   Operation 5 'trunc' 'p_Result_s' <Predicate = true> <Delay = 0.00>
ST_1 : Operation 6 [1/1] (0.00ns)   --->   "%mantissa = bitconcatenate i25 @_ssdm_op_BitConcatenate.i25.i1.i23.i1, i1 1, i23 %p_Result_s, i1 0" [/wrk/ci/prod/2022.2/hls_product/continuous/608/2022.2/src/shared/hls/clib/hlsmath/include/FloatingPoint/hls_case_IEEE754.h:68]   --->   Operation 6 'bitconcatenate' 'mantissa' <Predicate = true> <Delay = 0.00>
ST_1 : Operation 7 [1/1] (0.00ns)   --->   "%zext_ln68 = zext i25 %mantissa" [/wrk/ci/prod/2022.2/hls_product/continuous/608/2022.2/src/shared/hls/clib/hlsmath/include/FloatingPoint/hls_case_IEEE754.h:68]   --->   Operation 7 'zext' 'zext_ln68' <Predicate = true> <Delay = 0.00>
ST_1 : Operation 8 [1/1] (0.00ns)   --->   "%zext_ln346 = zext i8 %xs_exp_V" [/wrk/ci/prod/2022.2/hls_product/continuous/608/2022.2/src/shared/hls/clib/src/hls/utils/x_hls_utils.h:346]   --->   Operation 8 'zext' 'zext_ln346' <Predicate = true> <Delay = 0.00>
ST_1 : Operation 9 [1/1] (0.76ns)   --->   "%add_ln346 = add i9 %zext_ln346, i9 385" [/wrk/ci/prod/2022.2/hls_product/continuous/608/2022.2/src/shared/hls/clib/src/hls/utils/x_hls_utils.h:346]   --->   Operation 9 'add' 'add_ln346' <Predicate = true> <Delay = 0.76> <CoreInst = "Adder">   --->   Core 1 'Adder' <Latency = 0> <II = 1> <Delay = 0.76> <FuncUnit> <Opcode : 'add' 'sub'> <InPorts = 2> <OutPorts = 1>
ST_1 : Operation 10 [1/1] (0.00ns)   --->   "%isNeg = bitselect i1 @_ssdm_op_BitSelect.i1.i9.i32, i9 %add_ln346, i32 8"   --->   Operation 10 'bitselect' 'isNeg' <Predicate = true> <Delay = 0.00>
ST_1 : Operation 11 [1/1] (0.76ns)   --->   "%sub_ln1512 = sub i8 127, i8 %xs_exp_V"   --->   Operation 11 'sub' 'sub_ln1512' <Predicate = (isNeg)> <Delay = 0.76> <CoreInst = "Adder">   --->   Core 1 'Adder' <Latency = 0> <II = 1> <Delay = 0.76> <FuncUnit> <Opcode : 'add' 'sub'> <InPorts = 2> <OutPorts = 1>
ST_1 : Operation 12 [1/1] (0.00ns)   --->   "%sext_ln1512 = sext i8 %sub_ln1512"   --->   Operation 12 'sext' 'sext_ln1512' <Predicate = (isNeg)> <Delay = 0.00>
ST_1 : Operation 13 [1/1] (0.39ns)   --->   "%ush = select i1 %isNeg, i9 %sext_ln1512, i9 %add_ln346"   --->   Operation 13 'select' 'ush' <Predicate = true> <Delay = 0.39> <CoreInst = "Sel">   --->   Core 73 'Sel' <Latency = 0> <II = 1> <Delay = 0.39> <FuncUnit> <Opcode : 'select'> <InPorts = 3> <OutPorts = 1>
ST_1 : Operation 14 [1/1] (0.00ns)   --->   "%sext_ln1488 = sext i9 %ush"   --->   Operation 14 'sext' 'sext_ln1488' <Predicate = true> <Delay = 0.00>
ST_1 : Operation 15 [1/1] (0.00ns)   --->   "%zext_ln1488 = zext i32 %sext_ln1488"   --->   Operation 15 'zext' 'zext_ln1488' <Predicate = true> <Delay = 0.00>
ST_1 : Operation 16 [1/1] (0.00ns) (grouped into LUT with out node val)   --->   "%r_V = lshr i63 %zext_ln68, i63 %zext_ln1488"   --->   Operation 16 'lshr' 'r_V' <Predicate = (isNeg)> <Delay = 0.00> <CoreInst = "Shifter">   --->   Core 75 'Shifter' <Latency = 0> <II = 1> <Delay = 1.38> <FuncUnit> <Opcode : 'shl' 'lshr' 'ashr'> <InPorts = 2> <OutPorts = 1>
ST_1 : Operation 17 [1/1] (0.00ns) (grouped into LUT with out node val)   --->   "%r_V_1 = shl i63 %zext_ln68, i63 %zext_ln1488"   --->   Operation 17 'shl' 'r_V_1' <Predicate = (!isNeg)> <Delay = 0.00> <CoreInst = "Shifter">   --->   Core 75 'Shifter' <Latency = 0> <II = 1> <Delay = 1.38> <FuncUnit> <Opcode : 'shl' 'lshr' 'ashr'> <InPorts = 2> <OutPorts = 1>
ST_1 : Operation 18 [1/1] (0.00ns) (grouped into LUT with out node val)   --->   "%tmp = bitselect i1 @_ssdm_op_BitSelect.i1.i63.i32, i63 %r_V, i32 24"   --->   Operation 18 'bitselect' 'tmp' <Predicate = (isNeg)> <Delay = 0.00>
ST_1 : Operation 19 [1/1] (0.00ns) (grouped into LUT with out node val)   --->   "%zext_ln818 = zext i1 %tmp"   --->   Operation 19 'zext' 'zext_ln818' <Predicate = (isNeg)> <Delay = 0.00>
ST_1 : Operation 20 [1/1] (0.00ns) (grouped into LUT with out node val)   --->   "%tmp_s = partselect i16 @_ssdm_op_PartSelect.i16.i63.i32.i32, i63 %r_V_1, i32 24, i32 39"   --->   Operation 20 'partselect' 'tmp_s' <Predicate = (!isNeg)> <Delay = 0.00>
ST_1 : Operation 21 [1/1] (1.38ns) (out node of the LUT)   --->   "%val = select i1 %isNeg, i16 %zext_ln818, i16 %tmp_s"   --->   Operation 21 'select' 'val' <Predicate = true> <Delay = 1.38> <CoreInst = "Sel">   --->   Core 73 'Sel' <Latency = 0> <II = 1> <Delay = 0.35> <FuncUnit> <Opcode : 'select'> <InPorts = 3> <OutPorts = 1>
ST_1 : Operation 22 [1/1] (0.00ns)   --->   "%ret_ln64 = ret i16 %val" [/wrk/ci/prod/2022.2/hls_product/continuous/608/2022.2/src/shared/hls/clib/hlsmath/src/lib_floatconversion.cpp:64]   --->   Operation 22 'ret' 'ret_ln64' <Predicate = true> <Delay = 0.00>


============================================================
+ Verbose Summary: Timing violations
============================================================
Target clock period: 10ns, clock uncertainty: 2.7ns.

 <State 1>: 2.55ns
The critical path consists of the following:
	wire read operation ('x', /wrk/ci/prod/2022.2/hls_product/continuous/608/2022.2/src/shared/hls/clib/hlsmath/src/lib_floatconversion.cpp:64) on port 'x' (/wrk/ci/prod/2022.2/hls_product/continuous/608/2022.2/src/shared/hls/clib/hlsmath/src/lib_floatconversion.cpp:64) [2]  (0 ns)
	'sub' operation ('sub_ln1512') [11]  (0.765 ns)
	'select' operation ('ush') [13]  (0.398 ns)
	'shl' operation ('r.V') [17]  (0 ns)
	'select' operation ('val') [21]  (1.39 ns)


============================================================
+ Verbose Summary: Binding
============================================================
N/A
* FSMD analyzer results:
  - Output states:
 - Input state : 
  - Chain level:
	State 1


============================================================
+ Verbose Summary: Datapath Resource usage 
============================================================
N/A
