

================================================================
== Vitis HLS Report for 'activation_accelerator_Pipeline_VITIS_LOOP_186_1'
================================================================
* Date:           Sun Oct 12 09:48:02 2025

* Version:        2022.2 (Build 3670227 on Oct 13 2022)
* Project:        activation_accelerator
* Solution:       baseline (Vivado IP Flow Target)
* Product family: zynquplus
* Target device:  xck26-sfvc784-2LV-c


================================================================
== Performance Estimates
================================================================
+ Timing: 
    * Summary: 
    +--------+----------+----------+------------+
    |  Clock |  Target  | Estimated| Uncertainty|
    +--------+----------+----------+------------+
    |ap_clk  |  10.00 ns|  6.864 ns|     2.70 ns|
    +--------+----------+----------+------------+

+ Latency: 
    * Summary: 
    +---------+---------+----------+----------+-------+-------+---------+
    |  Latency (cycles) |  Latency (absolute) |    Interval   | Pipeline|
    |   min   |   max   |    min   |    max   |  min  |  max  |   Type  |
    +---------+---------+----------+----------+-------+-------+---------+
    |    98308|    98308|  0.983 ms|  0.983 ms|  98308|  98308|       no|
    +---------+---------+----------+----------+-------+-------+---------+

    + Detail: 
        * Instance: 
        N/A

        * Loop: 
        +--------------------+---------+---------+----------+-----------+-----------+-------+----------+
        |                    |  Latency (cycles) | Iteration|  Initiation Interval  |  Trip |          |
        |      Loop Name     |   min   |   max   |  Latency |  achieved |   target  | Count | Pipelined|
        +--------------------+---------+---------+----------+-----------+-----------+-------+----------+
        |- VITIS_LOOP_186_1  |    98306|    98306|         6|          3|          1|  32768|       yes|
        +--------------------+---------+---------+----------+-----------+-----------+-------+----------+

============================================================
+ Verbose Summary: Synthesis Manager
============================================================
InlineROM: 1
ExposeGlobal: 0
============================================================
+ Verbose Summary: CDFG Model
============================================================
IsTopModel: 0
ResetActiveHigh: 1
IsCombinational: 0
IsDatapathOnly: 0
HasWiredReturn: 1
HasMFsm: 2
HasVarLatency: 1
IsPipeline: 0
IsRtlPipelined: 0
IsInstanceOverlapped: 0
IsDontTouch: 0
HasImplIP: 0
IsGatedGlobalClock: 0

+ Individual pipeline summary: 
  * Pipeline-0: initiation interval (II) = 3, depth = 6


============================================================
+ Verbose Summary: Schedule
============================================================
* Number of FSM states : 6
* Pipeline : 1
  Pipeline-0 : II = 3, D = 6, States = { 1 2 3 4 5 6 }
* Dataflow Pipeline: 0

* FSM state transitions: 
1 --> 2 
2 --> 3 
3 --> 4 
4 --> 5 
5 --> 6 
6 --> 

* FSM state operations: 

State 1 <SV = 0> <Delay = 1.23>
ST_1 : Operation 9 [1/1] (0.00ns)   --->   "%sum = alloca i32 1"   --->   Operation 9 'alloca' 'sum' <Predicate = true> <Delay = 0.00>
ST_1 : Operation 10 [1/1] (0.00ns)   --->   "%i = alloca i32 1"   --->   Operation 10 'alloca' 'i' <Predicate = true> <Delay = 0.00>
ST_1 : Operation 11 [1/1] (0.42ns)   --->   "%store_ln0 = store i16 0, i16 %i"   --->   Operation 11 'store' 'store_ln0' <Predicate = true> <Delay = 0.42>
ST_1 : Operation 12 [1/1] (0.42ns)   --->   "%store_ln0 = store i32 0, i32 %sum"   --->   Operation 12 'store' 'store_ln0' <Predicate = true> <Delay = 0.42>
ST_1 : Operation 13 [1/1] (0.00ns)   --->   "%br_ln0 = br void %for.inc.i147"   --->   Operation 13 'br' 'br_ln0' <Predicate = true> <Delay = 0.00>
ST_1 : Operation 14 [1/1] (0.00ns)   --->   "%i_12 = load i16 %i" [activation_accelerator.cpp:187]   --->   Operation 14 'load' 'i_12' <Predicate = true> <Delay = 0.00>
ST_1 : Operation 15 [1/1] (1.10ns)   --->   "%icmp_ln186 = icmp_eq  i16 %i_12, i16 32768" [activation_accelerator.cpp:186]   --->   Operation 15 'icmp' 'icmp_ln186' <Predicate = true> <Delay = 1.10> <CoreInst = "Cmp">   --->   Core 9 'Cmp' <Latency = 0> <II = 1> <Delay = 1.10> <FuncUnit> <Opcode : 'icmp'> <InPorts = 2> <OutPorts = 1>
ST_1 : Operation 16 [1/1] (0.00ns)   --->   "%br_ln186 = br i1 %icmp_ln186, void %for.inc.i147.split, void %for.end.i149.exitStub" [activation_accelerator.cpp:186]   --->   Operation 16 'br' 'br_ln186' <Predicate = true> <Delay = 0.00>
ST_1 : Operation 17 [1/1] (0.00ns)   --->   "%lshr_ln8 = partselect i13 @_ssdm_op_PartSelect.i13.i16.i32.i32, i16 %i_12, i32 2, i32 14" [activation_accelerator.cpp:187]   --->   Operation 17 'partselect' 'lshr_ln8' <Predicate = (!icmp_ln186)> <Delay = 0.00>
ST_1 : Operation 18 [1/1] (0.00ns)   --->   "%zext_ln187 = zext i13 %lshr_ln8" [activation_accelerator.cpp:187]   --->   Operation 18 'zext' 'zext_ln187' <Predicate = (!icmp_ln186)> <Delay = 0.00>
ST_1 : Operation 19 [1/1] (0.00ns)   --->   "%x_addr = getelementptr i32 %x, i64 0, i64 %zext_ln187" [activation_accelerator.cpp:187]   --->   Operation 19 'getelementptr' 'x_addr' <Predicate = (!icmp_ln186)> <Delay = 0.00>
ST_1 : Operation 20 [1/1] (0.00ns)   --->   "%x_2_addr = getelementptr i32 %x_2, i64 0, i64 %zext_ln187" [activation_accelerator.cpp:187]   --->   Operation 20 'getelementptr' 'x_2_addr' <Predicate = (!icmp_ln186)> <Delay = 0.00>
ST_1 : Operation 21 [1/1] (0.00ns)   --->   "%x_4_addr = getelementptr i32 %x_4, i64 0, i64 %zext_ln187" [activation_accelerator.cpp:187]   --->   Operation 21 'getelementptr' 'x_4_addr' <Predicate = (!icmp_ln186)> <Delay = 0.00>
ST_1 : Operation 22 [1/1] (0.00ns)   --->   "%x_6_addr = getelementptr i32 %x_6, i64 0, i64 %zext_ln187" [activation_accelerator.cpp:187]   --->   Operation 22 'getelementptr' 'x_6_addr' <Predicate = (!icmp_ln186)> <Delay = 0.00>
ST_1 : Operation 23 [2/2] (1.23ns)   --->   "%x_load = load i13 %x_addr" [activation_accelerator.cpp:187]   --->   Operation 23 'load' 'x_load' <Predicate = (!icmp_ln186)> <Delay = 1.23> <CoreInst = "RAM">   --->   Core 83 'RAM' <Latency = 1> <II = 1> <Delay = 1.23> <Storage> <Opcode : 'load' 'store'> <Ports = 2> <Width = 32> <Depth = 8192> <RAM>
ST_1 : Operation 24 [2/2] (1.23ns)   --->   "%x_2_load = load i13 %x_2_addr" [activation_accelerator.cpp:187]   --->   Operation 24 'load' 'x_2_load' <Predicate = (!icmp_ln186)> <Delay = 1.23> <CoreInst = "RAM">   --->   Core 83 'RAM' <Latency = 1> <II = 1> <Delay = 1.23> <Storage> <Opcode : 'load' 'store'> <Ports = 2> <Width = 32> <Depth = 8192> <RAM>
ST_1 : Operation 25 [2/2] (1.23ns)   --->   "%x_4_load = load i13 %x_4_addr" [activation_accelerator.cpp:187]   --->   Operation 25 'load' 'x_4_load' <Predicate = (!icmp_ln186)> <Delay = 1.23> <CoreInst = "RAM">   --->   Core 83 'RAM' <Latency = 1> <II = 1> <Delay = 1.23> <Storage> <Opcode : 'load' 'store'> <Ports = 2> <Width = 32> <Depth = 8192> <RAM>
ST_1 : Operation 26 [2/2] (1.23ns)   --->   "%x_6_load = load i13 %x_6_addr" [activation_accelerator.cpp:187]   --->   Operation 26 'load' 'x_6_load' <Predicate = (!icmp_ln186)> <Delay = 1.23> <CoreInst = "RAM">   --->   Core 83 'RAM' <Latency = 1> <II = 1> <Delay = 1.23> <Storage> <Opcode : 'load' 'store'> <Ports = 2> <Width = 32> <Depth = 8192> <RAM>

State 2 <SV = 1> <Delay = 1.76>
ST_2 : Operation 27 [1/1] (0.00ns)   --->   "%specpipeline_ln0 = specpipeline void @_ssdm_op_SpecPipeline, i32 4294967295, i32 0, i32 1, i32 0, void @p_str"   --->   Operation 27 'specpipeline' 'specpipeline_ln0' <Predicate = true> <Delay = 0.00>
ST_2 : Operation 28 [1/1] (0.00ns)   --->   "%empty = speclooptripcount i32 @_ssdm_op_SpecLoopTripCount, i64 32768, i64 32768, i64 32768"   --->   Operation 28 'speclooptripcount' 'empty' <Predicate = true> <Delay = 0.00>
ST_2 : Operation 29 [1/1] (0.85ns)   --->   "%add_ln186 = add i16 %i_12, i16 1" [activation_accelerator.cpp:186]   --->   Operation 29 'add' 'add_ln186' <Predicate = true> <Delay = 0.85> <CoreInst = "Adder">   --->   Core 1 'Adder' <Latency = 0> <II = 1> <Delay = 0.85> <FuncUnit> <Opcode : 'add' 'sub'> <InPorts = 2> <OutPorts = 1>
ST_2 : Operation 30 [1/1] (0.00ns)   --->   "%trunc_ln187 = trunc i16 %i_12" [activation_accelerator.cpp:187]   --->   Operation 30 'trunc' 'trunc_ln187' <Predicate = (!icmp_ln186)> <Delay = 0.00>
ST_2 : Operation 31 [1/2] (1.23ns)   --->   "%x_load = load i13 %x_addr" [activation_accelerator.cpp:187]   --->   Operation 31 'load' 'x_load' <Predicate = (!icmp_ln186)> <Delay = 1.23> <CoreInst = "RAM">   --->   Core 83 'RAM' <Latency = 1> <II = 1> <Delay = 1.23> <Storage> <Opcode : 'load' 'store'> <Ports = 2> <Width = 32> <Depth = 8192> <RAM>
ST_2 : Operation 32 [1/2] (1.23ns)   --->   "%x_2_load = load i13 %x_2_addr" [activation_accelerator.cpp:187]   --->   Operation 32 'load' 'x_2_load' <Predicate = (!icmp_ln186)> <Delay = 1.23> <CoreInst = "RAM">   --->   Core 83 'RAM' <Latency = 1> <II = 1> <Delay = 1.23> <Storage> <Opcode : 'load' 'store'> <Ports = 2> <Width = 32> <Depth = 8192> <RAM>
ST_2 : Operation 33 [1/2] (1.23ns)   --->   "%x_4_load = load i13 %x_4_addr" [activation_accelerator.cpp:187]   --->   Operation 33 'load' 'x_4_load' <Predicate = (!icmp_ln186)> <Delay = 1.23> <CoreInst = "RAM">   --->   Core 83 'RAM' <Latency = 1> <II = 1> <Delay = 1.23> <Storage> <Opcode : 'load' 'store'> <Ports = 2> <Width = 32> <Depth = 8192> <RAM>
ST_2 : Operation 34 [1/2] (1.23ns)   --->   "%x_6_load = load i13 %x_6_addr" [activation_accelerator.cpp:187]   --->   Operation 34 'load' 'x_6_load' <Predicate = (!icmp_ln186)> <Delay = 1.23> <CoreInst = "RAM">   --->   Core 83 'RAM' <Latency = 1> <II = 1> <Delay = 1.23> <Storage> <Opcode : 'load' 'store'> <Ports = 2> <Width = 32> <Depth = 8192> <RAM>
ST_2 : Operation 35 [1/1] (0.52ns)   --->   "%tmp_9 = mux i32 @_ssdm_op_Mux.ap_auto.4f32.i2, i32 %x_load, i32 %x_2_load, i32 %x_4_load, i32 %x_6_load, i2 %trunc_ln187" [activation_accelerator.cpp:187]   --->   Operation 35 'mux' 'tmp_9' <Predicate = (!icmp_ln186)> <Delay = 0.52> <CoreInst = "Multiplexer">   --->   Core 76 'Multiplexer' <Latency = 0> <II = 1> <Delay = 0.52> <FuncUnit> <Opcode : 'mux'> <InPorts = 2> <OutPorts = 1>
ST_2 : Operation 36 [1/1] (0.42ns)   --->   "%store_ln186 = store i16 %add_ln186, i16 %i" [activation_accelerator.cpp:186]   --->   Operation 36 'store' 'store_ln186' <Predicate = (!icmp_ln186)> <Delay = 0.42>

State 3 <SV = 2> <Delay = 6.43>
ST_3 : Operation 37 [1/1] (0.00ns)   --->   "%sum_load = load i32 %sum" [activation_accelerator.cpp:187]   --->   Operation 37 'load' 'sum_load' <Predicate = (!icmp_ln186)> <Delay = 0.00>
ST_3 : Operation 38 [4/4] (6.43ns)   --->   "%sum_33 = fadd i32 %sum_load, i32 %tmp_9" [activation_accelerator.cpp:187]   --->   Operation 38 'fadd' 'sum_33' <Predicate = (!icmp_ln186)> <Delay = 6.43> <CoreInst = "FAddSub_fulldsp">   --->   Core 18 'FAddSub_fulldsp' <Latency = 3> <II = 1> <Delay = 6.43> <FuncUnit> <Opcode : 'fadd' 'fsub'> <InPorts = 2> <OutPorts = 1>
ST_3 : Operation 45 [1/1] (0.00ns)   --->   "%sum_load_2 = load i32 %sum"   --->   Operation 45 'load' 'sum_load_2' <Predicate = (icmp_ln186)> <Delay = 0.00>
ST_3 : Operation 46 [1/1] (0.00ns)   --->   "%write_ln0 = write void @_ssdm_op_Write.ap_auto.floatP0A, i32 %sum_out, i32 %sum_load_2"   --->   Operation 46 'write' 'write_ln0' <Predicate = (icmp_ln186)> <Delay = 0.00>
ST_3 : Operation 47 [1/1] (0.00ns)   --->   "%ret_ln0 = ret"   --->   Operation 47 'ret' 'ret_ln0' <Predicate = (icmp_ln186)> <Delay = 0.00>

State 4 <SV = 3> <Delay = 6.43>
ST_4 : Operation 39 [3/4] (6.43ns)   --->   "%sum_33 = fadd i32 %sum_load, i32 %tmp_9" [activation_accelerator.cpp:187]   --->   Operation 39 'fadd' 'sum_33' <Predicate = true> <Delay = 6.43> <CoreInst = "FAddSub_fulldsp">   --->   Core 18 'FAddSub_fulldsp' <Latency = 3> <II = 1> <Delay = 6.43> <FuncUnit> <Opcode : 'fadd' 'fsub'> <InPorts = 2> <OutPorts = 1>

State 5 <SV = 4> <Delay = 6.43>
ST_5 : Operation 40 [2/4] (6.43ns)   --->   "%sum_33 = fadd i32 %sum_load, i32 %tmp_9" [activation_accelerator.cpp:187]   --->   Operation 40 'fadd' 'sum_33' <Predicate = true> <Delay = 6.43> <CoreInst = "FAddSub_fulldsp">   --->   Core 18 'FAddSub_fulldsp' <Latency = 3> <II = 1> <Delay = 6.43> <FuncUnit> <Opcode : 'fadd' 'fsub'> <InPorts = 2> <OutPorts = 1>

State 6 <SV = 5> <Delay = 6.86>
ST_6 : Operation 41 [1/1] (0.00ns)   --->   "%specloopname_ln185 = specloopname void @_ssdm_op_SpecLoopName, void @empty_1" [activation_accelerator.cpp:185]   --->   Operation 41 'specloopname' 'specloopname_ln185' <Predicate = true> <Delay = 0.00>
ST_6 : Operation 42 [1/4] (6.43ns)   --->   "%sum_33 = fadd i32 %sum_load, i32 %tmp_9" [activation_accelerator.cpp:187]   --->   Operation 42 'fadd' 'sum_33' <Predicate = true> <Delay = 6.43> <CoreInst = "FAddSub_fulldsp">   --->   Core 18 'FAddSub_fulldsp' <Latency = 3> <II = 1> <Delay = 6.43> <FuncUnit> <Opcode : 'fadd' 'fsub'> <InPorts = 2> <OutPorts = 1>
ST_6 : Operation 43 [1/1] (0.42ns)   --->   "%store_ln186 = store i32 %sum_33, i32 %sum" [activation_accelerator.cpp:186]   --->   Operation 43 'store' 'store_ln186' <Predicate = true> <Delay = 0.42>
ST_6 : Operation 44 [1/1] (0.00ns)   --->   "%br_ln186 = br void %for.inc.i147" [activation_accelerator.cpp:186]   --->   Operation 44 'br' 'br_ln186' <Predicate = true> <Delay = 0.00>


============================================================
+ Verbose Summary: Timing violations
============================================================
Target clock period: 10ns, clock uncertainty: 2.7ns.

 <State 1>: 1.24ns
The critical path consists of the following:
	'alloca' operation ('i') [7]  (0 ns)
	'load' operation ('i', activation_accelerator.cpp:187) on local variable 'i' [12]  (0 ns)
	'getelementptr' operation ('x_addr', activation_accelerator.cpp:187) [23]  (0 ns)
	'load' operation ('x_load', activation_accelerator.cpp:187) on array 'x' [28]  (1.24 ns)

 <State 2>: 1.76ns
The critical path consists of the following:
	'load' operation ('x_load', activation_accelerator.cpp:187) on array 'x' [28]  (1.24 ns)
	'mux' operation ('tmp_9', activation_accelerator.cpp:187) [32]  (0.525 ns)

 <State 3>: 6.44ns
The critical path consists of the following:
	'load' operation ('sum_load', activation_accelerator.cpp:187) on local variable 'sum' [19]  (0 ns)
	'fadd' operation ('sum', activation_accelerator.cpp:187) [33]  (6.44 ns)

 <State 4>: 6.44ns
The critical path consists of the following:
	'fadd' operation ('sum', activation_accelerator.cpp:187) [33]  (6.44 ns)

 <State 5>: 6.44ns
The critical path consists of the following:
	'fadd' operation ('sum', activation_accelerator.cpp:187) [33]  (6.44 ns)

 <State 6>: 6.86ns
The critical path consists of the following:
	'fadd' operation ('sum', activation_accelerator.cpp:187) [33]  (6.44 ns)
	'store' operation ('store_ln186', activation_accelerator.cpp:186) of variable 'sum', activation_accelerator.cpp:187 on local variable 'sum' [35]  (0.427 ns)


============================================================
+ Verbose Summary: Binding
============================================================
N/A
* FSMD analyzer results:
  - Output states:
 - Input state : 
  - Chain level:
	State 1
	State 2
	State 3
	State 4
	State 5
	State 6


============================================================
+ Verbose Summary: Datapath Resource usage 
============================================================
N/A
