

================================================================
== Vitis HLS Report for 'activation_accelerator_Pipeline_VITIS_LOOP_206_1'
================================================================
* Date:           Sun Oct 12 09:48:09 2025

* Version:        2022.2 (Build 3670227 on Oct 13 2022)
* Project:        activation_accelerator
* Solution:       baseline (Vivado IP Flow Target)
* Product family: zynquplus
* Target device:  xck26-sfvc784-2LV-c


================================================================
== Performance Estimates
================================================================
+ Timing: 
    * Summary: 
    +--------+----------+----------+------------+
    |  Clock |  Target  | Estimated| Uncertainty|
    +--------+----------+----------+------------+
    |ap_clk  |  10.00 ns|  6.437 ns|     2.70 ns|
    +--------+----------+----------+------------+

+ Latency: 
    * Summary: 
    +---------+---------+----------+----------+-------+-------+---------+
    |  Latency (cycles) |  Latency (absolute) |    Interval   | Pipeline|
    |   min   |   max   |    min   |    max   |  min  |  max  |   Type  |
    +---------+---------+----------+----------+-------+-------+---------+
    |    32775|    32775|  0.328 ms|  0.328 ms|  32775|  32775|       no|
    +---------+---------+----------+----------+-------+-------+---------+

    + Detail: 
        * Instance: 
        N/A

        * Loop: 
        +--------------------+---------+---------+----------+-----------+-----------+-------+----------+
        |                    |  Latency (cycles) | Iteration|  Initiation Interval  |  Trip |          |
        |      Loop Name     |   min   |   max   |  Latency |  achieved |   target  | Count | Pipelined|
        +--------------------+---------+---------+----------+-----------+-----------+-------+----------+
        |- VITIS_LOOP_206_1  |    32773|    32773|         7|          1|          1|  32768|       yes|
        +--------------------+---------+---------+----------+-----------+-----------+-------+----------+

============================================================
+ Verbose Summary: Synthesis Manager
============================================================
InlineROM: 1
ExposeGlobal: 0
============================================================
+ Verbose Summary: CDFG Model
============================================================
IsTopModel: 0
ResetActiveHigh: 1
IsCombinational: 0
IsDatapathOnly: 0
HasWiredReturn: 1
HasMFsm: 2
HasVarLatency: 1
IsPipeline: 0
IsRtlPipelined: 0
IsInstanceOverlapped: 0
IsDontTouch: 0
HasImplIP: 0
IsGatedGlobalClock: 0

+ Individual pipeline summary: 
  * Pipeline-0: initiation interval (II) = 1, depth = 7


============================================================
+ Verbose Summary: Schedule
============================================================
* Number of FSM states : 7
* Pipeline : 1
  Pipeline-0 : II = 1, D = 7, States = { 1 2 3 4 5 6 7 }
* Dataflow Pipeline: 0

* FSM state transitions: 
1 --> 2 
2 --> 3 
3 --> 4 
4 --> 5 
5 --> 6 
6 --> 7 
7 --> 

* FSM state operations: 

State 1 <SV = 0> <Delay = 1.52>
ST_1 : Operation 10 [1/1] (0.00ns)   --->   "%i = alloca i32 1"   --->   Operation 10 'alloca' 'i' <Predicate = true> <Delay = 0.00>
ST_1 : Operation 11 [1/1] (0.42ns)   --->   "%store_ln0 = store i16 0, i16 %i"   --->   Operation 11 'store' 'store_ln0' <Predicate = true> <Delay = 0.42>
ST_1 : Operation 12 [1/1] (0.00ns)   --->   "%br_ln0 = br void %for.inc.i22"   --->   Operation 12 'br' 'br_ln0' <Predicate = true> <Delay = 0.00>
ST_1 : Operation 13 [1/1] (0.00ns)   --->   "%i_9 = load i16 %i" [activation_accelerator.cpp:207]   --->   Operation 13 'load' 'i_9' <Predicate = true> <Delay = 0.00>
ST_1 : Operation 14 [1/1] (0.00ns)   --->   "%specpipeline_ln0 = specpipeline void @_ssdm_op_SpecPipeline, i32 4294967295, i32 0, i32 1, i32 0, void @p_str"   --->   Operation 14 'specpipeline' 'specpipeline_ln0' <Predicate = true> <Delay = 0.00>
ST_1 : Operation 15 [1/1] (1.10ns)   --->   "%icmp_ln206 = icmp_eq  i16 %i_9, i16 32768" [activation_accelerator.cpp:206]   --->   Operation 15 'icmp' 'icmp_ln206' <Predicate = true> <Delay = 1.10> <CoreInst = "Cmp">   --->   Core 9 'Cmp' <Latency = 0> <II = 1> <Delay = 1.10> <FuncUnit> <Opcode : 'icmp'> <InPorts = 2> <OutPorts = 1>
ST_1 : Operation 16 [1/1] (0.00ns)   --->   "%empty = speclooptripcount i32 @_ssdm_op_SpecLoopTripCount, i64 32768, i64 32768, i64 32768"   --->   Operation 16 'speclooptripcount' 'empty' <Predicate = true> <Delay = 0.00>
ST_1 : Operation 17 [1/1] (0.85ns)   --->   "%add_ln206 = add i16 %i_9, i16 1" [activation_accelerator.cpp:206]   --->   Operation 17 'add' 'add_ln206' <Predicate = true> <Delay = 0.85> <CoreInst = "Adder">   --->   Core 1 'Adder' <Latency = 0> <II = 1> <Delay = 0.85> <FuncUnit> <Opcode : 'add' 'sub'> <InPorts = 2> <OutPorts = 1>
ST_1 : Operation 18 [1/1] (0.00ns)   --->   "%br_ln206 = br i1 %icmp_ln206, void %for.inc.i22.split, void %for.inc34.preheader.exitStub" [activation_accelerator.cpp:206]   --->   Operation 18 'br' 'br_ln206' <Predicate = true> <Delay = 0.00>
ST_1 : Operation 19 [1/1] (0.00ns)   --->   "%i_18_cast28 = zext i16 %i_9" [activation_accelerator.cpp:207]   --->   Operation 19 'zext' 'i_18_cast28' <Predicate = (!icmp_ln206)> <Delay = 0.00>
ST_1 : Operation 20 [1/1] (0.00ns)   --->   "%lshr_ln9 = partselect i13 @_ssdm_op_PartSelect.i13.i16.i32.i32, i16 %i_9, i32 2, i32 14" [activation_accelerator.cpp:207]   --->   Operation 20 'partselect' 'lshr_ln9' <Predicate = (!icmp_ln206)> <Delay = 0.00>
ST_1 : Operation 21 [1/1] (0.00ns)   --->   "%zext_ln207 = zext i13 %lshr_ln9" [activation_accelerator.cpp:207]   --->   Operation 21 'zext' 'zext_ln207' <Predicate = (!icmp_ln206)> <Delay = 0.00>
ST_1 : Operation 22 [1/1] (0.00ns)   --->   "%x_addr = getelementptr i32 %x, i64 0, i64 %zext_ln207" [activation_accelerator.cpp:207]   --->   Operation 22 'getelementptr' 'x_addr' <Predicate = (!icmp_ln206)> <Delay = 0.00>
ST_1 : Operation 23 [1/1] (0.00ns)   --->   "%x_2_addr = getelementptr i32 %x_2, i64 0, i64 %zext_ln207" [activation_accelerator.cpp:207]   --->   Operation 23 'getelementptr' 'x_2_addr' <Predicate = (!icmp_ln206)> <Delay = 0.00>
ST_1 : Operation 24 [1/1] (0.00ns)   --->   "%x_4_addr = getelementptr i32 %x_4, i64 0, i64 %zext_ln207" [activation_accelerator.cpp:207]   --->   Operation 24 'getelementptr' 'x_4_addr' <Predicate = (!icmp_ln206)> <Delay = 0.00>
ST_1 : Operation 25 [1/1] (0.00ns)   --->   "%x_6_addr = getelementptr i32 %x_6, i64 0, i64 %zext_ln207" [activation_accelerator.cpp:207]   --->   Operation 25 'getelementptr' 'x_6_addr' <Predicate = (!icmp_ln206)> <Delay = 0.00>
ST_1 : Operation 26 [1/1] (0.00ns)   --->   "%trunc_ln207 = trunc i16 %i_9" [activation_accelerator.cpp:207]   --->   Operation 26 'trunc' 'trunc_ln207' <Predicate = (!icmp_ln206)> <Delay = 0.00>
ST_1 : Operation 27 [2/2] (1.23ns)   --->   "%x_load = load i13 %x_addr" [activation_accelerator.cpp:207]   --->   Operation 27 'load' 'x_load' <Predicate = (!icmp_ln206)> <Delay = 1.23> <CoreInst = "RAM">   --->   Core 83 'RAM' <Latency = 1> <II = 1> <Delay = 1.23> <Storage> <Opcode : 'load' 'store'> <Ports = 2> <Width = 32> <Depth = 8192> <RAM>
ST_1 : Operation 28 [2/2] (1.23ns)   --->   "%x_2_load = load i13 %x_2_addr" [activation_accelerator.cpp:207]   --->   Operation 28 'load' 'x_2_load' <Predicate = (!icmp_ln206)> <Delay = 1.23> <CoreInst = "RAM">   --->   Core 83 'RAM' <Latency = 1> <II = 1> <Delay = 1.23> <Storage> <Opcode : 'load' 'store'> <Ports = 2> <Width = 32> <Depth = 8192> <RAM>
ST_1 : Operation 29 [2/2] (1.23ns)   --->   "%x_4_load = load i13 %x_4_addr" [activation_accelerator.cpp:207]   --->   Operation 29 'load' 'x_4_load' <Predicate = (!icmp_ln206)> <Delay = 1.23> <CoreInst = "RAM">   --->   Core 83 'RAM' <Latency = 1> <II = 1> <Delay = 1.23> <Storage> <Opcode : 'load' 'store'> <Ports = 2> <Width = 32> <Depth = 8192> <RAM>
ST_1 : Operation 30 [2/2] (1.23ns)   --->   "%x_6_load = load i13 %x_6_addr" [activation_accelerator.cpp:207]   --->   Operation 30 'load' 'x_6_load' <Predicate = (!icmp_ln206)> <Delay = 1.23> <CoreInst = "RAM">   --->   Core 83 'RAM' <Latency = 1> <II = 1> <Delay = 1.23> <Storage> <Opcode : 'load' 'store'> <Ports = 2> <Width = 32> <Depth = 8192> <RAM>
ST_1 : Operation 31 [1/1] (0.00ns)   --->   "%y_addr = getelementptr i32 %y, i64 0, i64 %i_18_cast28" [activation_accelerator.cpp:207]   --->   Operation 31 'getelementptr' 'y_addr' <Predicate = (!icmp_ln206)> <Delay = 0.00>
ST_1 : Operation 32 [2/2] (1.23ns)   --->   "%y_load = load i15 %y_addr" [activation_accelerator.cpp:207]   --->   Operation 32 'load' 'y_load' <Predicate = (!icmp_ln206)> <Delay = 1.23> <CoreInst = "RAM">   --->   Core 83 'RAM' <Latency = 1> <II = 1> <Delay = 1.23> <Storage> <Opcode : 'load' 'store'> <Ports = 2> <Width = 32> <Depth = 32768> <RAM>
ST_1 : Operation 33 [1/1] (0.00ns)   --->   "%activation_accelerator_unsigned_short_unsigned_short_unsigned_short_int_i_28 = getelementptr i16 %activation_accelerator_unsigned_short_unsigned_short_unsigned_short_int_i_3, i64 0, i64 %zext_ln207" [activation_accelerator.cpp:209]   --->   Operation 33 'getelementptr' 'activation_accelerator_unsigned_short_unsigned_short_unsigned_short_int_i_28' <Predicate = (!icmp_ln206)> <Delay = 0.00>
ST_1 : Operation 34 [1/1] (0.00ns)   --->   "%activation_accelerator_unsigned_short_unsigned_short_unsigned_short_int_i_29 = getelementptr i16 %activation_accelerator_unsigned_short_unsigned_short_unsigned_short_int_i_2, i64 0, i64 %zext_ln207" [activation_accelerator.cpp:209]   --->   Operation 34 'getelementptr' 'activation_accelerator_unsigned_short_unsigned_short_unsigned_short_int_i_29' <Predicate = (!icmp_ln206)> <Delay = 0.00>
ST_1 : Operation 35 [1/1] (0.00ns)   --->   "%activation_accelerator_unsigned_short_unsigned_short_unsigned_short_int_i_30 = getelementptr i16 %activation_accelerator_unsigned_short_unsigned_short_unsigned_short_int_i_1, i64 0, i64 %zext_ln207" [activation_accelerator.cpp:209]   --->   Operation 35 'getelementptr' 'activation_accelerator_unsigned_short_unsigned_short_unsigned_short_int_i_30' <Predicate = (!icmp_ln206)> <Delay = 0.00>
ST_1 : Operation 36 [1/1] (0.00ns)   --->   "%activation_accelerator_unsigned_short_unsigned_short_unsigned_short_int_i_31 = getelementptr i16 %activation_accelerator_unsigned_short_unsigned_short_unsigned_short_int_i, i64 0, i64 %zext_ln207" [activation_accelerator.cpp:209]   --->   Operation 36 'getelementptr' 'activation_accelerator_unsigned_short_unsigned_short_unsigned_short_int_i_31' <Predicate = (!icmp_ln206)> <Delay = 0.00>
ST_1 : Operation 37 [1/1] (0.44ns)   --->   "%switch_ln209 = switch i2 %trunc_ln207, void %arrayidx41.i.case.3, i2 0, void %arrayidx41.i.case.0, i2 1, void %arrayidx41.i.case.1, i2 2, void %arrayidx41.i.case.2" [activation_accelerator.cpp:209]   --->   Operation 37 'switch' 'switch_ln209' <Predicate = (!icmp_ln206)> <Delay = 0.44>
ST_1 : Operation 38 [1/1] (0.42ns)   --->   "%store_ln206 = store i16 %add_ln206, i16 %i" [activation_accelerator.cpp:206]   --->   Operation 38 'store' 'store_ln206' <Predicate = (!icmp_ln206)> <Delay = 0.42>
ST_1 : Operation 39 [1/1] (0.00ns)   --->   "%br_ln206 = br void %for.inc.i22" [activation_accelerator.cpp:206]   --->   Operation 39 'br' 'br_ln206' <Predicate = (!icmp_ln206)> <Delay = 0.00>

State 2 <SV = 1> <Delay = 1.76>
ST_2 : Operation 40 [1/2] (1.23ns)   --->   "%x_load = load i13 %x_addr" [activation_accelerator.cpp:207]   --->   Operation 40 'load' 'x_load' <Predicate = true> <Delay = 1.23> <CoreInst = "RAM">   --->   Core 83 'RAM' <Latency = 1> <II = 1> <Delay = 1.23> <Storage> <Opcode : 'load' 'store'> <Ports = 2> <Width = 32> <Depth = 8192> <RAM>
ST_2 : Operation 41 [1/2] (1.23ns)   --->   "%x_2_load = load i13 %x_2_addr" [activation_accelerator.cpp:207]   --->   Operation 41 'load' 'x_2_load' <Predicate = true> <Delay = 1.23> <CoreInst = "RAM">   --->   Core 83 'RAM' <Latency = 1> <II = 1> <Delay = 1.23> <Storage> <Opcode : 'load' 'store'> <Ports = 2> <Width = 32> <Depth = 8192> <RAM>
ST_2 : Operation 42 [1/2] (1.23ns)   --->   "%x_4_load = load i13 %x_4_addr" [activation_accelerator.cpp:207]   --->   Operation 42 'load' 'x_4_load' <Predicate = true> <Delay = 1.23> <CoreInst = "RAM">   --->   Core 83 'RAM' <Latency = 1> <II = 1> <Delay = 1.23> <Storage> <Opcode : 'load' 'store'> <Ports = 2> <Width = 32> <Depth = 8192> <RAM>
ST_2 : Operation 43 [1/2] (1.23ns)   --->   "%x_6_load = load i13 %x_6_addr" [activation_accelerator.cpp:207]   --->   Operation 43 'load' 'x_6_load' <Predicate = true> <Delay = 1.23> <CoreInst = "RAM">   --->   Core 83 'RAM' <Latency = 1> <II = 1> <Delay = 1.23> <Storage> <Opcode : 'load' 'store'> <Ports = 2> <Width = 32> <Depth = 8192> <RAM>
ST_2 : Operation 44 [1/1] (0.52ns)   --->   "%tmp_1 = mux i32 @_ssdm_op_Mux.ap_auto.4f32.i2, i32 %x_load, i32 %x_2_load, i32 %x_4_load, i32 %x_6_load, i2 %trunc_ln207" [activation_accelerator.cpp:207]   --->   Operation 44 'mux' 'tmp_1' <Predicate = true> <Delay = 0.52> <CoreInst = "Multiplexer">   --->   Core 76 'Multiplexer' <Latency = 0> <II = 1> <Delay = 0.52> <FuncUnit> <Opcode : 'mux'> <InPorts = 2> <OutPorts = 1>
ST_2 : Operation 45 [1/2] (1.23ns)   --->   "%y_load = load i15 %y_addr" [activation_accelerator.cpp:207]   --->   Operation 45 'load' 'y_load' <Predicate = true> <Delay = 1.23> <CoreInst = "RAM">   --->   Core 83 'RAM' <Latency = 1> <II = 1> <Delay = 1.23> <Storage> <Opcode : 'load' 'store'> <Ports = 2> <Width = 32> <Depth = 32768> <RAM>

State 3 <SV = 2> <Delay = 6.43>
ST_3 : Operation 46 [4/4] (6.43ns)   --->   "%sum = fadd i32 %tmp_1, i32 %y_load" [activation_accelerator.cpp:207]   --->   Operation 46 'fadd' 'sum' <Predicate = true> <Delay = 6.43> <CoreInst = "FAddSub_fulldsp">   --->   Core 18 'FAddSub_fulldsp' <Latency = 3> <II = 1> <Delay = 6.43> <FuncUnit> <Opcode : 'fadd' 'fsub'> <InPorts = 2> <OutPorts = 1>

State 4 <SV = 3> <Delay = 6.43>
ST_4 : Operation 47 [3/4] (6.43ns)   --->   "%sum = fadd i32 %tmp_1, i32 %y_load" [activation_accelerator.cpp:207]   --->   Operation 47 'fadd' 'sum' <Predicate = true> <Delay = 6.43> <CoreInst = "FAddSub_fulldsp">   --->   Core 18 'FAddSub_fulldsp' <Latency = 3> <II = 1> <Delay = 6.43> <FuncUnit> <Opcode : 'fadd' 'fsub'> <InPorts = 2> <OutPorts = 1>

State 5 <SV = 4> <Delay = 6.43>
ST_5 : Operation 48 [2/4] (6.43ns)   --->   "%sum = fadd i32 %tmp_1, i32 %y_load" [activation_accelerator.cpp:207]   --->   Operation 48 'fadd' 'sum' <Predicate = true> <Delay = 6.43> <CoreInst = "FAddSub_fulldsp">   --->   Core 18 'FAddSub_fulldsp' <Latency = 3> <II = 1> <Delay = 6.43> <FuncUnit> <Opcode : 'fadd' 'fsub'> <InPorts = 2> <OutPorts = 1>

State 6 <SV = 5> <Delay = 6.43>
ST_6 : Operation 49 [1/1] (0.00ns)   --->   "%specloopname_ln206 = specloopname void @_ssdm_op_SpecLoopName, void @empty_22" [activation_accelerator.cpp:206]   --->   Operation 49 'specloopname' 'specloopname_ln206' <Predicate = true> <Delay = 0.00>
ST_6 : Operation 50 [1/4] (6.43ns)   --->   "%sum = fadd i32 %tmp_1, i32 %y_load" [activation_accelerator.cpp:207]   --->   Operation 50 'fadd' 'sum' <Predicate = true> <Delay = 6.43> <CoreInst = "FAddSub_fulldsp">   --->   Core 18 'FAddSub_fulldsp' <Latency = 3> <II = 1> <Delay = 6.43> <FuncUnit> <Opcode : 'fadd' 'fsub'> <InPorts = 2> <OutPorts = 1>
ST_6 : Operation 51 [1/1] (0.00ns)   --->   "%bitcast_ln209 = bitcast i32 %sum" [activation_accelerator.cpp:209]   --->   Operation 51 'bitcast' 'bitcast_ln209' <Predicate = true> <Delay = 0.00>
ST_6 : Operation 52 [1/1] (0.00ns)   --->   "%trunc_ln = partselect i16 @_ssdm_op_PartSelect.i16.i32.i32.i32, i32 %bitcast_ln209, i32 16, i32 31" [activation_accelerator.cpp:209]   --->   Operation 52 'partselect' 'trunc_ln' <Predicate = true> <Delay = 0.00>
ST_6 : Operation 61 [1/1] (0.00ns)   --->   "%ret_ln0 = ret"   --->   Operation 61 'ret' 'ret_ln0' <Predicate = (icmp_ln206)> <Delay = 0.00>

State 7 <SV = 6> <Delay = 1.23>
ST_7 : Operation 53 [1/1] (1.23ns)   --->   "%store_ln209 = store i16 %trunc_ln, i13 %activation_accelerator_unsigned_short_unsigned_short_unsigned_short_int_i_30" [activation_accelerator.cpp:209]   --->   Operation 53 'store' 'store_ln209' <Predicate = (trunc_ln207 == 2)> <Delay = 1.23> <CoreInst = "RAM">   --->   Core 83 'RAM' <Latency = 1> <II = 1> <Delay = 1.23> <Storage> <Opcode : 'load' 'store'> <Ports = 2> <Width = 16> <Depth = 8192> <RAM>
ST_7 : Operation 54 [1/1] (0.00ns)   --->   "%br_ln209 = br void %arrayidx41.i.exit" [activation_accelerator.cpp:209]   --->   Operation 54 'br' 'br_ln209' <Predicate = (trunc_ln207 == 2)> <Delay = 0.00>
ST_7 : Operation 55 [1/1] (1.23ns)   --->   "%store_ln209 = store i16 %trunc_ln, i13 %activation_accelerator_unsigned_short_unsigned_short_unsigned_short_int_i_29" [activation_accelerator.cpp:209]   --->   Operation 55 'store' 'store_ln209' <Predicate = (trunc_ln207 == 1)> <Delay = 1.23> <CoreInst = "RAM">   --->   Core 83 'RAM' <Latency = 1> <II = 1> <Delay = 1.23> <Storage> <Opcode : 'load' 'store'> <Ports = 2> <Width = 16> <Depth = 8192> <RAM>
ST_7 : Operation 56 [1/1] (0.00ns)   --->   "%br_ln209 = br void %arrayidx41.i.exit" [activation_accelerator.cpp:209]   --->   Operation 56 'br' 'br_ln209' <Predicate = (trunc_ln207 == 1)> <Delay = 0.00>
ST_7 : Operation 57 [1/1] (1.23ns)   --->   "%store_ln209 = store i16 %trunc_ln, i13 %activation_accelerator_unsigned_short_unsigned_short_unsigned_short_int_i_28" [activation_accelerator.cpp:209]   --->   Operation 57 'store' 'store_ln209' <Predicate = (trunc_ln207 == 0)> <Delay = 1.23> <CoreInst = "RAM">   --->   Core 83 'RAM' <Latency = 1> <II = 1> <Delay = 1.23> <Storage> <Opcode : 'load' 'store'> <Ports = 2> <Width = 16> <Depth = 8192> <RAM>
ST_7 : Operation 58 [1/1] (0.00ns)   --->   "%br_ln209 = br void %arrayidx41.i.exit" [activation_accelerator.cpp:209]   --->   Operation 58 'br' 'br_ln209' <Predicate = (trunc_ln207 == 0)> <Delay = 0.00>
ST_7 : Operation 59 [1/1] (1.23ns)   --->   "%store_ln209 = store i16 %trunc_ln, i13 %activation_accelerator_unsigned_short_unsigned_short_unsigned_short_int_i_31" [activation_accelerator.cpp:209]   --->   Operation 59 'store' 'store_ln209' <Predicate = (trunc_ln207 == 3)> <Delay = 1.23> <CoreInst = "RAM">   --->   Core 83 'RAM' <Latency = 1> <II = 1> <Delay = 1.23> <Storage> <Opcode : 'load' 'store'> <Ports = 2> <Width = 16> <Depth = 8192> <RAM>
ST_7 : Operation 60 [1/1] (0.00ns)   --->   "%br_ln209 = br void %arrayidx41.i.exit" [activation_accelerator.cpp:209]   --->   Operation 60 'br' 'br_ln209' <Predicate = (trunc_ln207 == 3)> <Delay = 0.00>


============================================================
+ Verbose Summary: Timing violations
============================================================
Target clock period: 10ns, clock uncertainty: 2.7ns.

 <State 1>: 1.53ns
The critical path consists of the following:
	'alloca' operation ('i') [10]  (0 ns)
	'load' operation ('i', activation_accelerator.cpp:207) on local variable 'i' [14]  (0 ns)
	'add' operation ('add_ln206', activation_accelerator.cpp:206) [18]  (0.853 ns)
	'store' operation ('store_ln206', activation_accelerator.cpp:206) of variable 'add_ln206', activation_accelerator.cpp:206 on local variable 'i' [58]  (0.427 ns)
	blocking operation 0.249 ns on control path)

 <State 2>: 1.76ns
The critical path consists of the following:
	'load' operation ('x_load', activation_accelerator.cpp:207) on array 'x' [30]  (1.24 ns)
	'mux' operation ('tmp_1', activation_accelerator.cpp:207) [34]  (0.525 ns)

 <State 3>: 6.44ns
The critical path consists of the following:
	'fadd' operation ('sum', activation_accelerator.cpp:207) [37]  (6.44 ns)

 <State 4>: 6.44ns
The critical path consists of the following:
	'fadd' operation ('sum', activation_accelerator.cpp:207) [37]  (6.44 ns)

 <State 5>: 6.44ns
The critical path consists of the following:
	'fadd' operation ('sum', activation_accelerator.cpp:207) [37]  (6.44 ns)

 <State 6>: 6.44ns
The critical path consists of the following:
	'fadd' operation ('sum', activation_accelerator.cpp:207) [37]  (6.44 ns)

 <State 7>: 1.24ns
The critical path consists of the following:
	'store' operation ('store_ln209', activation_accelerator.cpp:209) of variable 'trunc_ln', activation_accelerator.cpp:209 on array 'activation_accelerator_unsigned_short_unsigned_short_unsigned_short_int_i_3' [52]  (1.24 ns)


============================================================
+ Verbose Summary: Binding
============================================================
N/A
* FSMD analyzer results:
  - Output states:
 - Input state : 
  - Chain level:
	State 1
	State 2
	State 3
	State 4
	State 5
	State 6
	State 7


============================================================
+ Verbose Summary: Datapath Resource usage 
============================================================
N/A
