

================================================================
== Vitis HLS Report for 'activation_accelerator_Pipeline_VITIS_LOOP_171_1'
================================================================
* Date:           Sun Oct 12 09:48:03 2025

* Version:        2022.2 (Build 3670227 on Oct 13 2022)
* Project:        activation_accelerator
* Solution:       baseline (Vivado IP Flow Target)
* Product family: zynquplus
* Target device:  xck26-sfvc784-2LV-c


================================================================
== Performance Estimates
================================================================
+ Timing: 
    * Summary: 
    +--------+----------+----------+------------+
    |  Clock |  Target  | Estimated| Uncertainty|
    +--------+----------+----------+------------+
    |ap_clk  |  10.00 ns|  7.016 ns|     2.70 ns|
    +--------+----------+----------+------------+

+ Latency: 
    * Summary: 
    +---------+---------+----------+----------+-------+-------+---------+
    |  Latency (cycles) |  Latency (absolute) |    Interval   | Pipeline|
    |   min   |   max   |    min   |    max   |  min  |  max  |   Type  |
    +---------+---------+----------+----------+-------+-------+---------+
    |    98311|    98311|  0.983 ms|  0.983 ms|  98311|  98311|       no|
    +---------+---------+----------+----------+-------+-------+---------+

    + Detail: 
        * Instance: 
        N/A

        * Loop: 
        +--------------------+---------+---------+----------+-----------+-----------+-------+----------+
        |                    |  Latency (cycles) | Iteration|  Initiation Interval  |  Trip |          |
        |      Loop Name     |   min   |   max   |  Latency |  achieved |   target  | Count | Pipelined|
        +--------------------+---------+---------+----------+-----------+-----------+-------+----------+
        |- VITIS_LOOP_171_1  |    98309|    98309|         9|          3|          1|  32768|       yes|
        +--------------------+---------+---------+----------+-----------+-----------+-------+----------+

============================================================
+ Verbose Summary: Synthesis Manager
============================================================
InlineROM: 1
ExposeGlobal: 0
============================================================
+ Verbose Summary: CDFG Model
============================================================
IsTopModel: 0
ResetActiveHigh: 1
IsCombinational: 0
IsDatapathOnly: 0
HasWiredReturn: 1
HasMFsm: 2
HasVarLatency: 1
IsPipeline: 0
IsRtlPipelined: 0
IsInstanceOverlapped: 0
IsDontTouch: 0
HasImplIP: 0
IsGatedGlobalClock: 0

+ Individual pipeline summary: 
  * Pipeline-0: initiation interval (II) = 3, depth = 9


============================================================
+ Verbose Summary: Schedule
============================================================
* Number of FSM states : 9
* Pipeline : 1
  Pipeline-0 : II = 3, D = 9, States = { 1 2 3 4 5 6 7 8 9 }
* Dataflow Pipeline: 0

* FSM state transitions: 
1 --> 2 
2 --> 3 
3 --> 4 
4 --> 5 
5 --> 6 
6 --> 7 
7 --> 8 
8 --> 9 
9 --> 

* FSM state operations: 

State 1 <SV = 0> <Delay = 1.52>
ST_1 : Operation 12 [1/1] (0.00ns)   --->   "%sum_sq = alloca i32 1"   --->   Operation 12 'alloca' 'sum_sq' <Predicate = true> <Delay = 0.00>
ST_1 : Operation 13 [1/1] (0.00ns)   --->   "%i = alloca i32 1"   --->   Operation 13 'alloca' 'i' <Predicate = true> <Delay = 0.00>
ST_1 : Operation 14 [1/1] (0.42ns)   --->   "%store_ln0 = store i16 0, i16 %i"   --->   Operation 14 'store' 'store_ln0' <Predicate = true> <Delay = 0.42>
ST_1 : Operation 15 [1/1] (0.42ns)   --->   "%store_ln0 = store i32 0, i32 %sum_sq"   --->   Operation 15 'store' 'store_ln0' <Predicate = true> <Delay = 0.42>
ST_1 : Operation 16 [1/1] (0.00ns)   --->   "%br_ln0 = br void %for.inc.i127"   --->   Operation 16 'br' 'br_ln0' <Predicate = true> <Delay = 0.00>
ST_1 : Operation 17 [1/1] (0.00ns)   --->   "%i_14 = load i16 %i" [activation_accelerator.cpp:172]   --->   Operation 17 'load' 'i_14' <Predicate = true> <Delay = 0.00>
ST_1 : Operation 18 [1/1] (0.00ns)   --->   "%specpipeline_ln0 = specpipeline void @_ssdm_op_SpecPipeline, i32 4294967295, i32 0, i32 1, i32 0, void @p_str"   --->   Operation 18 'specpipeline' 'specpipeline_ln0' <Predicate = true> <Delay = 0.00>
ST_1 : Operation 19 [1/1] (1.10ns)   --->   "%icmp_ln171 = icmp_eq  i16 %i_14, i16 32768" [activation_accelerator.cpp:171]   --->   Operation 19 'icmp' 'icmp_ln171' <Predicate = true> <Delay = 1.10> <CoreInst = "Cmp">   --->   Core 9 'Cmp' <Latency = 0> <II = 1> <Delay = 1.10> <FuncUnit> <Opcode : 'icmp'> <InPorts = 2> <OutPorts = 1>
ST_1 : Operation 20 [1/1] (0.00ns)   --->   "%empty = speclooptripcount i32 @_ssdm_op_SpecLoopTripCount, i64 32768, i64 32768, i64 32768"   --->   Operation 20 'speclooptripcount' 'empty' <Predicate = true> <Delay = 0.00>
ST_1 : Operation 21 [1/1] (0.85ns)   --->   "%add_ln171 = add i16 %i_14, i16 1" [activation_accelerator.cpp:171]   --->   Operation 21 'add' 'add_ln171' <Predicate = true> <Delay = 0.85> <CoreInst = "Adder">   --->   Core 1 'Adder' <Latency = 0> <II = 1> <Delay = 0.85> <FuncUnit> <Opcode : 'add' 'sub'> <InPorts = 2> <OutPorts = 1>
ST_1 : Operation 22 [1/1] (0.00ns)   --->   "%br_ln171 = br i1 %icmp_ln171, void %for.inc.i127.split, void %for.end.i129.exitStub" [activation_accelerator.cpp:171]   --->   Operation 22 'br' 'br_ln171' <Predicate = true> <Delay = 0.00>
ST_1 : Operation 23 [1/1] (0.00ns)   --->   "%lshr_ln7 = partselect i13 @_ssdm_op_PartSelect.i13.i16.i32.i32, i16 %i_14, i32 2, i32 14" [activation_accelerator.cpp:172]   --->   Operation 23 'partselect' 'lshr_ln7' <Predicate = (!icmp_ln171)> <Delay = 0.00>
ST_1 : Operation 24 [1/1] (0.00ns)   --->   "%zext_ln172 = zext i13 %lshr_ln7" [activation_accelerator.cpp:172]   --->   Operation 24 'zext' 'zext_ln172' <Predicate = (!icmp_ln171)> <Delay = 0.00>
ST_1 : Operation 25 [1/1] (0.00ns)   --->   "%x_addr = getelementptr i32 %x, i64 0, i64 %zext_ln172" [activation_accelerator.cpp:172]   --->   Operation 25 'getelementptr' 'x_addr' <Predicate = (!icmp_ln171)> <Delay = 0.00>
ST_1 : Operation 26 [1/1] (0.00ns)   --->   "%x_2_addr = getelementptr i32 %x_2, i64 0, i64 %zext_ln172" [activation_accelerator.cpp:172]   --->   Operation 26 'getelementptr' 'x_2_addr' <Predicate = (!icmp_ln171)> <Delay = 0.00>
ST_1 : Operation 27 [1/1] (0.00ns)   --->   "%x_4_addr = getelementptr i32 %x_4, i64 0, i64 %zext_ln172" [activation_accelerator.cpp:172]   --->   Operation 27 'getelementptr' 'x_4_addr' <Predicate = (!icmp_ln171)> <Delay = 0.00>
ST_1 : Operation 28 [1/1] (0.00ns)   --->   "%x_6_addr = getelementptr i32 %x_6, i64 0, i64 %zext_ln172" [activation_accelerator.cpp:172]   --->   Operation 28 'getelementptr' 'x_6_addr' <Predicate = (!icmp_ln171)> <Delay = 0.00>
ST_1 : Operation 29 [1/1] (0.00ns)   --->   "%trunc_ln172 = trunc i16 %i_14" [activation_accelerator.cpp:172]   --->   Operation 29 'trunc' 'trunc_ln172' <Predicate = (!icmp_ln171)> <Delay = 0.00>
ST_1 : Operation 30 [2/2] (1.23ns)   --->   "%x_load = load i13 %x_addr" [activation_accelerator.cpp:172]   --->   Operation 30 'load' 'x_load' <Predicate = (!icmp_ln171)> <Delay = 1.23> <CoreInst = "RAM">   --->   Core 83 'RAM' <Latency = 1> <II = 1> <Delay = 1.23> <Storage> <Opcode : 'load' 'store'> <Ports = 2> <Width = 32> <Depth = 8192> <RAM>
ST_1 : Operation 31 [2/2] (1.23ns)   --->   "%x_2_load = load i13 %x_2_addr" [activation_accelerator.cpp:172]   --->   Operation 31 'load' 'x_2_load' <Predicate = (!icmp_ln171)> <Delay = 1.23> <CoreInst = "RAM">   --->   Core 83 'RAM' <Latency = 1> <II = 1> <Delay = 1.23> <Storage> <Opcode : 'load' 'store'> <Ports = 2> <Width = 32> <Depth = 8192> <RAM>
ST_1 : Operation 32 [2/2] (1.23ns)   --->   "%x_4_load = load i13 %x_4_addr" [activation_accelerator.cpp:172]   --->   Operation 32 'load' 'x_4_load' <Predicate = (!icmp_ln171)> <Delay = 1.23> <CoreInst = "RAM">   --->   Core 83 'RAM' <Latency = 1> <II = 1> <Delay = 1.23> <Storage> <Opcode : 'load' 'store'> <Ports = 2> <Width = 32> <Depth = 8192> <RAM>
ST_1 : Operation 33 [2/2] (1.23ns)   --->   "%x_6_load = load i13 %x_6_addr" [activation_accelerator.cpp:172]   --->   Operation 33 'load' 'x_6_load' <Predicate = (!icmp_ln171)> <Delay = 1.23> <CoreInst = "RAM">   --->   Core 83 'RAM' <Latency = 1> <II = 1> <Delay = 1.23> <Storage> <Opcode : 'load' 'store'> <Ports = 2> <Width = 32> <Depth = 8192> <RAM>
ST_1 : Operation 34 [1/1] (0.42ns)   --->   "%store_ln171 = store i16 %add_ln171, i16 %i" [activation_accelerator.cpp:171]   --->   Operation 34 'store' 'store_ln171' <Predicate = (!icmp_ln171)> <Delay = 0.42>

State 2 <SV = 1> <Delay = 1.76>
ST_2 : Operation 35 [1/2] (1.23ns)   --->   "%x_load = load i13 %x_addr" [activation_accelerator.cpp:172]   --->   Operation 35 'load' 'x_load' <Predicate = (!icmp_ln171)> <Delay = 1.23> <CoreInst = "RAM">   --->   Core 83 'RAM' <Latency = 1> <II = 1> <Delay = 1.23> <Storage> <Opcode : 'load' 'store'> <Ports = 2> <Width = 32> <Depth = 8192> <RAM>
ST_2 : Operation 36 [1/2] (1.23ns)   --->   "%x_2_load = load i13 %x_2_addr" [activation_accelerator.cpp:172]   --->   Operation 36 'load' 'x_2_load' <Predicate = (!icmp_ln171)> <Delay = 1.23> <CoreInst = "RAM">   --->   Core 83 'RAM' <Latency = 1> <II = 1> <Delay = 1.23> <Storage> <Opcode : 'load' 'store'> <Ports = 2> <Width = 32> <Depth = 8192> <RAM>
ST_2 : Operation 37 [1/2] (1.23ns)   --->   "%x_4_load = load i13 %x_4_addr" [activation_accelerator.cpp:172]   --->   Operation 37 'load' 'x_4_load' <Predicate = (!icmp_ln171)> <Delay = 1.23> <CoreInst = "RAM">   --->   Core 83 'RAM' <Latency = 1> <II = 1> <Delay = 1.23> <Storage> <Opcode : 'load' 'store'> <Ports = 2> <Width = 32> <Depth = 8192> <RAM>
ST_2 : Operation 38 [1/2] (1.23ns)   --->   "%x_6_load = load i13 %x_6_addr" [activation_accelerator.cpp:172]   --->   Operation 38 'load' 'x_6_load' <Predicate = (!icmp_ln171)> <Delay = 1.23> <CoreInst = "RAM">   --->   Core 83 'RAM' <Latency = 1> <II = 1> <Delay = 1.23> <Storage> <Opcode : 'load' 'store'> <Ports = 2> <Width = 32> <Depth = 8192> <RAM>
ST_2 : Operation 39 [1/1] (0.52ns)   --->   "%tmp_8 = mux i32 @_ssdm_op_Mux.ap_auto.4f32.i2, i32 %x_load, i32 %x_2_load, i32 %x_4_load, i32 %x_6_load, i2 %trunc_ln172" [activation_accelerator.cpp:172]   --->   Operation 39 'mux' 'tmp_8' <Predicate = (!icmp_ln171)> <Delay = 0.52> <CoreInst = "Multiplexer">   --->   Core 76 'Multiplexer' <Latency = 0> <II = 1> <Delay = 0.52> <FuncUnit> <Opcode : 'mux'> <InPorts = 2> <OutPorts = 1>

State 3 <SV = 2> <Delay = 7.01>
ST_3 : Operation 40 [3/3] (7.01ns)   --->   "%mul_i2 = fmul i32 %tmp_8, i32 %tmp_8" [activation_accelerator.cpp:172]   --->   Operation 40 'fmul' 'mul_i2' <Predicate = (!icmp_ln171)> <Delay = 7.01> <CoreInst = "FMul_maxdsp">   --->   Core 30 'FMul_maxdsp' <Latency = 2> <II = 1> <Delay = 7.01> <FuncUnit> <Opcode : 'fmul'> <InPorts = 2> <OutPorts = 1>

State 4 <SV = 3> <Delay = 7.01>
ST_4 : Operation 41 [2/3] (7.01ns)   --->   "%mul_i2 = fmul i32 %tmp_8, i32 %tmp_8" [activation_accelerator.cpp:172]   --->   Operation 41 'fmul' 'mul_i2' <Predicate = true> <Delay = 7.01> <CoreInst = "FMul_maxdsp">   --->   Core 30 'FMul_maxdsp' <Latency = 2> <II = 1> <Delay = 7.01> <FuncUnit> <Opcode : 'fmul'> <InPorts = 2> <OutPorts = 1>

State 5 <SV = 4> <Delay = 7.01>
ST_5 : Operation 42 [1/3] (7.01ns)   --->   "%mul_i2 = fmul i32 %tmp_8, i32 %tmp_8" [activation_accelerator.cpp:172]   --->   Operation 42 'fmul' 'mul_i2' <Predicate = true> <Delay = 7.01> <CoreInst = "FMul_maxdsp">   --->   Core 30 'FMul_maxdsp' <Latency = 2> <II = 1> <Delay = 7.01> <FuncUnit> <Opcode : 'fmul'> <InPorts = 2> <OutPorts = 1>

State 6 <SV = 5> <Delay = 6.43>
ST_6 : Operation 43 [1/1] (0.00ns)   --->   "%sum_sq_load = load i32 %sum_sq" [activation_accelerator.cpp:172]   --->   Operation 43 'load' 'sum_sq_load' <Predicate = true> <Delay = 0.00>
ST_6 : Operation 44 [4/4] (6.43ns)   --->   "%sum_sq_1 = fadd i32 %sum_sq_load, i32 %mul_i2" [activation_accelerator.cpp:172]   --->   Operation 44 'fadd' 'sum_sq_1' <Predicate = true> <Delay = 6.43> <CoreInst = "FAddSub_fulldsp">   --->   Core 18 'FAddSub_fulldsp' <Latency = 3> <II = 1> <Delay = 6.43> <FuncUnit> <Opcode : 'fadd' 'fsub'> <InPorts = 2> <OutPorts = 1>
ST_6 : Operation 51 [1/1] (0.00ns)   --->   "%sum_sq_load_1 = load i32 %sum_sq"   --->   Operation 51 'load' 'sum_sq_load_1' <Predicate = (icmp_ln171)> <Delay = 0.00>
ST_6 : Operation 52 [1/1] (0.00ns)   --->   "%write_ln0 = write void @_ssdm_op_Write.ap_auto.floatP0A, i32 %sum_sq_out, i32 %sum_sq_load_1"   --->   Operation 52 'write' 'write_ln0' <Predicate = (icmp_ln171)> <Delay = 0.00>
ST_6 : Operation 53 [1/1] (0.00ns)   --->   "%ret_ln0 = ret"   --->   Operation 53 'ret' 'ret_ln0' <Predicate = (icmp_ln171)> <Delay = 0.00>

State 7 <SV = 6> <Delay = 6.43>
ST_7 : Operation 45 [3/4] (6.43ns)   --->   "%sum_sq_1 = fadd i32 %sum_sq_load, i32 %mul_i2" [activation_accelerator.cpp:172]   --->   Operation 45 'fadd' 'sum_sq_1' <Predicate = true> <Delay = 6.43> <CoreInst = "FAddSub_fulldsp">   --->   Core 18 'FAddSub_fulldsp' <Latency = 3> <II = 1> <Delay = 6.43> <FuncUnit> <Opcode : 'fadd' 'fsub'> <InPorts = 2> <OutPorts = 1>

State 8 <SV = 7> <Delay = 6.43>
ST_8 : Operation 46 [2/4] (6.43ns)   --->   "%sum_sq_1 = fadd i32 %sum_sq_load, i32 %mul_i2" [activation_accelerator.cpp:172]   --->   Operation 46 'fadd' 'sum_sq_1' <Predicate = true> <Delay = 6.43> <CoreInst = "FAddSub_fulldsp">   --->   Core 18 'FAddSub_fulldsp' <Latency = 3> <II = 1> <Delay = 6.43> <FuncUnit> <Opcode : 'fadd' 'fsub'> <InPorts = 2> <OutPorts = 1>

State 9 <SV = 8> <Delay = 6.86>
ST_9 : Operation 47 [1/1] (0.00ns)   --->   "%specloopname_ln170 = specloopname void @_ssdm_op_SpecLoopName, void @empty_31" [activation_accelerator.cpp:170]   --->   Operation 47 'specloopname' 'specloopname_ln170' <Predicate = true> <Delay = 0.00>
ST_9 : Operation 48 [1/4] (6.43ns)   --->   "%sum_sq_1 = fadd i32 %sum_sq_load, i32 %mul_i2" [activation_accelerator.cpp:172]   --->   Operation 48 'fadd' 'sum_sq_1' <Predicate = true> <Delay = 6.43> <CoreInst = "FAddSub_fulldsp">   --->   Core 18 'FAddSub_fulldsp' <Latency = 3> <II = 1> <Delay = 6.43> <FuncUnit> <Opcode : 'fadd' 'fsub'> <InPorts = 2> <OutPorts = 1>
ST_9 : Operation 49 [1/1] (0.42ns)   --->   "%store_ln171 = store i32 %sum_sq_1, i32 %sum_sq" [activation_accelerator.cpp:171]   --->   Operation 49 'store' 'store_ln171' <Predicate = true> <Delay = 0.42>
ST_9 : Operation 50 [1/1] (0.00ns)   --->   "%br_ln171 = br void %for.inc.i127" [activation_accelerator.cpp:171]   --->   Operation 50 'br' 'br_ln171' <Predicate = true> <Delay = 0.00>


============================================================
+ Verbose Summary: Timing violations
============================================================
Target clock period: 10ns, clock uncertainty: 2.7ns.

 <State 1>: 1.53ns
The critical path consists of the following:
	'alloca' operation ('i') [7]  (0 ns)
	'load' operation ('i', activation_accelerator.cpp:172) on local variable 'i' [12]  (0 ns)
	'add' operation ('add_ln171', activation_accelerator.cpp:171) [16]  (0.853 ns)
	'store' operation ('store_ln171', activation_accelerator.cpp:171) of variable 'add_ln171', activation_accelerator.cpp:171 on local variable 'i' [35]  (0.427 ns)
	blocking operation 0.249 ns on control path)

 <State 2>: 1.76ns
The critical path consists of the following:
	'load' operation ('x_load', activation_accelerator.cpp:172) on array 'x' [28]  (1.24 ns)
	'mux' operation ('tmp_8', activation_accelerator.cpp:172) [32]  (0.525 ns)

 <State 3>: 7.02ns
The critical path consists of the following:
	'fmul' operation ('mul_i2', activation_accelerator.cpp:172) [33]  (7.02 ns)

 <State 4>: 7.02ns
The critical path consists of the following:
	'fmul' operation ('mul_i2', activation_accelerator.cpp:172) [33]  (7.02 ns)

 <State 5>: 7.02ns
The critical path consists of the following:
	'fmul' operation ('mul_i2', activation_accelerator.cpp:172) [33]  (7.02 ns)

 <State 6>: 6.44ns
The critical path consists of the following:
	'load' operation ('sum_sq_load', activation_accelerator.cpp:172) on local variable 'sum_sq' [19]  (0 ns)
	'fadd' operation ('sum_sq', activation_accelerator.cpp:172) [34]  (6.44 ns)

 <State 7>: 6.44ns
The critical path consists of the following:
	'fadd' operation ('sum_sq', activation_accelerator.cpp:172) [34]  (6.44 ns)

 <State 8>: 6.44ns
The critical path consists of the following:
	'fadd' operation ('sum_sq', activation_accelerator.cpp:172) [34]  (6.44 ns)

 <State 9>: 6.86ns
The critical path consists of the following:
	'fadd' operation ('sum_sq', activation_accelerator.cpp:172) [34]  (6.44 ns)
	'store' operation ('store_ln171', activation_accelerator.cpp:171) of variable 'sum_sq', activation_accelerator.cpp:172 on local variable 'sum_sq' [36]  (0.427 ns)


============================================================
+ Verbose Summary: Binding
============================================================
N/A
* FSMD analyzer results:
  - Output states:
 - Input state : 
  - Chain level:
	State 1
	State 2
	State 3
	State 4
	State 5
	State 6
	State 7
	State 8
	State 9


============================================================
+ Verbose Summary: Datapath Resource usage 
============================================================
N/A
