

================================================================
== Vitis HLS Report for 'activation_accelerator_Pipeline_VITIS_LOOP_324_1'
================================================================
* Date:           Sun Oct 12 09:48:04 2025

* Version:        2022.2 (Build 3670227 on Oct 13 2022)
* Project:        activation_accelerator
* Solution:       baseline (Vivado IP Flow Target)
* Product family: zynquplus
* Target device:  xck26-sfvc784-2LV-c


================================================================
== Performance Estimates
================================================================
+ Timing: 
    * Summary: 
    +--------+----------+----------+------------+
    |  Clock |  Target  | Estimated| Uncertainty|
    +--------+----------+----------+------------+
    |ap_clk  |  10.00 ns|  7.016 ns|     2.70 ns|
    +--------+----------+----------+------------+

+ Latency: 
    * Summary: 
    +---------+---------+----------+----------+-------+-------+---------+
    |  Latency (cycles) |  Latency (absolute) |    Interval   | Pipeline|
    |   min   |   max   |    min   |    max   |  min  |  max  |   Type  |
    +---------+---------+----------+----------+-------+-------+---------+
    |    32774|    32774|  0.328 ms|  0.328 ms|  32774|  32774|       no|
    +---------+---------+----------+----------+-------+-------+---------+

    + Detail: 
        * Instance: 
        N/A

        * Loop: 
        +--------------------+---------+---------+----------+-----------+-----------+-------+----------+
        |                    |  Latency (cycles) | Iteration|  Initiation Interval  |  Trip |          |
        |      Loop Name     |   min   |   max   |  Latency |  achieved |   target  | Count | Pipelined|
        +--------------------+---------+---------+----------+-----------+-----------+-------+----------+
        |- VITIS_LOOP_324_1  |    32772|    32772|         6|          1|          1|  32768|       yes|
        +--------------------+---------+---------+----------+-----------+-----------+-------+----------+

============================================================
+ Verbose Summary: Synthesis Manager
============================================================
InlineROM: 1
ExposeGlobal: 0
============================================================
+ Verbose Summary: CDFG Model
============================================================
IsTopModel: 0
ResetActiveHigh: 1
IsCombinational: 0
IsDatapathOnly: 0
HasWiredReturn: 1
HasMFsm: 2
HasVarLatency: 1
IsPipeline: 0
IsRtlPipelined: 0
IsInstanceOverlapped: 0
IsDontTouch: 0
HasImplIP: 0
IsGatedGlobalClock: 0

+ Individual pipeline summary: 
  * Pipeline-0: initiation interval (II) = 1, depth = 6


============================================================
+ Verbose Summary: Schedule
============================================================
* Number of FSM states : 6
* Pipeline : 1
  Pipeline-0 : II = 1, D = 6, States = { 1 2 3 4 5 6 }
* Dataflow Pipeline: 0

* FSM state transitions: 
1 --> 2 
2 --> 3 
3 --> 4 
4 --> 5 
5 --> 6 
6 --> 

* FSM state operations: 

State 1 <SV = 0> <Delay = 1.52>
ST_1 : Operation 9 [1/1] (0.00ns)   --->   "%i = alloca i32 1"   --->   Operation 9 'alloca' 'i' <Predicate = true> <Delay = 0.00>
ST_1 : Operation 10 [1/1] (0.42ns)   --->   "%store_ln0 = store i16 0, i16 %i"   --->   Operation 10 'store' 'store_ln0' <Predicate = true> <Delay = 0.42>
ST_1 : Operation 11 [1/1] (0.00ns)   --->   "%br_ln0 = br void %for.inc.i58"   --->   Operation 11 'br' 'br_ln0' <Predicate = true> <Delay = 0.00>
ST_1 : Operation 12 [1/1] (0.00ns)   --->   "%i_8 = load i16 %i" [activation_accelerator.cpp:324]   --->   Operation 12 'load' 'i_8' <Predicate = true> <Delay = 0.00>
ST_1 : Operation 13 [1/1] (0.00ns)   --->   "%specpipeline_ln0 = specpipeline void @_ssdm_op_SpecPipeline, i32 4294967295, i32 0, i32 1, i32 0, void @p_str"   --->   Operation 13 'specpipeline' 'specpipeline_ln0' <Predicate = true> <Delay = 0.00>
ST_1 : Operation 14 [1/1] (1.10ns)   --->   "%icmp_ln324 = icmp_eq  i16 %i_8, i16 32768" [activation_accelerator.cpp:324]   --->   Operation 14 'icmp' 'icmp_ln324' <Predicate = true> <Delay = 1.10> <CoreInst = "Cmp">   --->   Core 9 'Cmp' <Latency = 0> <II = 1> <Delay = 1.10> <FuncUnit> <Opcode : 'icmp'> <InPorts = 2> <OutPorts = 1>
ST_1 : Operation 15 [1/1] (0.00ns)   --->   "%empty = speclooptripcount i32 @_ssdm_op_SpecLoopTripCount, i64 32768, i64 32768, i64 32768"   --->   Operation 15 'speclooptripcount' 'empty' <Predicate = true> <Delay = 0.00>
ST_1 : Operation 16 [1/1] (0.85ns)   --->   "%add_ln324 = add i16 %i_8, i16 1" [activation_accelerator.cpp:324]   --->   Operation 16 'add' 'add_ln324' <Predicate = true> <Delay = 0.85> <CoreInst = "Adder">   --->   Core 1 'Adder' <Latency = 0> <II = 1> <Delay = 0.85> <FuncUnit> <Opcode : 'add' 'sub'> <InPorts = 2> <OutPorts = 1>
ST_1 : Operation 17 [1/1] (0.00ns)   --->   "%br_ln324 = br i1 %icmp_ln324, void %for.inc.i58.split, void %for.end.i.exitStub" [activation_accelerator.cpp:324]   --->   Operation 17 'br' 'br_ln324' <Predicate = true> <Delay = 0.00>
ST_1 : Operation 18 [1/1] (0.00ns)   --->   "%i_19_cast29 = zext i16 %i_8" [activation_accelerator.cpp:324]   --->   Operation 18 'zext' 'i_19_cast29' <Predicate = (!icmp_ln324)> <Delay = 0.00>
ST_1 : Operation 19 [1/1] (0.00ns)   --->   "%lshr_ln = partselect i13 @_ssdm_op_PartSelect.i13.i16.i32.i32, i16 %i_8, i32 2, i32 14" [activation_accelerator.cpp:324]   --->   Operation 19 'partselect' 'lshr_ln' <Predicate = (!icmp_ln324)> <Delay = 0.00>
ST_1 : Operation 20 [1/1] (0.00ns)   --->   "%zext_ln324 = zext i13 %lshr_ln" [activation_accelerator.cpp:324]   --->   Operation 20 'zext' 'zext_ln324' <Predicate = (!icmp_ln324)> <Delay = 0.00>
ST_1 : Operation 21 [1/1] (0.00ns)   --->   "%x_addr = getelementptr i32 %x, i64 0, i64 %zext_ln324" [activation_accelerator.cpp:324]   --->   Operation 21 'getelementptr' 'x_addr' <Predicate = (!icmp_ln324)> <Delay = 0.00>
ST_1 : Operation 22 [1/1] (0.00ns)   --->   "%x_2_addr = getelementptr i32 %x_2, i64 0, i64 %zext_ln324" [activation_accelerator.cpp:324]   --->   Operation 22 'getelementptr' 'x_2_addr' <Predicate = (!icmp_ln324)> <Delay = 0.00>
ST_1 : Operation 23 [1/1] (0.00ns)   --->   "%x_4_addr = getelementptr i32 %x_4, i64 0, i64 %zext_ln324" [activation_accelerator.cpp:324]   --->   Operation 23 'getelementptr' 'x_4_addr' <Predicate = (!icmp_ln324)> <Delay = 0.00>
ST_1 : Operation 24 [1/1] (0.00ns)   --->   "%x_6_addr = getelementptr i32 %x_6, i64 0, i64 %zext_ln324" [activation_accelerator.cpp:324]   --->   Operation 24 'getelementptr' 'x_6_addr' <Predicate = (!icmp_ln324)> <Delay = 0.00>
ST_1 : Operation 25 [1/1] (0.00ns)   --->   "%trunc_ln324 = trunc i16 %i_8" [activation_accelerator.cpp:324]   --->   Operation 25 'trunc' 'trunc_ln324' <Predicate = (!icmp_ln324)> <Delay = 0.00>
ST_1 : Operation 26 [2/2] (1.23ns)   --->   "%x_load = load i13 %x_addr" [activation_accelerator.cpp:324]   --->   Operation 26 'load' 'x_load' <Predicate = (!icmp_ln324)> <Delay = 1.23> <CoreInst = "RAM">   --->   Core 83 'RAM' <Latency = 1> <II = 1> <Delay = 1.23> <Storage> <Opcode : 'load' 'store'> <Ports = 2> <Width = 32> <Depth = 8192> <RAM>
ST_1 : Operation 27 [2/2] (1.23ns)   --->   "%x_2_load = load i13 %x_2_addr" [activation_accelerator.cpp:324]   --->   Operation 27 'load' 'x_2_load' <Predicate = (!icmp_ln324)> <Delay = 1.23> <CoreInst = "RAM">   --->   Core 83 'RAM' <Latency = 1> <II = 1> <Delay = 1.23> <Storage> <Opcode : 'load' 'store'> <Ports = 2> <Width = 32> <Depth = 8192> <RAM>
ST_1 : Operation 28 [2/2] (1.23ns)   --->   "%x_4_load = load i13 %x_4_addr" [activation_accelerator.cpp:324]   --->   Operation 28 'load' 'x_4_load' <Predicate = (!icmp_ln324)> <Delay = 1.23> <CoreInst = "RAM">   --->   Core 83 'RAM' <Latency = 1> <II = 1> <Delay = 1.23> <Storage> <Opcode : 'load' 'store'> <Ports = 2> <Width = 32> <Depth = 8192> <RAM>
ST_1 : Operation 29 [2/2] (1.23ns)   --->   "%x_6_load = load i13 %x_6_addr" [activation_accelerator.cpp:324]   --->   Operation 29 'load' 'x_6_load' <Predicate = (!icmp_ln324)> <Delay = 1.23> <CoreInst = "RAM">   --->   Core 83 'RAM' <Latency = 1> <II = 1> <Delay = 1.23> <Storage> <Opcode : 'load' 'store'> <Ports = 2> <Width = 32> <Depth = 8192> <RAM>
ST_1 : Operation 30 [1/1] (0.00ns)   --->   "%y_addr = getelementptr i32 %y, i64 0, i64 %i_19_cast29" [activation_accelerator.cpp:324]   --->   Operation 30 'getelementptr' 'y_addr' <Predicate = (!icmp_ln324)> <Delay = 0.00>
ST_1 : Operation 31 [2/2] (1.23ns)   --->   "%y_load = load i15 %y_addr" [activation_accelerator.cpp:324]   --->   Operation 31 'load' 'y_load' <Predicate = (!icmp_ln324)> <Delay = 1.23> <CoreInst = "RAM">   --->   Core 83 'RAM' <Latency = 1> <II = 1> <Delay = 1.23> <Storage> <Opcode : 'load' 'store'> <Ports = 2> <Width = 32> <Depth = 32768> <RAM>
ST_1 : Operation 32 [1/1] (0.42ns)   --->   "%store_ln324 = store i16 %add_ln324, i16 %i" [activation_accelerator.cpp:324]   --->   Operation 32 'store' 'store_ln324' <Predicate = (!icmp_ln324)> <Delay = 0.42>

State 2 <SV = 1> <Delay = 1.76>
ST_2 : Operation 33 [1/2] (1.23ns)   --->   "%x_load = load i13 %x_addr" [activation_accelerator.cpp:324]   --->   Operation 33 'load' 'x_load' <Predicate = true> <Delay = 1.23> <CoreInst = "RAM">   --->   Core 83 'RAM' <Latency = 1> <II = 1> <Delay = 1.23> <Storage> <Opcode : 'load' 'store'> <Ports = 2> <Width = 32> <Depth = 8192> <RAM>
ST_2 : Operation 34 [1/2] (1.23ns)   --->   "%x_2_load = load i13 %x_2_addr" [activation_accelerator.cpp:324]   --->   Operation 34 'load' 'x_2_load' <Predicate = true> <Delay = 1.23> <CoreInst = "RAM">   --->   Core 83 'RAM' <Latency = 1> <II = 1> <Delay = 1.23> <Storage> <Opcode : 'load' 'store'> <Ports = 2> <Width = 32> <Depth = 8192> <RAM>
ST_2 : Operation 35 [1/2] (1.23ns)   --->   "%x_4_load = load i13 %x_4_addr" [activation_accelerator.cpp:324]   --->   Operation 35 'load' 'x_4_load' <Predicate = true> <Delay = 1.23> <CoreInst = "RAM">   --->   Core 83 'RAM' <Latency = 1> <II = 1> <Delay = 1.23> <Storage> <Opcode : 'load' 'store'> <Ports = 2> <Width = 32> <Depth = 8192> <RAM>
ST_2 : Operation 36 [1/2] (1.23ns)   --->   "%x_6_load = load i13 %x_6_addr" [activation_accelerator.cpp:324]   --->   Operation 36 'load' 'x_6_load' <Predicate = true> <Delay = 1.23> <CoreInst = "RAM">   --->   Core 83 'RAM' <Latency = 1> <II = 1> <Delay = 1.23> <Storage> <Opcode : 'load' 'store'> <Ports = 2> <Width = 32> <Depth = 8192> <RAM>
ST_2 : Operation 37 [1/1] (0.52ns)   --->   "%tmp_2 = mux i32 @_ssdm_op_Mux.ap_auto.4f32.i2, i32 %x_load, i32 %x_2_load, i32 %x_4_load, i32 %x_6_load, i2 %trunc_ln324" [activation_accelerator.cpp:324]   --->   Operation 37 'mux' 'tmp_2' <Predicate = true> <Delay = 0.52> <CoreInst = "Multiplexer">   --->   Core 76 'Multiplexer' <Latency = 0> <II = 1> <Delay = 0.52> <FuncUnit> <Opcode : 'mux'> <InPorts = 2> <OutPorts = 1>
ST_2 : Operation 38 [1/2] (1.23ns)   --->   "%y_load = load i15 %y_addr" [activation_accelerator.cpp:324]   --->   Operation 38 'load' 'y_load' <Predicate = true> <Delay = 1.23> <CoreInst = "RAM">   --->   Core 83 'RAM' <Latency = 1> <II = 1> <Delay = 1.23> <Storage> <Opcode : 'load' 'store'> <Ports = 2> <Width = 32> <Depth = 32768> <RAM>

State 3 <SV = 2> <Delay = 7.01>
ST_3 : Operation 39 [3/3] (7.01ns)   --->   "%mul_i = fmul i32 %tmp_2, i32 %y_load" [activation_accelerator.cpp:324]   --->   Operation 39 'fmul' 'mul_i' <Predicate = true> <Delay = 7.01> <CoreInst = "FMul_maxdsp">   --->   Core 30 'FMul_maxdsp' <Latency = 2> <II = 1> <Delay = 7.01> <FuncUnit> <Opcode : 'fmul'> <InPorts = 2> <OutPorts = 1>

State 4 <SV = 3> <Delay = 7.01>
ST_4 : Operation 40 [2/3] (7.01ns)   --->   "%mul_i = fmul i32 %tmp_2, i32 %y_load" [activation_accelerator.cpp:324]   --->   Operation 40 'fmul' 'mul_i' <Predicate = true> <Delay = 7.01> <CoreInst = "FMul_maxdsp">   --->   Core 30 'FMul_maxdsp' <Latency = 2> <II = 1> <Delay = 7.01> <FuncUnit> <Opcode : 'fmul'> <InPorts = 2> <OutPorts = 1>

State 5 <SV = 4> <Delay = 7.01>
ST_5 : Operation 41 [1/3] (7.01ns)   --->   "%mul_i = fmul i32 %tmp_2, i32 %y_load" [activation_accelerator.cpp:324]   --->   Operation 41 'fmul' 'mul_i' <Predicate = true> <Delay = 7.01> <CoreInst = "FMul_maxdsp">   --->   Core 30 'FMul_maxdsp' <Latency = 2> <II = 1> <Delay = 7.01> <FuncUnit> <Opcode : 'fmul'> <InPorts = 2> <OutPorts = 1>
ST_5 : Operation 46 [1/1] (0.00ns)   --->   "%ret_ln0 = ret"   --->   Operation 46 'ret' 'ret_ln0' <Predicate = (icmp_ln324)> <Delay = 0.00>

State 6 <SV = 5> <Delay = 1.23>
ST_6 : Operation 42 [1/1] (0.00ns)   --->   "%specloopname_ln324 = specloopname void @_ssdm_op_SpecLoopName, void @empty_27" [activation_accelerator.cpp:324]   --->   Operation 42 'specloopname' 'specloopname_ln324' <Predicate = true> <Delay = 0.00>
ST_6 : Operation 43 [1/1] (0.00ns)   --->   "%x_mask_addr = getelementptr i32 %x_mask, i64 0, i64 %i_19_cast29" [activation_accelerator.cpp:324]   --->   Operation 43 'getelementptr' 'x_mask_addr' <Predicate = true> <Delay = 0.00>
ST_6 : Operation 44 [1/1] (1.23ns)   --->   "%store_ln324 = store i32 %mul_i, i15 %x_mask_addr" [activation_accelerator.cpp:324]   --->   Operation 44 'store' 'store_ln324' <Predicate = true> <Delay = 1.23> <CoreInst = "RAM">   --->   Core 83 'RAM' <Latency = 1> <II = 1> <Delay = 1.23> <Storage> <Opcode : 'load' 'store'> <Ports = 2> <Width = 32> <Depth = 32768> <RAM>
ST_6 : Operation 45 [1/1] (0.00ns)   --->   "%br_ln324 = br void %for.inc.i58" [activation_accelerator.cpp:324]   --->   Operation 45 'br' 'br_ln324' <Predicate = true> <Delay = 0.00>


============================================================
+ Verbose Summary: Timing violations
============================================================
Target clock period: 10ns, clock uncertainty: 2.7ns.

 <State 1>: 1.53ns
The critical path consists of the following:
	'alloca' operation ('i') [7]  (0 ns)
	'load' operation ('i', activation_accelerator.cpp:324) on local variable 'i' [11]  (0 ns)
	'add' operation ('add_ln324', activation_accelerator.cpp:324) [15]  (0.853 ns)
	'store' operation ('store_ln324', activation_accelerator.cpp:324) of variable 'add_ln324', activation_accelerator.cpp:324 on local variable 'i' [37]  (0.427 ns)
	blocking operation 0.249 ns on control path)

 <State 2>: 1.76ns
The critical path consists of the following:
	'load' operation ('x_load', activation_accelerator.cpp:324) on array 'x' [27]  (1.24 ns)
	'mux' operation ('tmp_2', activation_accelerator.cpp:324) [31]  (0.525 ns)

 <State 3>: 7.02ns
The critical path consists of the following:
	'fmul' operation ('mul_i', activation_accelerator.cpp:324) [34]  (7.02 ns)

 <State 4>: 7.02ns
The critical path consists of the following:
	'fmul' operation ('mul_i', activation_accelerator.cpp:324) [34]  (7.02 ns)

 <State 5>: 7.02ns
The critical path consists of the following:
	'fmul' operation ('mul_i', activation_accelerator.cpp:324) [34]  (7.02 ns)

 <State 6>: 1.24ns
The critical path consists of the following:
	'getelementptr' operation ('x_mask_addr', activation_accelerator.cpp:324) [35]  (0 ns)
	'store' operation ('store_ln324', activation_accelerator.cpp:324) of variable 'mul_i', activation_accelerator.cpp:324 on array 'x_mask' [36]  (1.24 ns)


============================================================
+ Verbose Summary: Binding
============================================================
N/A
* FSMD analyzer results:
  - Output states:
 - Input state : 
  - Chain level:
	State 1
	State 2
	State 3
	State 4
	State 5
	State 6


============================================================
+ Verbose Summary: Datapath Resource usage 
============================================================
N/A
