

================================================================
== Vitis HLS Report for 'activation_accelerator_Pipeline_VITIS_LOOP_411_1'
================================================================
* Date:           Sun Oct 12 10:40:13 2025

* Version:        2022.2 (Build 3670227 on Oct 13 2022)
* Project:        activation_accelerator
* Solution:       baseline (Vivado IP Flow Target)
* Product family: zynquplus
* Target device:  xck26-sfvc784-2LV-c


================================================================
== Performance Estimates
================================================================
+ Timing: 
    * Summary: 
    +--------+----------+----------+------------+
    |  Clock |  Target  | Estimated| Uncertainty|
    +--------+----------+----------+------------+
    |ap_clk  |  10.00 ns|  7.300 ns|     2.70 ns|
    +--------+----------+----------+------------+

+ Latency: 
    * Summary: 
    +---------+---------+----------+----------+-------+-------+---------+
    |  Latency (cycles) |  Latency (absolute) |    Interval   | Pipeline|
    |   min   |   max   |    min   |    max   |  min  |  max  |   Type  |
    +---------+---------+----------+----------+-------+-------+---------+
    |    32771|    32771|  0.328 ms|  0.328 ms|  32771|  32771|       no|
    +---------+---------+----------+----------+-------+-------+---------+

    + Detail: 
        * Instance: 
        N/A

        * Loop: 
        +--------------------+---------+---------+----------+-----------+-----------+-------+----------+
        |                    |  Latency (cycles) | Iteration|  Initiation Interval  |  Trip |          |
        |      Loop Name     |   min   |   max   |  Latency |  achieved |   target  | Count | Pipelined|
        +--------------------+---------+---------+----------+-----------+-----------+-------+----------+
        |- VITIS_LOOP_411_1  |    32769|    32769|         3|          1|          1|  32768|       yes|
        +--------------------+---------+---------+----------+-----------+-----------+-------+----------+

============================================================
+ Verbose Summary: Synthesis Manager
============================================================
InlineROM: 1
ExposeGlobal: 0
============================================================
+ Verbose Summary: CDFG Model
============================================================
IsTopModel: 0
ResetActiveHigh: 1
IsCombinational: 0
IsDatapathOnly: 0
HasWiredReturn: 1
HasMFsm: 2
HasVarLatency: 1
IsPipeline: 0
IsRtlPipelined: 0
IsInstanceOverlapped: 0
IsDontTouch: 0
HasImplIP: 0
IsGatedGlobalClock: 0

+ Individual pipeline summary: 
  * Pipeline-0: initiation interval (II) = 1, depth = 3


============================================================
+ Verbose Summary: Schedule
============================================================
* Number of FSM states : 3
* Pipeline : 1
  Pipeline-0 : II = 1, D = 3, States = { 1 2 3 }
* Dataflow Pipeline: 0

* FSM state transitions: 
1 --> 2 
2 --> 3 
3 --> 

* FSM state operations: 

State 1 <SV = 0> <Delay = 1.52>
ST_1 : Operation 6 [1/1] (0.00ns)   --->   "%i = alloca i32 1"   --->   Operation 6 'alloca' 'i' <Predicate = true> <Delay = 0.00>
ST_1 : Operation 7 [1/1] (0.00ns)   --->   "%sext_ln411_read = read i63 @_ssdm_op_Read.ap_auto.i63, i63 %sext_ln411"   --->   Operation 7 'read' 'sext_ln411_read' <Predicate = true> <Delay = 0.00>
ST_1 : Operation 8 [1/1] (0.00ns)   --->   "%sext_ln411_cast = sext i63 %sext_ln411_read"   --->   Operation 8 'sext' 'sext_ln411_cast' <Predicate = true> <Delay = 0.00>
ST_1 : Operation 9 [1/1] (0.00ns)   --->   "%specinterface_ln0 = specinterface void @_ssdm_op_SpecInterface, i16 %gmem0, void @empty_33, i32 0, i32 0, void @empty_8, i32 0, i32 32768, void @empty_13, void @empty_14, void @empty_8, i32 16, i32 16, i32 16, i32 16, void @empty_8, void @empty_8, i32 4294967295, i32 0"   --->   Operation 9 'specinterface' 'specinterface_ln0' <Predicate = true> <Delay = 0.00>
ST_1 : Operation 10 [1/1] (0.42ns)   --->   "%store_ln0 = store i16 0, i16 %i"   --->   Operation 10 'store' 'store_ln0' <Predicate = true> <Delay = 0.42>
ST_1 : Operation 11 [1/1] (0.00ns)   --->   "%br_ln0 = br void %for.inc"   --->   Operation 11 'br' 'br_ln0' <Predicate = true> <Delay = 0.00>
ST_1 : Operation 12 [1/1] (0.00ns)   --->   "%i_4 = load i16 %i" [activation_accelerator.cpp:411]   --->   Operation 12 'load' 'i_4' <Predicate = true> <Delay = 0.00>
ST_1 : Operation 13 [1/1] (0.00ns)   --->   "%specbitsmap_ln0 = specbitsmap void @_ssdm_op_SpecBitsMap, i16 %gmem0"   --->   Operation 13 'specbitsmap' 'specbitsmap_ln0' <Predicate = true> <Delay = 0.00>
ST_1 : Operation 14 [1/1] (0.00ns)   --->   "%gmem0_addr = getelementptr i16 %gmem0, i64 %sext_ln411_cast" [activation_accelerator.cpp:411]   --->   Operation 14 'getelementptr' 'gmem0_addr' <Predicate = true> <Delay = 0.00>
ST_1 : Operation 15 [1/1] (0.00ns)   --->   "%specpipeline_ln0 = specpipeline void @_ssdm_op_SpecPipeline, i32 4294967295, i32 0, i32 1, i32 0, void @p_str"   --->   Operation 15 'specpipeline' 'specpipeline_ln0' <Predicate = true> <Delay = 0.00>
ST_1 : Operation 16 [1/1] (1.10ns)   --->   "%icmp_ln411 = icmp_eq  i16 %i_4, i16 32768" [activation_accelerator.cpp:411]   --->   Operation 16 'icmp' 'icmp_ln411' <Predicate = true> <Delay = 1.10> <CoreInst = "Cmp">   --->   Core 9 'Cmp' <Latency = 0> <II = 1> <Delay = 1.10> <FuncUnit> <Opcode : 'icmp'> <InPorts = 2> <OutPorts = 1>
ST_1 : Operation 17 [1/1] (0.00ns)   --->   "%empty = speclooptripcount i32 @_ssdm_op_SpecLoopTripCount, i64 32768, i64 32768, i64 32768"   --->   Operation 17 'speclooptripcount' 'empty' <Predicate = true> <Delay = 0.00>
ST_1 : Operation 18 [1/1] (0.85ns)   --->   "%add_ln411 = add i16 %i_4, i16 1" [activation_accelerator.cpp:411]   --->   Operation 18 'add' 'add_ln411' <Predicate = true> <Delay = 0.85> <CoreInst = "Adder">   --->   Core 1 'Adder' <Latency = 0> <II = 1> <Delay = 0.85> <FuncUnit> <Opcode : 'add' 'sub'> <InPorts = 2> <OutPorts = 1>
ST_1 : Operation 19 [1/1] (0.00ns)   --->   "%br_ln411 = br i1 %icmp_ln411, void %for.inc.split, void %VITIS_LOOP_414_2.exitStub" [activation_accelerator.cpp:411]   --->   Operation 19 'br' 'br_ln411' <Predicate = true> <Delay = 0.00>
ST_1 : Operation 20 [1/1] (0.42ns)   --->   "%store_ln411 = store i16 %add_ln411, i16 %i" [activation_accelerator.cpp:411]   --->   Operation 20 'store' 'store_ln411' <Predicate = (!icmp_ln411)> <Delay = 0.42>

State 2 <SV = 1> <Delay = 7.30>
ST_2 : Operation 21 [1/1] (7.30ns)   --->   "%gmem0_addr_read = read i16 @_ssdm_op_Read.m_axi.p1i16, i16 %gmem0_addr" [activation_accelerator.cpp:412]   --->   Operation 21 'read' 'gmem0_addr_read' <Predicate = true> <Delay = 7.30> <CoreInst = "m_axi">   --->   Core 121 'm_axi' <Latency = 0> <II = 1> <Delay = 1.00> <Adapter> <Opcode : 'read' 'write' 'readreq' 'writereq' 'writeresp'>
ST_2 : Operation 27 [1/1] (0.00ns)   --->   "%ret_ln0 = ret"   --->   Operation 27 'ret' 'ret_ln0' <Predicate = (icmp_ln411)> <Delay = 0.00>

State 3 <SV = 2> <Delay = 1.23>
ST_3 : Operation 22 [1/1] (0.00ns)   --->   "%i_cast = zext i16 %i_4" [activation_accelerator.cpp:411]   --->   Operation 22 'zext' 'i_cast' <Predicate = true> <Delay = 0.00>
ST_3 : Operation 23 [1/1] (0.00ns)   --->   "%specloopname_ln411 = specloopname void @_ssdm_op_SpecLoopName, void @empty_29" [activation_accelerator.cpp:411]   --->   Operation 23 'specloopname' 'specloopname_ln411' <Predicate = true> <Delay = 0.00>
ST_3 : Operation 24 [1/1] (0.00ns)   --->   "%buf0_addr = getelementptr i16 %buf0, i64 0, i64 %i_cast" [activation_accelerator.cpp:412]   --->   Operation 24 'getelementptr' 'buf0_addr' <Predicate = true> <Delay = 0.00>
ST_3 : Operation 25 [1/1] (1.23ns)   --->   "%store_ln412 = store i16 %gmem0_addr_read, i15 %buf0_addr" [activation_accelerator.cpp:412]   --->   Operation 25 'store' 'store_ln412' <Predicate = true> <Delay = 1.23> <CoreInst = "RAM">   --->   Core 83 'RAM' <Latency = 1> <II = 1> <Delay = 1.23> <Storage> <Opcode : 'load' 'store'> <Ports = 2> <Width = 16> <Depth = 32768> <RAM>
ST_3 : Operation 26 [1/1] (0.00ns)   --->   "%br_ln411 = br void %for.inc" [activation_accelerator.cpp:411]   --->   Operation 26 'br' 'br_ln411' <Predicate = true> <Delay = 0.00>


============================================================
+ Verbose Summary: Timing violations
============================================================
Target clock period: 10ns, clock uncertainty: 2.7ns.

 <State 1>: 1.53ns
The critical path consists of the following:
	'alloca' operation ('i') [4]  (0 ns)
	'load' operation ('i', activation_accelerator.cpp:411) on local variable 'i' [11]  (0 ns)
	'add' operation ('add_ln411', activation_accelerator.cpp:411) [17]  (0.853 ns)
	'store' operation ('store_ln411', activation_accelerator.cpp:411) of variable 'add_ln411', activation_accelerator.cpp:411 on local variable 'i' [25]  (0.427 ns)
	blocking operation 0.249 ns on control path)

 <State 2>: 7.3ns
The critical path consists of the following:
	bus read operation ('gmem0_addr_read', activation_accelerator.cpp:412) on port 'gmem0' (activation_accelerator.cpp:412) [22]  (7.3 ns)

 <State 3>: 1.24ns
The critical path consists of the following:
	'getelementptr' operation ('buf0_addr', activation_accelerator.cpp:412) [23]  (0 ns)
	'store' operation ('store_ln412', activation_accelerator.cpp:412) of variable 'gmem0_addr_read', activation_accelerator.cpp:412 on array 'buf0' [24]  (1.24 ns)


============================================================
+ Verbose Summary: Binding
============================================================
N/A
* FSMD analyzer results:
  - Output states:
 - Input state : 
  - Chain level:
	State 1
	State 2
	State 3


============================================================
+ Verbose Summary: Datapath Resource usage 
============================================================
N/A
