

================================================================
== Vitis HLS Report for 'activation_accelerator_Pipeline_VITIS_LOOP_731_2'
================================================================
* Date:           Tue Oct 14 11:16:47 2025

* Version:        2022.2 (Build 3670227 on Oct 13 2022)
* Project:        activation_accelerator
* Solution:       baseline (Vivado IP Flow Target)
* Product family: zynquplus
* Target device:  xck26-sfvc784-2LV-c


================================================================
== Performance Estimates
================================================================
+ Timing: 
    * Summary: 
    +--------+----------+----------+------------+
    |  Clock |  Target  | Estimated| Uncertainty|
    +--------+----------+----------+------------+
    |ap_clk  |  10.00 ns|  7.300 ns|     2.70 ns|
    +--------+----------+----------+------------+

+ Latency: 
    * Summary: 
    +---------+---------+----------+----------+-------+-------+---------+
    |  Latency (cycles) |  Latency (absolute) |    Interval   | Pipeline|
    |   min   |   max   |    min   |    max   |  min  |  max  |   Type  |
    +---------+---------+----------+----------+-------+-------+---------+
    |    49155|    49155|  0.492 ms|  0.492 ms|  49155|  49155|       no|
    +---------+---------+----------+----------+-------+-------+---------+

    + Detail: 
        * Instance: 
        N/A

        * Loop: 
        +--------------------+---------+---------+----------+-----------+-----------+-------+----------+
        |                    |  Latency (cycles) | Iteration|  Initiation Interval  |  Trip |          |
        |      Loop Name     |   min   |   max   |  Latency |  achieved |   target  | Count | Pipelined|
        +--------------------+---------+---------+----------+-----------+-----------+-------+----------+
        |- VITIS_LOOP_731_2  |    49153|    49153|         3|          1|          1|  49152|       yes|
        +--------------------+---------+---------+----------+-----------+-----------+-------+----------+

============================================================
+ Verbose Summary: Synthesis Manager
============================================================
InlineROM: 1
ExposeGlobal: 0
============================================================
+ Verbose Summary: CDFG Model
============================================================
IsTopModel: 0
ResetActiveHigh: 1
IsCombinational: 0
IsDatapathOnly: 0
HasWiredReturn: 1
HasMFsm: 2
HasVarLatency: 1
IsPipeline: 0
IsRtlPipelined: 0
IsInstanceOverlapped: 0
IsDontTouch: 0
HasImplIP: 0
IsGatedGlobalClock: 0

+ Individual pipeline summary: 
  * Pipeline-0: initiation interval (II) = 1, depth = 3


============================================================
+ Verbose Summary: Schedule
============================================================
* Number of FSM states : 3
* Pipeline : 1
  Pipeline-0 : II = 1, D = 3, States = { 1 2 3 }
* Dataflow Pipeline: 0

* FSM state transitions: 
1 --> 2 
2 --> 3 
3 --> 

* FSM state operations: 

State 1 <SV = 0> <Delay = 1.52>
ST_1 : Operation 6 [1/1] (0.00ns)   --->   "%i = alloca i32 1"   --->   Operation 6 'alloca' 'i' <Predicate = true> <Delay = 0.00>
ST_1 : Operation 7 [1/1] (0.00ns)   --->   "%sext_ln731_read = read i63 @_ssdm_op_Read.ap_auto.i63, i63 %sext_ln731"   --->   Operation 7 'read' 'sext_ln731_read' <Predicate = true> <Delay = 0.00>
ST_1 : Operation 8 [1/1] (0.00ns)   --->   "%sext_ln731_cast = sext i63 %sext_ln731_read"   --->   Operation 8 'sext' 'sext_ln731_cast' <Predicate = true> <Delay = 0.00>
ST_1 : Operation 9 [1/1] (0.00ns)   --->   "%specinterface_ln0 = specinterface void @_ssdm_op_SpecInterface, i16 %gmem1, void @empty_11, i32 0, i32 0, void @empty_12, i32 0, i32 49152, void @empty_4, void @empty_14, void @empty_12, i32 16, i32 16, i32 16, i32 16, void @empty_12, void @empty_12, i32 4294967295, i32 0"   --->   Operation 9 'specinterface' 'specinterface_ln0' <Predicate = true> <Delay = 0.00>
ST_1 : Operation 10 [1/1] (0.42ns)   --->   "%store_ln0 = store i16 0, i16 %i"   --->   Operation 10 'store' 'store_ln0' <Predicate = true> <Delay = 0.42>
ST_1 : Operation 11 [1/1] (0.00ns)   --->   "%br_ln0 = br void %for.inc13"   --->   Operation 11 'br' 'br_ln0' <Predicate = true> <Delay = 0.00>
ST_1 : Operation 12 [1/1] (0.00ns)   --->   "%i_3 = load i16 %i" [activation_accelerator.cpp:731]   --->   Operation 12 'load' 'i_3' <Predicate = true> <Delay = 0.00>
ST_1 : Operation 13 [1/1] (0.00ns)   --->   "%specbitsmap_ln0 = specbitsmap void @_ssdm_op_SpecBitsMap, i16 %gmem1"   --->   Operation 13 'specbitsmap' 'specbitsmap_ln0' <Predicate = true> <Delay = 0.00>
ST_1 : Operation 14 [1/1] (0.00ns)   --->   "%gmem1_addr = getelementptr i16 %gmem1, i64 %sext_ln731_cast" [activation_accelerator.cpp:731]   --->   Operation 14 'getelementptr' 'gmem1_addr' <Predicate = true> <Delay = 0.00>
ST_1 : Operation 15 [1/1] (0.00ns)   --->   "%specpipeline_ln0 = specpipeline void @_ssdm_op_SpecPipeline, i32 4294967295, i32 0, i32 1, i32 0, void @p_str"   --->   Operation 15 'specpipeline' 'specpipeline_ln0' <Predicate = true> <Delay = 0.00>
ST_1 : Operation 16 [1/1] (1.10ns)   --->   "%icmp_ln731 = icmp_eq  i16 %i_3, i16 49152" [activation_accelerator.cpp:731]   --->   Operation 16 'icmp' 'icmp_ln731' <Predicate = true> <Delay = 1.10> <CoreInst = "Cmp">   --->   Core 9 'Cmp' <Latency = 0> <II = 1> <Delay = 1.10> <FuncUnit> <Opcode : 'icmp'> <InPorts = 2> <OutPorts = 1>
ST_1 : Operation 17 [1/1] (0.00ns)   --->   "%empty = speclooptripcount i32 @_ssdm_op_SpecLoopTripCount, i64 49152, i64 49152, i64 49152"   --->   Operation 17 'speclooptripcount' 'empty' <Predicate = true> <Delay = 0.00>
ST_1 : Operation 18 [1/1] (0.85ns)   --->   "%add_ln731 = add i16 %i_3, i16 1" [activation_accelerator.cpp:731]   --->   Operation 18 'add' 'add_ln731' <Predicate = true> <Delay = 0.85> <CoreInst = "Adder">   --->   Core 1 'Adder' <Latency = 0> <II = 1> <Delay = 0.85> <FuncUnit> <Opcode : 'add' 'sub'> <InPorts = 2> <OutPorts = 1>
ST_1 : Operation 19 [1/1] (0.00ns)   --->   "%br_ln731 = br i1 %icmp_ln731, void %for.inc13.split, void %if.end90.loopexit.exitStub" [activation_accelerator.cpp:731]   --->   Operation 19 'br' 'br_ln731' <Predicate = true> <Delay = 0.00>
ST_1 : Operation 20 [1/1] (0.42ns)   --->   "%store_ln731 = store i16 %add_ln731, i16 %i" [activation_accelerator.cpp:731]   --->   Operation 20 'store' 'store_ln731' <Predicate = (!icmp_ln731)> <Delay = 0.42>

State 2 <SV = 1> <Delay = 7.30>
ST_2 : Operation 21 [1/1] (7.30ns)   --->   "%gmem1_addr_read = read i16 @_ssdm_op_Read.m_axi.p1i16, i16 %gmem1_addr" [activation_accelerator.cpp:732]   --->   Operation 21 'read' 'gmem1_addr_read' <Predicate = true> <Delay = 7.30> <CoreInst = "m_axi">   --->   Core 121 'm_axi' <Latency = 0> <II = 1> <Delay = 1.00> <Adapter> <Opcode : 'read' 'write' 'readreq' 'writereq' 'writeresp'>
ST_2 : Operation 27 [1/1] (0.00ns)   --->   "%ret_ln0 = ret"   --->   Operation 27 'ret' 'ret_ln0' <Predicate = (icmp_ln731)> <Delay = 0.00>

State 3 <SV = 2> <Delay = 1.23>
ST_3 : Operation 22 [1/1] (0.00ns)   --->   "%i_14_cast = zext i16 %i_3" [activation_accelerator.cpp:731]   --->   Operation 22 'zext' 'i_14_cast' <Predicate = true> <Delay = 0.00>
ST_3 : Operation 23 [1/1] (0.00ns)   --->   "%specloopname_ln731 = specloopname void @_ssdm_op_SpecLoopName, void @empty_0" [activation_accelerator.cpp:731]   --->   Operation 23 'specloopname' 'specloopname_ln731' <Predicate = true> <Delay = 0.00>
ST_3 : Operation 24 [1/1] (0.00ns)   --->   "%buf1_addr = getelementptr i16 %buf1, i64 0, i64 %i_14_cast" [activation_accelerator.cpp:732]   --->   Operation 24 'getelementptr' 'buf1_addr' <Predicate = true> <Delay = 0.00>
ST_3 : Operation 25 [1/1] (1.23ns)   --->   "%store_ln732 = store i16 %gmem1_addr_read, i16 %buf1_addr" [activation_accelerator.cpp:732]   --->   Operation 25 'store' 'store_ln732' <Predicate = true> <Delay = 1.23> <CoreInst = "RAM">   --->   Core 83 'RAM' <Latency = 1> <II = 1> <Delay = 1.23> <Storage> <Opcode : 'load' 'store'> <Ports = 2> <Width = 16> <Depth = 49152> <RAM>
ST_3 : Operation 26 [1/1] (0.00ns)   --->   "%br_ln731 = br void %for.inc13" [activation_accelerator.cpp:731]   --->   Operation 26 'br' 'br_ln731' <Predicate = true> <Delay = 0.00>


============================================================
+ Verbose Summary: Timing violations
============================================================
Target clock period: 10ns, clock uncertainty: 2.7ns.

 <State 1>: 1.53ns
The critical path consists of the following:
	'alloca' operation ('i') [4]  (0 ns)
	'load' operation ('i', activation_accelerator.cpp:731) on local variable 'i' [11]  (0 ns)
	'add' operation ('add_ln731', activation_accelerator.cpp:731) [17]  (0.853 ns)
	'store' operation ('store_ln731', activation_accelerator.cpp:731) of variable 'add_ln731', activation_accelerator.cpp:731 on local variable 'i' [25]  (0.427 ns)
	blocking operation 0.249 ns on control path)

 <State 2>: 7.3ns
The critical path consists of the following:
	bus read operation ('gmem1_addr_read', activation_accelerator.cpp:732) on port 'gmem1' (activation_accelerator.cpp:732) [22]  (7.3 ns)

 <State 3>: 1.24ns
The critical path consists of the following:
	'getelementptr' operation ('buf1_addr', activation_accelerator.cpp:732) [23]  (0 ns)
	'store' operation ('store_ln732', activation_accelerator.cpp:732) of variable 'gmem1_addr_read', activation_accelerator.cpp:732 on array 'buf1' [24]  (1.24 ns)


============================================================
+ Verbose Summary: Binding
============================================================
N/A
* FSMD analyzer results:
  - Output states:
 - Input state : 
  - Chain level:
	State 1
	State 2
	State 3


============================================================
+ Verbose Summary: Datapath Resource usage 
============================================================
N/A
